Speaker ID,Speaker Name,Speaker Company,Text,Sentiment Label,Positive Score,Negative Score,Neutral Score
0,Operator,,[Operator Instructions] Our first question comes from the line of Steven Chubak with Wolfe Research.,neutral,0.042,0.0264,0.9316
27,Steven Joseph Chubak,,"Wanted to start things off with just a question on the NIR guidance, Emily, that you just gave. I was hoping just to unpack the guide for 4Q, specifically what you're assuming in terms of deposit and balance sheet growth; liquidity redeployment; and I guess, last and certainly not least, premium amortization.",neutral,0.0454,0.0266,0.9279
19,Emily Hope Portney,,"Sure. So just -- why don't we first just start with the third quarter. In the third quarter, NIR was down very, very modestly. That was off the back of lower reinvestment yields, also lower interest-earning assets as we worked with our clients to actually manage especially excess deposits. We were able to offset that with some tweaks in the securities portfolio. And also, we did see a benefit from premium amortization coming down that was both a mixture of us reducing the size of our MBS portfolio as well as the fact that prepayment speeds did slow down quarter-to-quarter. 
Our full year guide, as you just rightfully pointed out, remains at down 14% for the full year. In terms of kind of what's baked into the fourth quarter, look, I think we have more or less hit the trough. What's baked in there, certainly, we'll still have the impact of lower reinvestment yields as a headwind. We are expecting a further reduction in interest-earning assets because we will continue to work with our clients in terms of managing excess deposits. So perhaps we expected them to go down by about $5 billion to $10 billion. 
With respect to premium amortization, it's likely our expectation or forecast based on rates is that it will be pretty much flat fourth quarter to third quarter. And look, there's probably some upside. I mean certainly, based on what we're seeing in terms of volatility in rates and even some movements by, for example, the Bank of England, et cetera, so there could be some upside.",negative,0.0254,0.9367,0.0379
27,Steven Joseph Chubak,,"That's great color, Emily. And just for -- a follow-up on expenses. I was hoping you could speak to the expense growth outlook. We've seen a number of upward revisions to the expense guidance over the course of the year. And just wanted to gauge whether the current level of expense, it's about $2.85 billion ex the litigation cost, is the right jumping-off point for 4Q and maybe just longer term, what level of expense inflation we should be underwriting on a more normal basis just given the continued investments you cited in the business.",neutral,0.149,0.025,0.8259
19,Emily Hope Portney,,"Sure. So within the quarter -- so yes, expenses overall up 6%. We're still guiding for the full year expenses to be up 5% versus last year, obviously ex notables. When you unpack the third quarter, about 2/3 of that is attributable to what we call revenue-related expenses, inclusive of an uptick in higher incentives. We obviously want to pay our people competitively and for the strong organic growth that we are seeing. About 1/3 of that is split evenly between the impact of the weaker U.S. dollar as well as the incremental investments that we have pulled forward. 
So those are the investments in both -- in growth, in infrastructure as well as efficiency. We're also -- it's worth mentioning that in the third quarter, we are starting to see an impact of a tighter labor market, both in terms of competition and in terms of costs. And also, in the third quarter, there was an impact of a merit increase which took effect in June. 
As we kind of look out, it's certainly too early to really comment on 2022. We're in the middle of the planning process. What I would say is that yes, the uptick you're seeing in the second half of the year is really the jumping-off point for next year, and ultimately, there are other headwinds as well; inflation, as I just mentioned. 
Look, we're seeing, it's a good thing, but return to more normalized travel rates. So T&E is likely to go up. We're -- as we reopen the offices and return to the office, there'll be some additional expenses associated with that. Of course, we will continue to also achieve and identify efficiencies. We're working through the investment spend as we speak, going through the proverbial food fight because, as always, there's lots that we want to do. 
But what I would say is we are intensely focused on expense management. We will continue to be focused on expense management, but we're also going to invest through the cycle. And if I were to just give some color, I would just say that expenses in 2022, as I'm standing here today, will be modestly up from 2021.",positive,0.8065,0.0318,0.1617
0,Operator,,Our next question comes from the line of Mike Mayo with Wells Fargo Securities.,neutral,0.0311,0.036,0.9329
18,Michael Lawrence Mayo,,"Well, this is good timing because I wanted to follow up on the food fight, investment spend discussion. So software costs were up 8% year-over-year. And Todd, you started off talking about some fintech-like initiatives. And so I'm just wondering if maybe next year, you want to spend more money. I mean there's this tough trade-off that you have in delivering results and investing for what you think could be a good effort. 
I didn't fully understand when you're talking about Pershing and the transaction banking payments. So maybe if you could just describe the total addressable market for that, how much you have and where you think you're getting or some color around that and then what type of spending that's going to involve.",neutral,0.0937,0.0247,0.8816
17,Thomas P. Gibbons,,"Okay. So Pershing X is, I think, an exciting opportunity for us. And so if you think about the registered investment adviser business, so if you think about Pershing, we're really the largest correspondent clearer. So we're a third-party clearer for broker-dealers in the retail space and now registered investment adviser. And that business is actually growing, but it's not growing nearly as fast as the advisory space is growing. 
And so we are the custodian. We are the clearer. We are providing a lot of the back-end services for that business. But we think there's the opportunity for us to be an integrator in that business. So -- and it's been growing. I haven't looked at the numbers recently, but it's been growing in the ballpark of 15%. So we think that -- and we've got a relatively small market share for it -- of it, Mike. So we think there's an opportunity for us to pick up market share in a fast-growing segment. So that's why it's so exciting to us. 
In terms of the challenge that Pershing X will solve, if you think about it, advisers have these multiple technology tools, a bunch of different data sets that they're trying to integrate or trying to look at. Oftentimes, they're logging into multiple systems and they're really reducing the advisory productivity. And that would be across things like financial planning, investment modeling, even some banking activities. And we have the ability to integrate our own private bank. 
So there's really no solution out there today that can tie that all together. And so that's what we mean. It will be an open architected but an end-to-end solution. So we'll be integrating best-in-class services amongst some of our own, and it will provide a digital capability and real good retail experience both to the adviser as well as to the investor itself. So that's our target for Pershing. 
I think your other question was around the e-payments. So in e-payments, this is using The Clearinghouse's Real-Time Payment system, and we were the first to actually connect. And now this is a request for payment from a client -- excuse me, our client, so Verizon, to their customer. And they send -- it will come across your -- they'll come across your phone that your bill is ready. Here is your bill, press this and make the payment in real time or you can even -- you can set a time when you want to make that payment to make sure that you've got funds in your account. 
That will connect -- as more and more banks connect to the real-time payment system, that broadens the capability of covering a very large percentage of the market. Currently, there are about 15 billion payments made in the U.S., so it's an enormous market. We've got some -- we've got about 100 prospects showing significant interest in the capability we designed.",neutral,0.1001,0.0204,0.8794
18,Michael Lawrence Mayo,,"Okay. So e-payments, big initiative, big opportunity. Pershing X, if I heard you correctly, big market, big opportunity. So in terms of funding these initiatives, as far as investing in these areas specifically or more generally, I know you've done a lot of overhaul in the back office, a lot of overhaul with your tech talent. What sort of spending will this take? And should you be going faster or slower? Or how do you decide that?",neutral,0.0836,0.0166,0.8998
17,Thomas P. Gibbons,,"Yes. I mean we -- so as you know, we've been increasing our tech spend over the past few years. A lot of that, as you pointed out, was in infrastructure and resiliency and building a sounder infrastructure to support the growth that we're looking to drive today. And so kind of the peace dividend from that, we are reinvesting in a number of the -- in software and the app dev that we've talked about. 
So I kind of categorize it into 3 areas. One is we've talked about our initiatives. I mean we just talked on 2, Pershing and treasury, but we've got some very neat things going on in our Data & Analytics capability. We're digitizing things across the bank. The wealth platform, we continue to invest in for our own Wealth Management activity. Corporate Trust, we're using smart contracts and developing a digital network for our clients to operate on. In Investment Management, we're -- so just about across our businesses, we continue to invest in technology. 
There's also ongoing infrastructure and risk management. I mean our cyber defenses are not cheap, and we need to continue to invest in them. We're doing a significant number of cloud conversions, as I think through it, across the company. Regulatory reporting requirements continue to go up. There's a lot of liquidity requirements as well as complying with the LIBOR requirements. And we will always be focused on data and resiliency. 
And then on the efficiency side, there's -- we've actually inventoried the number of things that we do manually, and we're looking to knock them out for automating when it can create some significant efficiencies and risk reduction. And we're also looking to modernize some of our core apps. So even on our Treasury Services, we're putting very modern payments app -- engine underneath all of this. So there are a lot of -- the good news is there are a lot of opportunities, but it will come with some costs. And our intent is to increase our technology spend next year.",neutral,0.2404,0.0146,0.745
0,Operator,,Our next question comes from the line of Gerard Cassidy with RBC.,neutral,0.0309,0.0291,0.94
10,Gerard Sean Cassidy,,"Todd, can you -- or Emily, when I go back to the year-end 2019 pre-pandemic size of your balance sheet, you guys had assets about $382 billion and deposits of $259 billion, let's call it. And then you had deposits at the Fed of $95 billion. Obviously, today, it's considerably higher. 
When the Fed finishes quantitative easing, assuming it's finished by next summer, can you kind of frame out for us what you think your balance sheet might look like as we go forward? Are customers going to be pulling deposits out? Do you think it will shrink down? Not that you'll ever get to that year-end '19 level, but should we start to think about a continued falling on the size of the balance sheet?",negative,0.068,0.4976,0.4344
19,Emily Hope Portney,,"So I'm happy to take that, and Todd certainly can chime in. So the way we think about deposit levels now, we probably still have around 10% to 15% of our deposits are excess, and they will eventually recede in a more normalized rate environment. But actually, core deposits overall are also up just given the growth in AUC/A, et cetera. So I mean the core deposits are also up, but the excess is about 10% to 15%. And the way we've been looking at it is certainly we've been kind of managing the growth in those deposits very successfully, so kind of very -- in a targeted way, looking at what we deem to be excess and working with our clients to pursue off-balance-sheet alternatives for those particular balances. 
And as the Fed begins to taper, and we all think they will begin to taper soon, I think that does help in terms of kind of putting a lid to a degree on the growth of deposits from here. In terms of kind of what we expect kind of in -- I guess, kind of 2023 and beyond, yes, I think at the stage where the Fed actually hikes on multiple occasions, it's kind of only at that point that we would probably see a decline in deposits. But the core itself is higher than it was in the fourth quarter of 2019.",positive,0.4713,0.1939,0.3349
17,Thomas P. Gibbons,,"And Gerard, I think if my memory serves me right, that date was -- you were picking an end date. It was actually -- the averages were a little bit lower than that. So there is a significant amount of excess. It will start to -- and that's why we're sitting on so much cash at central banks. And we'll probably see a little less pressure certainly for deposit growth when the Fed starts to taper. But to Emily's point, the excess coming off is probably sometime thereafter.",neutral,0.0784,0.4355,0.4862
10,Gerard Sean Cassidy,,"Correct, Todd. They were period-end numbers. Good memory. 
The follow-up question, you guys had a very robust share repurchase amount this quarter, as Emily pointed out, of $2 billion, and there's guidance for the fourth quarter. The question is -- if I recall correctly, you have a $6 billion program that I think expires at the end of next year. If you reach the $6 billion prior to the termination date, would you consider re-upping -- assuming, of course, your capital ratios permitted, would you consider re-upping the buyback if you use it all up before that termination date?",neutral,0.1305,0.0498,0.8197
17,Thomas P. Gibbons,,"The answer -- Gerard, if you think about it, the stress capital buffer regime has actually made things a little more flexible for us. And so certainly, the Board recognizes that if we continue to produce the capital that we're likely to and we buy back the excess capital that we've accumulated, we'll be in a position to come back to them and ask for more. So the answer is yes.",positive,0.5174,0.02,0.4625
0,Operator,,Our next question comes from the line of Jim Mitchell with Seaport Research.,neutral,0.0349,0.0297,0.9354
32,James Francis Mitchell,,"Maybe just one on issuer service fees. They were flat sequentially. And typically, you'd have some seasonality. I think you mentioned some weakness in -- on the corporate side -- Corporate Trust side. Is that just pushed out? Should we expect some rebound in 4Q? Just how do we think about the trajectory in that business? And any more detail on the quarter would be great.",neutral,0.144,0.0743,0.7817
19,Emily Hope Portney,,"Sure. So in the Issuer Services, you really do have 2 businesses: Depositary Receipts and Corporate Trust, as you point out. Within DR, we definitely saw a resumption in both issuance and dividend activity, and that was really even on top of the normal uptick that we see in the third quarter. 
In Corporate Trust, the underlying business actually is performing really well. Volumes in structured products are up actually meaningfully, slightly offsetting a small decline in activity in munis. But the third quarter for Corporate Trust, there were really 2 things that also impacted revenue. 
So one was a decline in reimbursable expenses. We've got reimbursable expenses that are just a pass-through. And ultimately, so that impacts revenue, does not have any impact whatsoever on PTI. And also, there was a discontinuation of a public sector mandate that started in this quarter, and you'll -- we'll see the full effect of that in the next -- in the fourth quarter, will probably be another $10 million or so decline.",negative,0.0719,0.8755,0.0526
32,James Francis Mitchell,,Okay. And -- but no -- nothing got pushed into 4Q? It just was those issues.,neutral,0.0373,0.1383,0.8244
19,Emily Hope Portney,,Yes.,neutral,0.1082,0.0226,0.8692
32,James Francis Mitchell,,"Okay. And just maybe on the payments business. I think it's kind of an interesting push. You've already had some growth in Treasury Services. So maybe you could just talk a little bit of what's been driving the accelerating growth of late. I think it's a little too early to be expecting anything from these new initiatives. 
And then I guess, as we think about the new initiatives, like this Verizon deal and others potentially, is that a first-mover advantage type thing? I guess how do you defend being the intermediary between the merchants and the banks? Is it just simply being the first-mover advantage? And what do you think the possibility from a revenue standpoint could be from that business?",neutral,0.0686,0.0251,0.9063
17,Thomas P. Gibbons,,"Yes. I mean this is -- so a couple of things there. So effectively, what we're doing is we're digitizing the collection experience. So we've been in the lockbox business, and now we're converting that to electronic for these requests for payments. And it is faster and cheaper for the provider, so the cost actually -- for the utility in this case. So the cost to them on a per-unit basis is down dramatically, and you also reduce float and other items. So we think it's hugely to their advantage. 
So we happen to have the collection relationship. And we can continue this -- paper is not going away. That's going to be a component of it. So we can provide the complete solution, so we just thought we happen to be in a very nice position to do this. And we're not in the card or retail payments business to speak of in between it. So we happen to be very well positioned, and we got a little bit of a first-mover advantage by being into The Clearinghouse's Real-Time Payments system right away. 
In terms of how big can this grow, it could possibly move the needle a little bit and add a little something to our organic growth. I think it's a little too early to tell. We're excited about the relationship that we've got with Verizon. We're excited that this certainly stirred up a lot of interest. And we've got a pretty reasonable pipeline, but I just prefer at this point not to speculate on what that could be right now.",neutral,0.3138,0.0576,0.6286
0,Operator,,Our next question comes from the line of Brennan Hawken with UBS.,neutral,0.0311,0.0338,0.9351
6,Brennan Hawken,,"Would like to explore the really robust core fee revenue growth that you guys have seen here. Todd, you made reference to a nearly 3% organic growth rate in the quarter, which is really quite good. So is it possible to break down the year-to-date or your expectations for 2021 into different components, how much of it came, you think, from organic, how much activity and volume related? 
I seem to recall that in the past, you've said that half of your servicing business is market-sensitive. So is that still the right way to calibrate when we think about the market impact or pricing dynamics? Is it possible to give some color around the composition?",neutral,0.0807,0.0204,0.8989
17,Thomas P. Gibbons,,"Sure. Sure, Brennan. So I think first of all, we should probably help you understand what we're describing as organic. So we do try to take the market impact out for interest rates and the equity markets. We also try to adjust, for example, for some of the unusual activity that came -- for example, right now, money market funds are very large because of all this excess cash. Deposits are very large because of this excess cash. So we're trying to knock that growth out of the calculation. 
And when we get -- when we knock all of that out, you look at us growing -- our revenue growth minus fee waivers is significantly higher than what we're talking about in terms of our organic growth because that's getting the benefit of some of the market considerations. So our -- once you knock all of that out, the numbers get to something like 2.5% or so for this year, which is much stronger than what we've seen in years past. And frankly, 3 years ago, it was probably 0, maybe even slightly negative. 
Emily, you want to kind of march through some of the areas where we're actually seeing it?",neutral,0.1583,0.0445,0.7972
19,Emily Hope Portney,,"In organic -- sure. I mean the -- and just to really break it down very clearly. So the 11% in fee growth ex waivers we saw this quarter year-on-year, 3% was organic growth, as Todd alluded to. About 6% of that was just market -- was market impact, and the remainder was just impact of a weaker U.S. dollar. 
In terms of the organic growth in that 3%, it was really broad-based. So when you look at Pershing, I think we talked a bit about continued growth in clearing accounts, mutual fund balances and net new assets. In terms of Treasury Services, we saw good growth in terms of payment activity and on the back of both stronger economic -- a stronger macroeconomic backdrop but also net new business. And also, within Treasury Services, we've really shifted the product mix to be higher margin in that business. 
In Asset Servicing, wins are up 40% year-to-date versus what they were last year. So that, too, is just speaking to the organic growth in that business. In FX, volumes were up significantly. And some of that's market, but a lot of that, too, is just based on investments in the FX platform that we've made. So it's really broad-based and strong.",positive,0.7375,0.0222,0.2403
6,Brennan Hawken,,"Excellent. And Emily, I'd like to explore some of your -- I know it's very early to talk about 2022, but the expectation around expenses next year, a few questions on that. Would that modest growth be on a constant-currency basis? 
And when we calibrate -- I think you also had said that the back half of '21 is a decent base in which to build off of. Is that excluding the litigation that you guys had? And if so, could you size that for us? And when we think about modest, is there any way to calibrate that? Like would you consider the 2021 expense growth to be modest? Or is it a bit more significant than that?",neutral,0.0748,0.0193,0.9058
19,Emily Hope Portney,,"So in terms of -- it's a bit early to really comment on 2022. We're obviously going through the entire planning process as we speak. As I did mention earlier, the uplift in expenses that you're seeing in the second half of this year on the back of the investments that we are making is structural, so that -- those are permanent and that really will be baked into next year. 
As I also mentioned, there are some headwinds. We're starting to see a bit of inflationary pressure. Like I said, we're going to return to more kind of normalized, we think, travel, and so T&E will likely go up; a bit of extra expense associated with return to the office. So there are headwinds that of course, we're going to be looking to offset with efficiencies. So I wouldn't want to put an actual number on it, but at this moment, I would say expenses for the full year next year will be modestly up. And that's just on a top line basis. They will be modestly up versus this year.",positive,0.6851,0.2372,0.0777
17,Thomas P. Gibbons,,"And Brennan, we would adjust for the litigation reserve so we wouldn't consider that part of the base.",neutral,0.0359,0.0304,0.9337
19,Emily Hope Portney,,"Yes, on a nonoperating basis (sic) [ on an operating basis ]. I should have said that, sorry.",neutral,0.0501,0.246,0.7039
6,Brennan Hawken,,Got it. And I know FX -- should FX be a tailwind for you guys next year? Just to follow up on that because I know it was a headwind this year.,negative,0.0568,0.6102,0.333
19,Emily Hope Portney,,It depends.,neutral,0.0477,0.0826,0.8697
17,Thomas P. Gibbons,,"It depends on where we go out. Right now, the dollar is showing a little bit of strength, which would create an expense tailwind, but it would be neutral to our pretax.",neutral,0.1835,0.2017,0.6149
0,Operator,,Our next question comes from the line of Ken Usdin with Jefferies.,neutral,0.0346,0.0279,0.9375
12,Kenneth Michael Usdin,,I wanted to start by just asking you to talk a little bit more about Asset Servicing. It had really good underlying growth if we just keep lending aside and fee waivers aside. And the deck mentions transaction activity and higher market levels. I'm just wondering if you can help us understand. Like how did the collateral business act versus how did the core Asset Servicing act? And what type of net new wins quarter did you see on both sides?,neutral,0.1129,0.0233,0.8637
