Speaker ID,Speaker Name,Speaker Company,Text,Sentiment Label,Positive Score,Negative Score,Neutral Score
0,Operator,,[Operator Instructions] We will now take our first question from Brennan Hawken from UBS.,neutral,0.0383,0.0236,0.9381
6,Brennan Hawken,,"First, Todd, congrats on your pending retirement and Robin, congrats on the new role. I look forward to working closer with you. Before a question though for Robin, I'd love to drill down a little bit Emily on what you talked about. More tactically around the actions you've taken with the balance sheet to reduce the AOCI sensitivity. Could you maybe expand on that a bit and touch on some of the specific actions in greater detail and what impact we could expect on the outlook for NIR and how that might inform your updated expectation?",neutral,0.1142,0.0136,0.8722
19,Emily Hope Portney,,"So Brennan, I'm just taking a quick step back, I do want to do a shout-out to our CIO because I think that came really did -- do a great job in terms of both optimizing NIR but also protecting against AOCI volatility during the quarter. As I mentioned in my prepared remarks and I'll give a bit more color, we shortened the duration of AFS portion of the portfolio. It's now a little over 1.5 years, down from more than 2 years at the end of last quarter. We've transferred longer-dated securities to HTM. You'll notice that HTM now as a proportion of the securities portfolio is about 40%. That's up from about 36% at the end of last year. We've also reduced convexity and credit risk in the portfolio. 
And so all of these things, I mean, we did -- obviously, there was a reduction in AOCI of $1.5 billion during the quarter, but it would have been larger if had we not taken these actions. And as you rightfully point out, these actions have also made us a lot less sensitive to rising rates going forward. And as I also, I think, mentioned, we've reduced -- just to put a finer point on it. we've reduced DV01 in the AFS portfolio in excess of 25% just through the actions that we carried out this quarter. So as you can tell, we've been managing the portfolio very actively, we'll continue to monitor it and be very nimble.",negative,0.3414,0.5293,0.1293
6,Brennan Hawken,,"Great. Robin, maybe one for you. Stepping back and widening out here. Understand that you've just been named to the job. But you're not new to Bank of New York, for sure. So at this point, can you provide any details or plans about your goals or targets? Or maybe at least like a road map for when we could expect to hear more from you about your goals and your plans?",neutral,0.0804,0.0133,0.9062
24,Robin Antony Vince,,"Sure. Brennan, and I appreciate the comment and the question. So you're right. I'm not completely new to the firm, which is certainly an advantage for me in coming in and taking on the role. But I will say that I'm being very diligent, as Todd referred to earlier on in his comments about the transition. And so we're working very closely together. And I don't want to be complacent about the fact that there's a great opportunity for a CEO-elect to have the opportunity to come in and to really benefit from a transition. 
Having said all of that, when I joined the firm, I was really struck by the breadth of the franchise. I mean, 93% of the world's top investment managers or clients of ours -- as are 97% of the world's top 100 banks. And that breadth, coupled with the depth of the franchise, that real client trust that we've talked about before is a super powerful foundation. And so job #1 for me is to really build on that. And that's been an investment that Todd has been very focused on during his time as CEO. 
Now what I also would reflect on is some of the things that I've been focused on in the Market and Wealth Services businesses. And the first of those is innovation. You've seen that we've launched Pershing X. We've been very focused on real-time payments in the Treasury Services space. And that concept of really driving innovation across the enterprise is another important pillar of how I think about the firm and the opportunity that's ahead of us. 
Another thing that we've been doing in that segment, which I'm very excited about across the company is really deepening the wallet, connecting the dots across the firm, helping clients that are existing clients of the firm to do more with us. And that whole ethos of ONE BNY Mellon, I think is a real important and deep vein for us to continue to mine. 
And then the last point that I mention is operating leverage and focus on margins. In that segment, we had a 41% margin in the first quarter and having run operational businesses in the past. I'm very focused on operating leverage, and that will continue to be a focus of mine along with these other pillars. So that's how I'm thinking about the world. But I'd just remind you that I'm still in the transition and enjoying working with Todd, and we're already focused on making this a smooth and effective handover.",neutral,0.2034,0.0137,0.7829
0,Operator,,We will now take our next question from Mike Mayo from Wells Fargo.,neutral,0.0332,0.0383,0.9285
18,Michael Lawrence Mayo,,"Well, what I was going to ask you, Robin, I asked that at the shareholder meeting, but maybe just a little bit more about your  background. I just say that when Northern changed their CEO, they said ""The old CEO is more about marketing and I'm more about numbers"". When State Street changed, their CEO, they said, ""Well, the new CEO was more about understanding asset management and their clients."" Anything else -- since we don't know you as well as Todd, who's been there for in his fourth decade, anything else about your background that you could share that could give investors confidence as you are about to enter the CEO role in several months.",neutral,0.0702,0.0187,0.9111
24,Robin Antony Vince,,"Sure, Mike. Well, I'm all about being a great all-around CEO. But to answer the sort of question a bit more directly in terms of my background, I feel like I've been prepared for this role over the course of my career. I started off in the markets business, and I ran the money markets business at my prior organization, which was a great opportunity to really get into the markets, capital markets, interest rates and really the client franchise. 
And of course, a lot of those same clients are clients of ours and so that was a great formative start for me. I ran operations at my prior firm. I was a Treasurer. I was the Chief Risk Officer. I was the CEO of the International Bank. I operated internationally. And so when I put all of that together, I think it really gives me the opportunity having touched a lot of different aspects of our franchise and our activities to really bring all of that to bear in the role going forward. And I'm very excited about that. And as I joined the firm, I commented before, I've been struck by a few things, including the depth and breadth of the franchise, but also the culture of the firm. And I think that there's a lot of opportunity for us, and I'm excited to have at it.",neutral,0.1535,0.0184,0.8282
18,Michael Lawrence Mayo,,"And so to summarize, you kind of want to have like ONE BNY Mellon and improve the wallet share. And hopefully, I'm not sure if you guys can gives us now. I don't think so, Todd. There's not too many firms that do it. But what's your market share by large client, where was it a few years ago? And where do you hope it to be? Do you have any metrics around that? Or do you think we can get that in the future?",neutral,0.2179,0.0111,0.771
17,Thomas P. Gibbons,,"Yes. We haven't disclosed that publicly, but what I would say is we have grown with our clients, and we have continued to increase market share with our largest clients over the past couple of years especially in our servicing business -- our Asset Servicing business. And I think some of the stats that we even did disclose this morning that Emily mentioned. We retained 90 -- actually, I mentioned that. We retained 97% of all of the business that we rebid on, which is an enormously high number. And we've got some capabilities, I mean, the investments that we've made in service quality. And some of that is in some of the technology that we've got around that, keeping us much closer to our clients, much better informed, much more responsive. 
The investments that we've made in our data management and data analytics, where I think we are the leader, not only in the servicing capabilities, but also the fact that we can -- we've got the ability to bundle all of the back-office services not just custody and accounting and administration. But TA as well as a differentiator. So I think we are seeing increased market share. I haven't disclosed it specifically against the major clients. But I think the fact that we are with just about every one of the major clients which have reflects that.",positive,0.6514,0.0124,0.3362
0,Operator,,We will now take our next question from Ken Usdin from Jefferies.,neutral,0.0333,0.0315,0.9352
12,Kenneth Michael Usdin,,"Emily, I wanted to ask you a little bit on net interest income and some of the changes that you're referencing. So I guess to start, can you help us understand your point about historical reference of deposits versus QT or rates environment. We saw the positives come down this quarter. Can you tell us what you're expecting to see out of the balance sheet going forward?",neutral,0.0987,0.0398,0.8615
19,Emily Hope Portney,,"Sure. So when it comes to deposits and runoff, what I'd first say is that we're just using the forward curve. So assume that it's just as baked into the forward curve, Fed funds is about 2.5% by the end of the year. Also, we're just assuming that betas largely retraced what we've seen in the last cycle. It means that we will get to the end-state faster, but they're going to largely retrace, it's correlated to rates and largely retraced what we've already seen. 
So with all that said, we would expect deposits to probably run off maybe about 10% over the course of this year. And that's from where we are in the average of the first quarter. We've already seen them come down a bit from the fourth quarter. And just as a reminder, our deposit base is largely institutional, NIBs. Part of the growth you've seen has been in NIBs and so we expect that to kind of normalize too over time. 
And the other thing I would mention is that as we see deposit runoff, we also could see a migration to money market funds. And if that does indeed happen, then obviously, that could be a nice tailwind for us as well.",negative,0.0945,0.6594,0.2461
12,Kenneth Michael Usdin,,"Okay. Got it. And then in terms of the shortening up of the duration, can you tell us how I don't know if you can size the magnitude of how much that might have changed your current views of full year NII up 13 versus what it might have been otherwise? And how you're now redirecting incremental cash flows into the portfolio versus what you might have done otherwise, if rates haven't gone up this quickly?",neutral,0.3541,0.0646,0.5813
19,Emily Hope Portney,,"Yes. We are -- we've obviously shortened duration across the portfolio. We've swapped fixed floating. And considering just the uncertain environment, we're also continuing to be cautious and nimble.",negative,0.2614,0.4246,0.314
12,Kenneth Michael Usdin,,"Okay. And then you mentioned the more cautious on buybacks in the near term and maybe returning 75% this year. How will you evaluate that? Obviously, we can do math on what it means for this year. But in terms of how much could the swings in AOCI continue to impact even being able to do 75%.",neutral,0.1327,0.0393,0.828
19,Emily Hope Portney,,"Sure. So as I mentioned in my prepared remarks, we still intend to return 100% of our earnings to our shareholders over time, and that's, of course, across dividends and buybacks. We've been cautious, and I think it's been appropriate to be somewhat defensive in this environment with the uncertainty and, of course, the reduction in AOCI. But given the assumptions in our forecast, we feel pretty confident that we would expect to return at least 75% of our earnings to our shareholders over this year. And the nice thing about SCB and the SCB framework is that we can be nimble, we can be flexible. And ultimately, depending upon the runoff we see we might be able to do more.",neutral,0.328,0.0221,0.6499
0,Operator,,We will now take our next question from Steven Chubak from Wolfe Research.,neutral,0.0351,0.0357,0.9292
27,Steven Joseph Chubak,,I wanted to ask a follow-up on the NII guidance. I appreciate the color Emily on the deposit balance trajectory based on what we experienced last cycle. I was hoping you could just speak to the deposit beta assumptions underpinning the guidance for the full year? And also how much of a helper was premium am this quarter? And how much of a benefit do you expect to realize over the course of the remainder of this year?,neutral,0.1308,0.0136,0.8555
19,Emily Hope Portney,,"So from a beta perspective, as I said before, we just expect betas to largely retrace what we've seen historically. It does mean you'll get to the end-state faster. In the first rate rise, it's generally and what we've experienced is very much as we've been expecting in line with expectations, kind of betas of 35% to 40%. 
By the time we kind of get towards year-end and we have many more rate hikes, that will be probably closer to -- betas would be closer to 70-plus percent, which is kind of where we ended in the last rate cycle. In terms of -- what was your last -- sorry, I missed the question.",neutral,0.221,0.0656,0.7134
27,Steven Joseph Chubak,,Sorry. The premium amortization...,neutral,0.0497,0.116,0.8343
19,Emily Hope Portney,,"Yes. It was helpful this quarter. I don't have it right off hand. But it was obviously -- definitely helpful this quarter, but -- and we just expect it with rates rising as we go forward, it will continue to be a bit helpful. But frankly, at a more modest level.",positive,0.9164,0.0147,0.0689
27,Steven Joseph Chubak,,"Understood. And maybe just switching over to the fee side. You spoke to fee revenue up 4% to 5%. And I believe, Emily, and I'm sorry if I missed this, you alluded to organic growth of 1% plus being the underlying assumption. I know you had been running at 2% plus of late. And wanted to get a sense is that organic growth guide more reflection of conservatism, challenging macro or just what you're actually seeing in the backlog of new mandates.",neutral,0.1929,0.0294,0.7777
19,Emily Hope Portney,,"It's definitely not so much on -- at all on the mandate side. We still -- fundamentally, our businesses are in really good health. The growth is really just considering the more challenging environment that we're in. And specifically, when you look at market levels or client activity across some businesses have slowed down, you're seeing or we're expecting a bit more risk-off behavior. And so the particular businesses, which are probably most -- which are going to be most impacted, we think, are Investment Management, Corporate Trust, Depositary Receipts to a lot lesser extent, Asset Servicing. And so that's what's all baked into the 1-plus-percent guide. But the fundamentals are very good and we feel pretty good about that considering the challenging environment.",neutral,0.2114,0.2602,0.5283
27,Steven Joseph Chubak,,"I couldn't agree more. And just one follow-up, ticky-tacky modeling question. Just on the Asset Servicing line. I believe in the slides you flagged a gain on strategic equity investment. I was hoping that you could size that for us.",positive,0.5985,0.0126,0.3889
19,Emily Hope Portney,,We don't disclose that in -- we only disclose that concrete (sic) [ discrete ] item.,neutral,0.0236,0.0258,0.9506
17,Thomas P. Gibbons,,"I would just add to that, Emily. So if you look at our investment and other income, it was about in line with the guidance that we had given. On the Asset Servicing, we do have some investments that we've said and some FinTechs that we work very closely with strategically and they've performed pretty well. But as you might imagine, in this down cycle in the first quarter, we got hit pretty hard in our seed capital and some of our other things. So net-net, they basically offset each other.",positive,0.4329,0.2379,0.3292
0,Operator,,Will now take our next question from Alex Blostein from Goldman Sachs.,neutral,0.0365,0.0312,0.9323
4,Alexander Blostein,,"Congrats again to both Todd and Robin here. So my first question is around the kind of connectivity between organic growth and operating leverage in the business. So organic growth sounds like 1-ish percent this year. Fees were flattish year-over-year. Expenses, up 5%, right? So I understand that there's obviously investments that you guys are making in the business. But when you think about this on a 18 to 24 months out, should we expect BK to get to a point where fee growth is more in line with expense growth. I think this kind of dovetails maybe some of Robin's comments earlier around his focus on operating leverage.",neutral,0.4026,0.0344,0.563
19,Emily Hope Portney,,"So what I would say is, look, we are very focused on driving positive operating leverage. And I just would remind you that overall, for -- if you look at our total revenues, we will be -- our plan is to deliver positive operating leverage this year. And frankly, that's with the impact of the Russia notable items. So I think that's pretty good. 
In terms of fee -- when we think about just fee revenue versus expenses, what I would say is that when you look at our -- the guide that we gave for the rest of the year, our expense guide does include slightly more inflationary pressures as well as the investments, of course, that we've talked about extensively that we think are very compelling and some will pay off sooner and some will pay off a bit over the course of the next couple of years. And as we talked about, it's way too early to kind of talk about like what it's going to look like in say, 24, 36 months out. But we have said that, ultimately, over time, we would expect expense growth, the rate of growth to moderate.",positive,0.5737,0.0322,0.3941
4,Alexander Blostein,,"All right. We'll stay tuned for that. My second question around maybe the Issuer Services business and really DR specifically. I think in the earlier release when you guys announced the Russia loss this quarter, there's a comment there around just a more subdued level of revenue growth. I think there's an ongoing effect from the Russia exited business as well. 
Can you just level set us what the DR business does in revenues now per year kind of net of these changes on a run rate basis? And then ultimately, how should we think about any other sort of geopolitical risk within that business? I don't know to what extent China is part of that revenue stream?",neutral,0.0506,0.07,0.8795
17,Thomas P. Gibbons,,"Emily, you want me to take it or you want it?",neutral,0.0349,0.051,0.9141
19,Emily Hope Portney,,Sure. Go ahead.,neutral,0.0791,0.0192,0.9017
17,Thomas P. Gibbons,,"So I think there's a couple of questions there. So Russia was -- it was a material component of the total DR revenue. And the indication that we gave is there was a contra hit on kind of prepaid expenses there. So that got reversed in the first quarter, and that was the most of the $88 million that we were talking about. And on a go-forward basis, we'd expect probably something like $20 million -- probably $15 million a quarter specifically from DRs. 
There are -- I mean, China is an important market to us, too. So we saw what we have seen, Alex, is a little bit of fewer transactions. Fewer new issuance in China a little bit down, and that's reflected in those numbers. We don't break out the entire ADR revenue line. It's a small -- a modest percentage of the total Issuer Services. But it is impactful and it did, as you can see, it hit the bottom line in the first quarter.",neutral,0.1846,0.2296,0.5859
0,Operator,,"We will now take our next question from Glenn Schorr from Evercore. [Operator Instructions] 
We will now take our next question from Betsy Graseck from Morgan Stanley.",neutral,0.0356,0.0183,0.9461
26,Ryan Michael Kenny,,"This is Ryan Kenny on behalf of Betsy. Just a question on the Pershing X initiative that was announced a few months ago. Wondering if you could dig in more on what specific areas you're looking to grow in and help us size the investment dollars, timing and the ROI of the investments here. And any expected impact on margins?",neutral,0.0517,0.0162,0.932
24,Robin Antony Vince,,"Sure, Ryan. So look, it's an investment that we're excited about. As we step back from our Pershing business, where as you know, we're a real market leader in that business. We touch about 15% of RIA accounts in the U.S. We touch a little over 30% of all RIAs with $1 billion or more in AUM. 
One of the things that we've heard from our clients is that the world is getting increasingly complex for them as they think about how to really pull all of the capabilities that they need to run their businesses together. And as we've really listened to our customers on that point, we decided that there was a great opportunity for us to help solve some of those problems. And so collecting the various different capabilities focusing on the data and the smooth movement of data across those various capabilities we saw that as an opportunity to really deliver something new and incremental to our customer base. 
And we've tried to speed our way along that we hired, as you know, Ainslie Simmonds to run that for us. She's recently completed the rounding out of her top leadership team. We to speed our way to market with the acquisition of a direct indexing capability in the fourth quarter, Optimal Asset Management. That was an example of a bolt-on capability that we think can just help us to accelerate. But we've disclosed before, we're not expecting this to drop much to the bottom line over the course of the next couple of years. This is an investment in positioning Pershing and the aggregate wealth management platform services platform for the future. And so this is an investment in the medium to long term, we think it's important our customers very much want it, and we're excited for it.",neutral,0.2664,0.016,0.7176
0,Operator,,We will now take our next question from Brian Bedell from Deutsche Bank.,neutral,0.0326,0.0367,0.9307
7,Brian Bertram Bedell,,"Great. Well, first of all, congrats again, Todd and Robin. And Robin, looking forward to working with you. 
The first question is just on the short-term second quarter outlook. I know Emily, you gave the outlook for the full year. Maybe just to focus a little bit on the pace coming into the second quarter on the recoupment of fee waivers. And any commentary on the sort of near-term trajectory of NIR for the second quarter?",neutral,0.0716,0.0212,0.9072
19,Emily Hope Portney,,"Yes. We really decided to give more of a full year guide second quarter. But I mean to size what you're thinking about, I think, specifically on waivers, if we do see the Fed raise rates by 50 basis in May as I think we're all kind of expecting. Obviously, that will be a nice uptick in terms of recruiting waivers and it's to the tune of, call it, like $100 million or so is what I -- is how I'd estimate it.",neutral,0.2781,0.0224,0.6995
7,Brian Bertram Bedell,,"Okay. Okay. And then to focus a little bit longer term on the organic revenue growth outlook, the 1% plus. Just I guess if we do get a better -- let's say, if we get a risk on backdrop in the second half as opposed to the current sort of view of a challenging market backdrop, how might that influence that organic revenue growth outlook? Is that enough to put you back in that 2% area? Or do you really -- there's a lot of things you're working on to really build that organically. And if you could just remind us the sensitivity of fee revenue to equity markets, global equity markets improvement? And then just lastly, whether you would be considering any type of major acquisitions to accelerate revenue growth? Or really, it's just going to be a focus on organic.",neutral,0.095,0.0169,0.8882
19,Emily Hope Portney,,"So I'll take a couple of parts to that, and Todd or Robin might want to chime in about the inorganic opportunities. But in terms of organic growth, I mean, just remember, when we define organic growth, we are normalizing for market appreciation or depreciation, but it is fair that risk-on or risk-off risk behavior associated with that could also impact organic growth. And so what I would say is, it's hard, we don't really say like what's the sensitivity. But yes, there certainly could be more upside if you see more risk on behavior and ultimately, that means more trading, more transaction volume, et cetera. So that is upside. So it's certainly not out of the realm of possibility that it could be higher. In terms of -- what was your second question?",neutral,0.0794,0.0368,0.8838
7,Brian Bertram Bedell,,The equity -- the fee revenue sensitivity to -- so like every 10% increase in equity market.,neutral,0.2231,0.0113,0.7656
19,Emily Hope Portney,,"Sure. Yes. We've disclosed this. I think you can find in the K. So basically, any like a 5% move in equity markets is kind of happening gradually throughout the year is about an additional $75 million in revenue.",neutral,0.1541,0.0183,0.8275
7,Brian Bertram Bedell,,Yes. Great. And then [indiscernible].,neutral,0.0361,0.4788,0.485
19,Emily Hope Portney,,"Todd, do you want me to take inorganic or you want to?",neutral,0.0378,0.0323,0.9298
