Speaker ID,Speaker Name,Speaker Company,Text,Sentiment Label,Positive Score,Negative Score,Neutral Score
17,Thomas P. Gibbons,,"So Emily, why don't I take the clearing and collateral management business, and you can take the rest of the Asset Servicing space. So we saw good growth in the clearing and collateral management business as we have for a while now. In fact, one of the points I made in my remarks, for the first time, we saw the collateral management numbers -- our tri-party numbers exceed $5 trillion in the quarter. So we continue to see good growth there. And the profitability on the global collateral management continues to be strong. We've got innovation that is paying off there. So that attributed a bit to the growth. 
The other thing that we're doing, and we do this out of our Markets business but it's really a collateral management business, is the requirement to meet margining in over the counter -- for over-the-counter derivatives transactions to meet margin requirements. And we're in phase 5 of 6 of that. And our teams did an excellent job of seamlessly onboarding a significant number of players. And that's starting to add a little bit of revenue to the line there. So overall, that business continues to look pretty healthy and continues to show underlying organic growth. 
Why don't you comment on the rest of Asset Servicing?",positive,0.8346,0.013,0.1524
19,Emily Hope Portney,,"Sure. As you think about Asset Servicing and just thinking about just the growth in our fees or asset -- sorry, our AUC, our assets under custody, they are up about 17% year-on-year on a spot basis. About half of that was driven by market and the other half truly driven by growth. So both from -- growth from existing clients as well as new clients probably split about 50-50. 
And when just thinking through kind of where we're seeing a lot of that growth, about 30% of it is from investment managers. Another 30% or so is from broker-dealers and banks. And then the remainder is really split between both the alternatives space and the asset owner space. So that's -- we're seeing a nice uptick, and the pipeline is stronger than it was at this period last year.",positive,0.5394,0.0316,0.429
12,Kenneth Michael Usdin,,"Great. And my follow-up is just coming back on the clearing business. Last quarter, you had said that you had expected about a $20 million impact from the deconsolidation that you discussed. Can you just help us understand how much of that was already out in the third quarter and how much more do you still expect, if any?",neutral,0.0945,0.0471,0.8584
19,Emily Hope Portney,,"Sure. In Pershing, the -- we had originally expected about a $20 million impact of the lost business due to just being on the wrong side of M&A. That is -- due to timing, that was a lot less. So I would think about it as the uptick will be about $15 million. Between the third quarter and the fourth quarter, we'll see the full impact.",neutral,0.1031,0.3338,0.5631
0,Operator,,Our next question comes from the line of Brian Bedell with Deutsche Bank.,neutral,0.0346,0.0302,0.9352
7,Brian Bertram Bedell,,"Most of my questions have been asked, but maybe just to follow on, on a couple. So just going back on to the organic growth. Obviously, this is really tracking well, going from 0-ish to now close to 3%. So maybe just a thought. I know 2022 is too early, but given these initiatives that you have and how you think about the revenue following through, do you -- are you optimistic that you can continue to improve upon that 3% number? 
And then just one on Pershing X. Just in that aggregator system, does that require you to disintermediate the current custodians? Or are you becoming the custodian in that process? Or rather, would you sit on top of the current custodian and make it -- have a seamless aggregation of their technology services?",neutral,0.0925,0.0153,0.8922
17,Thomas P. Gibbons,,"Okay. So why don't I take the Pershing question, and then, Emily, I think you can probably handle the other one. But the Pershing Project X will be multi-custodial, so it will actually be custodian-agnostic. Of course, we'd love to have a custodial business, but we'll be able to provide these capabilities regardless of who the custodian is. And we're working on that capability right now. 
And I must -- I have to say this is going to -- Pershing, in particular, is probably the longest in term of our investments. So this, we're really investing for the future. And I think before we really start to see the revenues that we expect in that business, that's probably 2 or 3 years out. Most of the other ones that we've been talking about are a little more near term. Do you want to...",neutral,0.114,0.0125,0.8734
19,Emily Hope Portney,,"Sure. Again, we're in the middle of the planning process so it's probably too soon to really comment on the expectations specifically for organic growth next year. But certainly, we're really pleased with the momentum that we've seen this year, and we would hope to certainly achieve roughly the same amount of organic growth next year.",positive,0.9041,0.0117,0.0841
7,Brian Bertram Bedell,,"Okay. Okay. Great. And then just quickly on net interest revenue, on that 14% down guide. I'm not sure if I had the right base here, but does that imply a slight downtick in NIR in 4Q versus 3Q? I know Emily you said -- you talked about the trough, and I wasn't sure if you're referring to 3Q or 4Q as the likely trough in NIR.",negative,0.03,0.8995,0.0705
19,Emily Hope Portney,,"Yes. I mean if you do the math, it would imply a very -- a slight downtick, about 1% to 2% in the fourth quarter. But of course, rates are moving all the time. Like I said, we're seeing potential upside from some central banks even moving earlier than originally thought. So that's what -- based on the last forecast, it's slightly down, but we think there's potentially some upside. And hopefully, it will be flat.",negative,0.0914,0.8091,0.0996
0,Operator,,Our next question comes from Robert Wildhack with Autonomous Research.,neutral,0.0445,0.0311,0.9244
22,Robert Henry Wildhack,,"One more on organic growth, if I can. How much of that is coming from competitive wins versus, say, more greenfield-type opportunities?",neutral,0.0967,0.0146,0.8886
17,Thomas P. Gibbons,,Do you want to take that?,neutral,0.0431,0.0246,0.9323
19,Emily Hope Portney,,I missed it.,neutral,0.1053,0.1364,0.7584
17,Thomas P. Gibbons,,The competitive wins versus greenfield.,positive,0.9041,0.012,0.084
19,Emily Hope Portney,,"So when -- I mean, certainly, when we look at the entirety of our wins, we're -- both new -- wins of what we call new business, it can be new business from completely new clients as well as new business from existing clients. So as clients obviously launch new funds, et cetera, that's still new business but it's new business with existing clients. And of course, we're always very, very focused on retention. So having the business already and still competitive -- it's competitive out there, so making sure that we're retaining those deals that we already -- that we -- where we are the incumbent. When you look at it, about -- it's about 50-50 in terms of the breakdown of like new versus just retention of existing business.",neutral,0.0776,0.0228,0.8996
17,Thomas P. Gibbons,,"And we're -- I think, to your point, we're definitely winning against the competition in a couple of the ones that I even called out today. One in the alternatives space, that was a different service provider. We had a broader set of capabilities in addition to the ability to do the administration, so we've won that business. We won a couple of large businesses over the last -- takeaways over the last couple of quarters. 
So occasionally, we lose them. But right now, our win-loss ratio versus the competition is leaning toward our side. And we think that's because of the capabilities that we've got as well as the quality of the service that we've been delivering.",positive,0.5597,0.0179,0.4225
22,Robert Henry Wildhack,,"Okay. And just to stay on retention, how has the retention rate been trending? And then what kind of opportunities or things can you do to continue to improve the retention rate?",neutral,0.186,0.0199,0.7942
19,Emily Hope Portney,,"Our retention rates have been trending upwards and -- we don't really disclose, but certainly, they're trending upward and they're very high, so well in excess of 70%, 75%. So in terms of how, I mean, the first thing I would say is -- first and foremost is just client service and basically performing well day in and day out. And that's what kind of gives you the even -- the right actually to bid and to ultimately retain. So we're intensely focused on that. 
And then, of course, it's about talking to our clients, understanding their strategy. More and more, we're really working in a consultative manner with our clients, looking at their issues, their challenges and how we can bring the solutions of our -- the entirety of the firm to bear to help them with their operating model and to get more efficient and to create alpha. So it's both just being good at the day-to-day and also ensuring that our capabilities and our -- both our capabilities and our products are not only competitive but leading edge and then working with the client -- working with our clients on a very -- in a consultative and in a strategic manner.",neutral,0.1699,0.014,0.8161
0,Operator,,[Operator Instructions] Our next question comes from Michael Brown with KBW.,neutral,0.0422,0.0284,0.9294
25,Michael C. Brown,,"I'm not sure if you guys gave this, but Emily, just given most of your comments are on a year-over-year basis, I was just curious given the move in the dollar and the strengthening that we recently saw. What was the sequential impact to revenues and expenses in the third quarter versus the second quarter from the move in the dollar?",neutral,0.1329,0.1158,0.7513
19,Emily Hope Portney,,"Oh, gosh. Off the top of my head, I can't really -- I don't have it off the top of my head. But I mean the good news is that actually we're pretty equally matched. So any benefit you have in revenues or any -- sorry, any headwinds you have in expenses is pretty much equally offset in revenues. From a -- so from a PTI perspective, we're incredibly well hedged.",positive,0.5884,0.0176,0.3941
17,Thomas P. Gibbons,,But it's going to be in the ballpark of 1% to 2% of the expense base (sic) [ year-over-year ].,neutral,0.0668,0.0126,0.9206
19,Emily Hope Portney,,"Yes. Off the expense base, yes.",neutral,0.1437,0.0668,0.7895
25,Michael C. Brown,,"Okay. And then just on the loan book, it's up 14% year-over-year, the average loans, but just 1% sequentially. And that's the lowest growth rate we've seen in the last 3 quarters. Any particular reason there was a bit of a slowdown this quarter? And what's the expectation there going forward?",negative,0.0414,0.7888,0.1698
19,Emily Hope Portney,,"So I mean just to point out, our loan book has grown by 14% year-on-year. So there's been very healthy growth in the loan portfolio over time. Of course, growth in any 1 quarter can be lumpy. We did see some healthy growth. Loans on a spot basis, they're actually up more than -- they're up at -- to $64 billion. 
Some of the growth we're seeing is a growth in margin loans, growth in collateralized lending in Wealth. We're seeing growth in our term loans in terms of securities financing and also more demand in terms of capital call facilities. So -- and look, we do think we have certainly -- we're proactively looking to grow the loan portfolio. And we're very -- we feel that it's certainly an area that's in focus, and we've got capacity certainly to do so.",positive,0.9113,0.0142,0.0745
0,Operator,,"And with that, that does conclude our question-and-answer session for today. I would now like to hand the call back over to Todd with any additional or closing remarks.",neutral,0.0385,0.0241,0.9374
17,Thomas P. Gibbons,,"Thank you, everyone, for your interest. And obviously, you can reach out to Marius and the IR team for any follow-ups. Thank you.",neutral,0.3104,0.0097,0.6799
0,Operator,,Thank you. This does conclude today's conference and webcast. A replay of this conference call and webcast will be available on the BNY Mellon Investor Relations website at 2 p.m. Eastern Standard Time today. Have a great day.,neutral,0.0962,0.0151,0.8887
