Speaker ID,Speaker Name,Speaker Company,Text,Sentiment Label,Positive Score,Negative Score,Neutral Score
17,Thomas P. Gibbons,,"Yes. Why don't you go ahead and take it. So before you do Emily, before you do Emily, I just want to add. So Brian, just that 5% was -- that was not an average at $75 million. That means if it goes up on average over the course of the year, yes, [indiscernible].",neutral,0.2952,0.1196,0.5852
7,Brian Bertram Bedell,,Yes. That makes sense.,neutral,0.1085,0.0239,0.8676
17,Thomas P. Gibbons,,"Okay, you want to follow up on inorganic, Emily?",neutral,0.0468,0.0199,0.9333
19,Emily Hope Portney,,"Sure. I mean on inorganic, what I would say and Todd and I have been very consistent on this, is that we are -- of course, we always are evaluating inorganic opportunities. But at the same time, the bar is really, really high. And it's not high just from a return perspective, it's also very high from an execution risk perspective. So we have been doing several deals, but they've been mostly kind of digestible bolt-on things that are adding capabilities or markets or clients. And we will continue to look out for those.",neutral,0.2275,0.0197,0.7528
0,Operator,,We will now take our next question from Michael Brown from KBW.,neutral,0.0357,0.0302,0.9341
25,Michael C. Brown,,I just wanted to ask about -- start with the average loans were up 3% sequentially and 18% year-over-year. So I just wanted to ask a little bit about where you're seeing the strongest demand? And what are your expectations moving forward and the ability to meet that demand given the expected trajectory of the deposit balances from here?,neutral,0.3833,0.0228,0.5939
19,Emily Hope Portney,,"So actually, we've been very proactively growing the loan portfolio. So yes, as you mentioned, it's up 3% on average and 18% year-on-year. We will continue -- it's our expectation to continue to grow that over the course of this year. And where we're seeing it is really on a couple of different areas. So capital call facilities, certainly, trade finance, likewise, margin loans, CCLs and mortgages and in Wealth, so let pretty much across the board. And that's -- we want to be there and leverage our balance sheet for our clients when it makes sense.",positive,0.6886,0.01,0.3015
25,Michael C. Brown,,"Okay. And then just thinking about the capital ratios today in your comment on returning 75% of net income, any thoughts on the trajectory in terms of the quarterly pace, just given that the Tier 1 leverage is at 5.3% or ended the quarter at 5.3%. It seems like the buybacks may need to be a bit more back-half weighted as the capital ratios kind of accrete higher from here? Is that a fair expectation?",neutral,0.0723,0.0993,0.8283
19,Emily Hope Portney,,"I'm not going to really comment on kind of how it's going to be paced throughout the year. I think you can kind of look at all of our ratios and make your own assumptions. But -- and the thing I would just remind everyone again is that the SCB framework is really, allows us to be very nimble and very flexible.",neutral,0.1424,0.0132,0.8444
0,Operator,,We will now take our final question from Gerard Cassidy from RBC.,neutral,0.0288,0.0296,0.9416
10,Gerard Sean Cassidy,,"Emily, can you share with us -- and if it's not available, maybe you could answer it in a different way. But in your quarterly and 10-Ks, you and your peers always give us a 100 basis point parallel shift in the curve leads to an x percent increase or decrease in net interest revenue. How does that -- how do you stand today at the end of the first quarter versus the end of the fourth quarter? Do you have that number? And if you don't -- will it be lower by 30% or 40% compared to the fourth quarter?",negative,0.0306,0.8682,0.1012
19,Emily Hope Portney,,"It's -- we don't -- we will obviously be updating that when we release the Q. What I would say is we're much more sensitive, of course, to short-term rates than long-term rates. That continues, of course, to be the case. And you'll see more of that when we actually release the Q.",neutral,0.0758,0.0245,0.8997
10,Gerard Sean Cassidy,,"Okay. Very good. And then following up on the Tier 1 leverage ratio. I think last quarter, you mentioned that you guys trying to manage to 5.5%. Obviously, you're slightly below that today. Where do you think -- how low can it go from where we are today? Or just your views on how you're managing that number.",neutral,0.171,0.1995,0.6296
19,Emily Hope Portney,,"So in terms of Tier 1 leverage, we've always said that given the extraordinary circumstances we're in and all of the excess liquidity in the system that we would be -- it makes perfect sense to dip into our buffer to a degree, which is what we've done. We would expect, of course, as we start to see some probably deposit runoffs that will take a lot of pressure off Tier 1 leverage. 
And what I'd also just flag is that by the end of the year, it's not -- it's likely -- actually not out of the realm of possibility, but frankly, probably likely that our binding constraint will become CET1 versus Tier 1 leverage. And frankly, I think if you're toggling between Tier 1 and Tier 1 leverage in CET1, that actually is very good. It means you're managing your balance sheet optimally.",neutral,0.4697,0.0333,0.497
10,Gerard Sean Cassidy,,"Great. And then just quickly, on the HTM, I think you said you lifted your HTM portfolio of 40% of total securities. Is there a limit on how high you would take that to?",neutral,0.2295,0.0154,0.7551
19,Emily Hope Portney,,"There isn't a limit per se, but we obviously do that every with our partners in Risk, and we're always making sure that whatever we move there is high-quality liquid assets that generally speaking, you can repo it. Repo those assets, et cetera. So I wouldn't expect it to increase a lot more from here.",neutral,0.1875,0.0173,0.7952
17,Thomas P. Gibbons,,"Gerard, it's Todd. I'll follow up. I just want to add to -- I mean, Emily made, I think, all the right points around the capital ratios and the Tier 1 leverage. But remember, we're probably too precise when we give you a number of something like 5.50. If you remember, that's a 150 basis point buffer to what the requirement is. And the reason it's there is because we recognize that you could have a spike in the balance sheet and for us, it's not a risk spike. It's because deposits have increased, and we've certainly seen that through the quantitative easing over the past couple of years or you could have a sell-off and some impact in the OCI. That's exactly why the buffer is there. 
So eating into the buffer in this type of situation is exactly what we would expect. And it's not really particularly constraining to us. as we still have that 130 basis points to Emily's point in our modeling, if things run the way we would expect them off of the forward curve those deposits are going to come down 10% or so, and that's going to free up quite a bit of Tier 1 leverage. 
And basically -- and we're estimating that we're going to get pretty close to common equity in Tier 1, which is a great place to be. And it also means common equity is a little easier to manage because that's a risk-based asset ratio where we can manage. It's not just what comes on to the balance sheet. So I want to make that clear, well probably in the future, we should give you guidelines sort of more ranges, and we can kind of calculate where we are in the range.",neutral,0.1367,0.1234,0.7399
10,Gerard Sean Cassidy,,"Very good, Todd. And a great run Todd with Bank of New York, and good luck with you next endeavor.",positive,0.834,0.0121,0.1538
17,Thomas P. Gibbons,,"Appreciate it, Gerard. Thank you. So it is top of the hour. Operator, do we have any other questions?",neutral,0.0339,0.0311,0.935
0,Operator,,"There are no further questions in the queue, sir.",neutral,0.0332,0.0422,0.9246
17,Thomas P. Gibbons,,"Okay. Thank you, everybody. Thank you for joining us today. Look forward to following up. I guess you can call Marius if you have any follow-up questions. Be well.",neutral,0.0831,0.0204,0.8965
0,Operator,,Thank you. This does conclude today's conference and webcast. A replay of this conference call and webcast will be available on the BNY Mellon Investor Relations website at 2:00 p.m. Eastern Standard Time today. Have a great day. Thank you.,neutral,0.1257,0.0131,0.8612
