Speaker ID,Speaker Name,Speaker Company,Text,Sentiment Label,Positive Score,Negative Score,Neutral Score
0,Operator,,[Operator Instructions] Our first question comes from the line of Glenn Schorr from Evercore.,neutral,0.044,0.0263,0.9297
11,Glenn Paul Schorr,,So I appreciate your comments about acting as agents in the LDI cases in the U.K. I wonder if we could get a little more of the ins and outs of the impact to both BK and clients because Insight has been a great acquisition that's produced a lot of flows for you in the past. So I'm curious on impact in the quarter when you get more collateral but clients have lower balances and what you think clients are going to do with this business going forward.,neutral,0.117,0.0485,0.8344
24,Robin Antony Vince,,"Sure. Well, Glenn, thanks for the question. Obviously, this topic has been in the news a lot over the course of the past few weeks. Let's maybe just start by stepping back and remember what LDI actually stands for and what it is, so it's liability-driven investing. And the principle at work, as I think you know but let me just recap it, is really the investment approach that ensures that the assets ultimately, are moving more in line with the value of the liabilities. And so we think that principle, which has been very important to the pension space over time, is an important one, and it's going to be something that we would expect to continue. I mean these strategies have been employed by many years. They've been extensively embraced by the pension regulators in the U.K. and then the consultants who advise our pension clients in the space. 
The second thing I'd say is that, more broadly, higher interest rates have actually served to improve the funding positions of most pension funds because the value of the liabilities has decreased by more than the decreases in their gilt holdings. And so that has been a net positive in terms of contributing to the pension funds' funding status. But look, clearly, as you pointed out, the speed and the magnitude of the rise in the U.K. government bond yields has been pretty unprecedented and certainly has created challenges in the market with the sort of speed and magnitude of everything that's been going on. And that's created issues, including liquidity issues, for many of these pension funds, who've had to sell gilts and mobilize other forms of liquidity in order to be able to meet the margin calls on derivatives. And as you know, they are the principal on the derivatives. 
This has clearly put a strain on the markets. I mean the sheer size of the pension market versus the U.K. gilt market just sort of shows the degree of impact that they can have. And it's also highlighted some operational challenges if you just think about the 2-day settlement of margin versus the time to liquidate assets across the wider asset pools, and that's been exacerbated actually by some operational providers. We actually don't provide direct operational support to Insight. That's done by a third party. And what's happened as a result of all of that? Well, clearly, people are raising additional liquidity, which makes a lot of sense. 
Now we've been pleased -- to the other part of your question, we've been pleased with Insight's performance. They've been focused actually on building collateral buffers throughout the year, and this prudence, I think, has been quite helpful in protecting client portfolios. And Insight has also been, over time, working on a strategy that they called integrated solutions, which is really encouraging pension funds to be able to look across all of the types of assets that they have so that they see the whole and not just the individual pieces. So the investment of maybe less liquid components is done with a mind and a view to what's being done and where leverage might exist elsewhere in the portfolio. And I think that that integrated approach which they've been a big proponent of has actually been a good solution in this particular crisis. 
And so we actually think that net-net, our solution is being strengthened in the market, Insight's reputation has done quite well. In fact, they are turning away new business as they've seen and benefited, frankly, from the incomings and a bit of the flight to quality. So clearly, a situation that's still evolving. Today's market looks a little bit better following some of the news at the end of last week and over the weekend, but we're watching it very closely.",neutral,0.3019,0.2084,0.4897
11,Glenn Paul Schorr,,"So I appreciate all that color. I follow everything and it feels like nothing on balance sheet risk, didn't have major client outflows. The last part I wasn't sure about is why would they be turning away new business or are clients not going to use this as much forward or just use less leverage? I'm curious on your outlook. Again, I think it was a good source of flows in the past, and just curious what you think going forward.",neutral,0.0726,0.0326,0.8948
24,Robin Antony Vince,,"Yes. So the reason why we've been turning away some new business is because, really, we want to protect the interest of our existing clients. And so taking on more problematic situations and there are some in the market which have less funding and liquidity available, and then essentially taking them into our franchise and having to deal with that problem, this didn't seem like the smartest moment to do that and also, frankly, wasn't in the interest of our existing clients who've been along -- with Insight along the journey. So that's actually the reason there. 
But more broadly, we do expect to continue to get incoming phone calls given some of the differentiated nature of how Insight’s performed through this, and we view that to be positive for the franchise. So actually, I view that as something of a tailwind because these types of reputational events in the market, frankly, can sift out some of the different players.",neutral,0.1995,0.1044,0.6961
0,Operator,,The next question comes from Mike Brown from KBW.,neutral,0.0291,0.085,0.8859
25,Michael C. Brown,,"So Robin, I noticed that the AUC/A declined just about 2% quarter-over-quarter. This would be less than we'd expect given the market backdrop here. You talked about the strong sales momentum and recent wins. So how much did organic growth contribute this quarter, if you could kind of quantify that? And when did that come in in the quarter?",negative,0.0727,0.7538,0.1734
19,Emily Hope Portney,,"It's Emily, I'll take that. The AUC/A really speaks to -- the trends in AUC/A speak to the diversity of the franchise overall. So firm-wide AUC/A was down about 7%. That was based on lower Securities Services AUC/A of about 11%, but very much tempered by growth in Market and Wealth Services, led by CCM. 
If you want to kind of drill down a bit more in terms of Securities Services and what you're seeing there, about -- the 11% decline, about 13% of that was due to lower market values as well as the strengthening U.S. dollar, and that was partially offset by about 2% of net new business.",negative,0.0115,0.9602,0.0283
25,Michael C. Brown,,"Okay. Great. And then, Emily, if I heard your comments correctly on the share buybacks, it sounds like it's really dependent on the capital levels. But did I understand that correctly that it's still possible that you will -- that you could be in the market for buybacks this quarter if the capital levels perform as expected?",neutral,0.3237,0.0353,0.641
19,Emily Hope Portney,,"As I said in my prepared remarks, and it's very important that everyone really understands, we're going to continue to be prudent with respect to buybacks. So I think that's natural given the continued volatility that we're seeing across the markets and frankly, the uncertain macroeconomic environment. We also -- we do want to be above our internal target for our capital ratios before we consider resuming buybacks. So it is true that when we think about capital distribution, frankly, our approach hasn't changed. Whether it's this quarter or next quarter, it's always going to be informed by the rate trajectory and the corresponding impact on AOCI, the size of our balance sheet, market conditions, of course, and frankly, our forward outlook. 
But what I would remind everybody is that beyond the near term, we have a business model that really allows a meaningful amount of return to -- of our capital to shareholders. And pending the sale of Alcentra as well as over time, as rates do move in a different direction, that the AOCI will be pulling back to par, and that will -- both of those things will free up meaningful capital levels.",neutral,0.481,0.0269,0.4921
0,Operator,,We will now take our next question from Steven Chubak from Wolfe Research.,neutral,0.0351,0.0357,0.9292
27,Steven Joseph Chubak,,"Wanted to start off with a question on the operating margin. While the operating backdrop, Robin, as you noted, remains highly uncertain. In the last Fed tightening cycle, the company was generating mid-30s operating margins fairly consistently, so well above current levels. I just wanted to get your perspective or take on whether you see a credible path to getting to those type -- back to those types of operating margins. And what are some of the drivers that could potentially help you close the gap here?",neutral,0.1873,0.0217,0.791
24,Robin Antony Vince,,"Sure, Steven. Well, I'll just start by reminding you, and I mentioned this in my prepared remarks, but when we announced our resegmentation in December last year, Emily and I both commented on the fact that we were driving towards a 30%-plus margin in our Securities Services segment, which, as you know, is not where we have been. And we said at the time, that was going to be made up of a variety of different components. It was going to be top line organic growth. It was also going to be, of course, the rate cycle, which is a meaningful contributor, and we do view that as an important contributor to our firm. And then third, it was going to be through focus on the bottom line. 
And so if you take that as a microcosm for a second, that's exactly how I think about the strategy for the whole firm. We're laser-focused on executing on our growth investments, things like Pershing X, real-time payments and some of the other things that I've detailed before. But we also have to be a very good steward of expenses. And although we've made significant investments in resiliency over the course of the past 4 to 5 years, I feel that there is more room for us to be able to invest in efficiency-related technology. So investing in technology on the top line and the bottom line but with a more sense of tangible payoffs that are available than maybe we've seen in the resiliency space, which is really a cost of doing business. 
Emily can comment maybe just for a moment on our budget process because we're in that season, and we've adjusted our budget process to really try to get at this margin question that you raised.",neutral,0.1422,0.0168,0.8411
19,Emily Hope Portney,,"Sure. So we are, as Robin said, intensely focused on our forward expense trajectory. And in the budget cycle that we've just kicked off, we're actually doubling down on a rubric that we've actually used historically, but mostly just for tech, and now we're looking at it and applying that rubric across the entire company. And in effect, what we're doing is stratifying all of our expenses across 3 buckets. 
So first is really structural or running the bank. Second is change the bank. And we're really drilling into that category to be very clear about if we're making investments, are they for growth, are they to transform or for that matter, are they to continue to meet ongoing regulatory obligations? And third, of course -- the third bucket is just revenue related, which obviously rise with top line growth. 
So I can share that as we go through this, more than 50% of our expenses are structural in nature. They are certainly higher where -- higher than we think they should be, as Robin has alluded to. And we're very heavily focused on driving these down. In some areas, we have multiyear programs like transfer agency, fund accounting, et cetera, which are businesses that are highly manual in nature, and we do have programs to make them more efficient, and we'll come back to you when we finish the planning process.",neutral,0.102,0.024,0.8739
27,Steven Joseph Chubak,,"Thanks for all that color. It's really helpful perspective. And maybe just for my follow-up on the deposit outlook, Emily, you noted that the noninterest-bearing outflows have been tracking better so far this cycle. And as a percentage of total deposits, it's still fairly elevated at 28%. I believe last cycle, it troughed somewhere around 22%. What's your expectation in terms of the pace of noninterest-bearing outflow? What's driving the better outcome this cycle? And where do you expect NIBs to ultimately trough this cycle relative to last?",negative,0.0645,0.7731,0.1624
19,Emily Hope Portney,,"So I think I've mentioned and we still believe that NIBs will ultimately revert to what we saw prepandemic, which would be about 20% to 25% of our total deposit base. We actually think that that might happen here in the fourth quarter. 
In terms of why they've held so, so steady, I think some of that is probably risk-off behavior. Some of that is just our businesses are a bit bigger. And ultimately, what I would say is that we have seen when we look at our deposit trend overall, and this is very important, irrespective NIBs or IBs, the runoff we've seen thus far has been largely nonoperational in nature, and that's actually good. We're seeing the right runoff, and I think very much due to our very -- what's become much more sophisticated pricing across clients and segments in businesses.",neutral,0.2993,0.0248,0.6759
0,Operator,,We will now take our next question from Betsy Graseck from Morgan Stanley.,neutral,0.0316,0.0341,0.9343
26,Ryan Michael Kenny,,This is Ryan Kenny on behalf of Betsy. Wondering if you could give us more color on the goodwill charge. What specifically was the driver of the charge this quarter? And does it give you more flexibility on your strategy in Investment Management?,neutral,0.1076,0.0127,0.8797
24,Robin Antony Vince,,"Sure. Happy to. So first of all, let's be clear about what it is and what it isn't. So it's not the outcome of any changes in our strategy. It's also not related to the pending sale of Alcentra. And it's also not a statement about the fundamental health of the business as we see it today and going forward. It is the outcome of our regular impairment testing process, and it's a reflection of both the lower market values that we've seen across equity and fixed income markets and also a higher discount rate. 
So inevitably wrapped up in your question is the strategy. And so maybe I'd just recap for a second where we are on that investment management journey. As you know, over the course of the past 15 years or so, we've streamlined the investment portfolio. We used to have 27 independent investment management firms. That's down to 7 once Alcentra is closed. That helps us to sharpen our focus, as does the fact that we've improved substantially the alignment between strategy and the individual firms. And so we've realigned Mellon's investment capabilities into parts of Newton and Insight and Dreyfus. We think that helps make it less confusing for our clients externally and sharpens the focus internally. 
We're also investing in the types of solutions that, of course, people want in this day and age, in some of those outcome-orientated solutions, active ETFs, responsible investing. We talked about BOLD, I think, on our last earnings call in the money market fund space. It's another example of that. And then very importantly, in the investment management space, the investment performance has improved and remains healthy. So kind of that's where we are.",neutral,0.2338,0.0177,0.7484
0,Operator,,We will now take our next question from Alex Blostein from Goldman Sachs.,neutral,0.0364,0.0295,0.9341
4,Alexander Blostein,,"So there's been a number of liquidity challenges in the market, and Robin, you alluded to those in your prepared remarks as well. So as BK serves, obviously, a fairly critical function in sort of the capital markets plumbing globally, what are some of the risks, I guess, you're most mindful of that we should be looking after? And as you think about any opportunities that this kind of environment creates for the bank as well, would love to hear your thoughts on that.",neutral,0.0855,0.0163,0.8981
24,Robin Antony Vince,,"Sure. So Alex, we've got a bunch of different crosscurrents at the moment in the system. On the cash side, we're coming off the back of QE. Central Bank is, obviously, driving very aggressively at inflation, clearly necessary given the continued prints. But then on the flip side, and these 2 things don't necessarily always happen at the same time which is what makes it complicated, is we've got supply chain issues ongoing, geopolitics, energy prices, risks of recession, already very much front and center. And so we've got sort of a risk-on and a risk-off angles sort of happening at the same time. 
We've also seen some pretty unprecedented starting places for some of these markets. And I think that's a little bit for us where we see some of the concern, which is the usual tool kits around market stability aren't available in maybe quite the same way. You saw that in the U.K., where just to take that as a microcosm for a second, their bond market goes through a little bit of tumult as a result of some news in the government actions. And at the time, the Bank of England was still in the QT process, which they had to suspend to then go do some buying. You just can't really be doing buying and selling at the same time. That's a good example of the fact that the tool kits aren't fully available. 
We look at the scale of moves in the market and we look at the amounts of liquidity. And so much has been done in the banking sector, particularly over the course of the past decade post financial regulatory reform, the regulators have been very much at it. So banks, massive amounts of liquidity, large amounts of capital very well set up for this. But if you have huge selling from other market constituents, there is a little bit of a question there of where the buyer is going to be. And we see echoes of that in the U.K. market. There are legitimate concerns about that in the U.S. market. If there were a significant episode as we've seen in the past, what does that pivot looks like? 
And to some extent, those are the consequences of having and benefiting from the most liquid markets in the world on a normal basis and also being the place where people store their cash. And when they want cash, they need it back and they're selling. So the question becomes who are the buyers? We've seen the Central Bank of Japan having to be sellers of treasuries as they defend their currency. 
So there's a lot going on in the world, and it's a bit complex. But I think we have a healthy amount of caution as we see all this play out over the course of the coming weeks and months.",neutral,0.0673,0.0862,0.8465
4,Alexander Blostein,,"Got you. All right. And then my follow-up just around the LDI dynamic again, and I appreciate your comments around Insight on the asset management side. But I guess, as a servicer, curious how you're thinking about your exposure to U.K. pension plans on the Asset Servicing side of the business, either as custodian or a middle or back office administrator. Any sort of implications for fees or deposits we should be thinking about as U.K. pensions post more collateral?",neutral,0.0507,0.0231,0.9262
24,Robin Antony Vince,,"Yes. It's been pretty business as usual for us on the servicing side. As I mentioned before, that isn't the case everywhere. Clearly, there have been issues in that market, and there are a couple of providers who've had some more stresses associated with the massive upsurge in volumes, but that has not been our experience. Clearly, there is more cash in the market generally. 
And look, let me just make a broader point about cash because I think it's a very interesting position for us as a company. The various different roles that we play in cash because yes, we have deposits on our balance sheet, and that tends to be a lot of the focus that we talk about in terms of cash, but we actually manage over $1 trillion of daily liquidity for our clients in markets all around the world. And this goes way beyond deposits on our balance sheet, it goes to our money market fund business, it goes to our market-leading LiquidityDirect portal, which helps treasurers and other cash managers be able to direct cash through the system. 
And so we actually feel pretty well positioned as a company on the topic of cash because sort of irrespective of exactly where the flow is heading, we set ourselves in a little bit of an orchestration role in the middle of that, which we think is really quite good for our franchise over time.",neutral,0.1605,0.023,0.8165
0,Operator,,We will now take our next question from Mike Mayo from Wells Fargo Securities.,neutral,0.0322,0.0389,0.9289
18,Michael Lawrence Mayo,,Can you hear me?,neutral,0.071,0.0306,0.8983
19,Emily Hope Portney,,Yes.,neutral,0.1082,0.0226,0.8692
24,Robin Antony Vince,,"Yes, Mike.",neutral,0.0981,0.0177,0.8841
18,Michael Lawrence Mayo,,"Okay, great. I'm going to answer my question, I think, which you're guiding a little bit lower for fees, but you're not guiding lower for expenses. And I guess the answer is because you're looking to invest through the cycle, if you could validate that. And then just more on the Digital Asset Custody platform, you said that custody of digital assets and crypto are simply the start of a journey. And there's a lot written pro and con as it relates to digital currencies. Clearly, you think this has legs. Maybe that's one reason why you're going to invest maybe more even with softer fees, but if you could elaborate on that.",neutral,0.1169,0.0233,0.8598
24,Robin Antony Vince,,"Sure. Mike, let me -- I'll take the whole thing. So first of all, in terms of -- we're not reguiding on expenses. Emily said that the original guidance of 5% to 5.5% is intact, but she also said that we're aiming towards the lower end of that range. So that's meant to be sort of a vote of confidence in our own active management of expenses, which we're really driving at. And we are very, very focused, as Emily said earlier on, on this journey. And so you should expect us to continue to give you updates on how we do on that over time. 
Let me talk a little bit about digital assets because it is a very important question, and I tried to stress this in my prepared remarks around the fact that it really isn't just about crypto. So one of the things that we did recently was we did a survey of large institutional asset managers, asset owners, hedge funds. About 40% of them already hold crypto in their portfolios. About 75% of them are actively investing or exploring investing in digital assets. 
But here's the important stat, which is over 90% of them are interested in investing in some type of tokenized asset within the next few years. And so what we've heard from our clients is they want institutional-grade solutions in the space. And the way that we think about the world is, yes, sure, there are cryptos and those are things that are clearly have had a lot of spotlight recently, but we view the tokenization of other types of assets, whether they're traditional financial assets or maybe assets that haven't been as easy to manage in the financial system, like hard commodities, real estate, forests, they're all sorts of things, you could think about certificates and with the world of ESG, some of those things could be much better managed using tokens. And then also tokenized currencies where real currencies, fiat currencies or proxies for fiat currencies, we also think could be quite interesting. 
Now all of this is over the course of the next few years. The actual dematerialization of assets from paper into technology back in the '60s and '70s, took a long time to actually happen. It was not coincidentally happening with the rise of computing in business. Now we've got a new technology. The rise of that in business, we think, is going to be important. But I'm not going to put an exact time scale on it, but it's years, maybe it's even decades for full adoption. But we thought that with a longer-term view, this was an important space. 
Now we're not spending a ton of money on it, but we're deliberately investing in smart places in that ecosystem so that we are prepared to be there for our clients over the long term on this important journey.",neutral,0.0553,0.0235,0.9211
18,Michael Lawrence Mayo,,"And what was the tipping point, just as a follow-up, the tipping point for you to really highlight this? I mean this is front and center here. This was the third area that you've mentioned investing. You said Pershing X, collateral, digital assets, real-time payments. This was #3 on your list. So certainly, it's moved up in priority. And crypto has been around a little while now. What was the tipping point here? Was it a new survey of your clients? Did you see something in the market? What's changed?",neutral,0.0891,0.0287,0.8823
24,Robin Antony Vince,,"So I mentioned the survey. The survey wasn't the tipping point, but it was an affirmation. But the answer to your question is client demand. Our clients want institutional-grade custody and solutions in this space. And I enjoyed a quip that I read in the media maybe a year or so ago, which is, ""You know what, it's not a real asset until BNY Mellon say they'll look after it.""",neutral,0.1372,0.0199,0.8429
