Speaker ID,Speaker Name,Speaker Company,Text,Sentiment Label,Positive Score,Negative Score,Neutral Score
2,Michael P. Santomassimo,,"Yes. Vivek, it's Mike. I think Todd highlighted a little bit of that in his scripts, where we are as focused about driving efficiency in our technology spend as we are anywhere else in the company. And we reduced the number of apps by 10%. There's another 10% coming, so it's over a 20% reduction of our apps. And as we sort of make these investments in the underlying infrastructure and application, it makes the next set of investments we want to make that much more efficient, cheaper, faster. And so it's something you're already seeing in the spend that we're making.",neutral,0.2519,0.2512,0.4969
16,Vivek Juneja,,So do you have a range or something on the operating margin where you think you can get to with all of this tech spend as we look out a year or 2?,neutral,0.0936,0.0161,0.8902
2,Michael P. Santomassimo,,"Yes. Look, we haven't given you a view on go-forward operating margins, Vivek. But as I said earlier, I think as we sort of get through to -- through the short term and medium term on net interest revenue, we do feel confident that the model still holds, where we'll be able to deliver for a little bit of revenue growth a pretty significant amount of earnings growth. And I think that implies expansion in operating margin at that point. So I think I would just sort of model it that way. I think the guide we gave you a while ago now, at Investor Day a couple of years ago is probably a good way to think about it still.",neutral,0.3539,0.0145,0.6316
16,Vivek Juneja,,"One last one for you, Mike. Your reverse repo yields fell pretty sharply, the one that -- the way you have it on the balance sheet, the lowest level we've seen in 5 quarters. How should we think about that? Is that -- that drop?",negative,0.0091,0.9602,0.0307
2,Michael P. Santomassimo,,"Yes. The Fed reduced rates and the September -- the peak in reverse repo spread in September didn't happen again, those 2 drivers.",neutral,0.0849,0.2806,0.6346
17,Thomas P. Gibbons,,"I know you like to do the arithmetic there, Vivek. But we look at that -- since it's no way but down, the size matters, the spread matters and then the overall rate matters. But ultimately, we're generating a spread that's been no way but down, and that spread has been reasonably consistent. But in the third quarter, we saw the spike with an unusual activity in the repo market.",positive,0.6534,0.0927,0.2539
0,Operator,,And our next question comes from the line of Mike Mayo with Wells Fargo Securities.,neutral,0.0356,0.033,0.9314
18,Michael Lawrence Mayo,,"You mentioned retiring apps. You've retired 10%, 10% more to go. What's the total number of apps that you have? And I don't think this is completely related, but what percent of apps on desktops are web-based versus having old versions of code support them?",neutral,0.0296,0.0566,0.9138
17,Thomas P. Gibbons,,"I'm going to turn this one over to Mike, Mike. But in terms of the -- we don't disclose the total number of apps. I don't believe we've disclosed total number of apps that we've got, but we've obviously got a pretty careful inventory of those apps. And part of what we're doing in our resiliency build-out in infrastructure investment is also making ourselves more efficient by really the sunsetting of some of those applications. And so I'm pleased that we're down 10%, probably closer to 12% now, and we've got another 10% or so that we'd probably take out over the course of the next 12 to 18 months. So I can't really get into the specifics of where those apps are in terms of web-based.",negative,0.0142,0.9329,0.0529
2,Michael P. Santomassimo,,"Yes. I'm not -- I think that I'm not sure that's the right way to think about it. Not all modern apps are web-based apps. But I think you should assume that many of the tools that our folks are using are continued -- are always getting better and we're always investing in those. And that gets -- we have -- every weekend of the year, there's something that's being rolled out across our product suite to either internal folks or external folks, and that improves the way they work, so I think that...",neutral,0.2336,0.0132,0.7532
17,Thomas P. Gibbons,,"Yes. In terms of productivity tools, we are rolling out the most -- the office -- I mean the cloud version as Microsoft Office 365. And one of the things that we're also doing is our operations -- we get over 1 million client e-mail inquiries each year. And we are developing AI around making that much more productive and responsive in responding to it. So we're continuing to invest a lot in productivity, and the infrastructure build that we have -- that we're making, I think, will help us do that as well.",neutral,0.3134,0.0112,0.6754
18,Michael Lawrence Mayo,,"And then just one follow-up. So just generally speaking, you said you're spending more in technology. What was that, $3 billion going up to what number? I'm not sure if you said that, if you are willing to do so. And where -- when do you think that turns? Like if you -- if we think of it going down the J-curve, when do you come up the other side with these investments? Is that like a year or 3 years or 5 years?",neutral,0.0362,0.0402,0.9237
17,Thomas P. Gibbons,,"Let me make one comment and Mike might get you more of the details. As we've really picked up the tech spend over the past 3 years, I would say the rate has come down slightly, although the total amount continues to go up because it's now a little bit of a bigger base. But the rate of growth has probably come down. I don't know, Mike, if you want to simulate the J-curve is, meaning think through how quickly we amortize infrastructure...",negative,0.0623,0.7466,0.191
2,Michael P. Santomassimo,,"Yes, I mean look, Mike, I think the way we think about the tech spend is it's not a we're shooting to spend a certain number. What we're doing each year is looking at how much can we actually execute, what are the business cases, how do we think about like the return we're going to get on them and, most importantly, like can we successfully sort of execute it and do we have people in place to do it. And I think that's driving -- and that's going to be the constraint that we've got in most years, is making sure that we can execute it well. 
And I think right now, we feel it's important to continue to make those investments because that's what's going to differentiate us going forward. And keeping in mind that we've got to deliver bottom line -- on bottom line as well, and so we're trying to find the balance there to make sure that we're doing the right thing by all of our stakeholders. And so that's the way we sort of go about how much we're going to spend in any given year.",neutral,0.1186,0.0159,0.8655
17,Thomas P. Gibbons,,"Yes. So the -- so it's a really good plan. So as we look out to next year, I don't want to predict this. If there's not an ROI on the spend, we'll bring it down. But right now, we believe there is.",negative,0.0694,0.484,0.4466
2,Michael P. Santomassimo,,"All right. It looks like that was the last question. Thank you, everyone. We'll talk to you next time.",neutral,0.057,0.0246,0.9184
17,Thomas P. Gibbons,,Thank you.,neutral,0.1625,0.014,0.8235
0,Operator,,Thank you. This concludes today's conference call webcast. A replay of this conference call webcast will be available on the BNY Mellon Investor Relations website at 2:00 p.m. Eastern Standard time today. Have a good day.,neutral,0.0666,0.017,0.9163
