Speaker ID,Speaker Name,Speaker Company,Text,Sentiment Label,Positive Score,Negative Score,Neutral Score
0,Operator,,We will now take our next question from Brennan Hawken from UBS.,neutral,0.0315,0.0442,0.9243
6,Brennan Hawken,,"A couple of follow-ups on deposits. So Emily, you've previously indicated that you had expected by the fourth quarter that deposits on an average basis would be down 5% to 10%. They were actually down -- they're already down 7% based on the 3Q average. Should we still think about that range of 5% to 10%? Or might that end up being different? And maybe if you could update on how beta is tracking in your expectation there, too.",negative,0.0119,0.9328,0.0553
19,Emily Hope Portney,,"Sure. So you're correct, I did guide, I think it was around second quarter that we'd expect a decline of about 5% to 10% by -- well, average to average Q2 to Q4. In the third quarter, as you also rightfully pointed out, deposits down 7%. Now that's in part due to the strengthening of the U.S. dollar, which was a headwind of about 1% and also just seasonality, just that you normally see lower deposit levels in the third quarter. 
For the fourth quarter, we are anticipating a decline of about 3% to 4%. And as I mentioned before, we expect it to be mostly in NIBs as the percentage of NIBs as a total of our deposit base kind of reverts back to pre-pandemic levels. 
And like anything, there's a lot of uncertainty out there. So this is what we are anticipating based on the forward curve and ultimately, the forward curve and what we have been seeing so far this year. 
In terms of betas, betas do continue to be a little better than we had anticipated. Just as a note, they do vary widely by line of business. So Treasury Services and Markets are -- certainly have much higher betas than, say, Asset Servicing or Corporate Trust. So it's just important to keep that in mind. 
Looking ahead, we do expect marginal betas to continue to ramp higher as rates continue to rise. But at the end of the day, we do think that they will largely retrace what we saw in the last cycle and so ultimately end up higher than where they are today. And again, I would just say that's just another factor. Whether it's deposit balances or betas, those are all factors that are somewhat uncertain based upon the macroeconomic backdrop.",negative,0.0497,0.878,0.0723
6,Brennan Hawken,,"Yes. Okay. And then another sort of related question. Helpful to get full year 2022 NII expectation for sure. But when we step back a bit and think about -- I know it's too early to comment on next year, but just sort of generally speaking, at this point, we've gotten back to triple-digit NIM. Rates continue to be pretty robust. You think that your beta is going to largely retrace the last cycle, as you just said. Is there any reason why the NIM can't retrace the prior cycle NIM? 
And when we think about the security reinvestment tailwinds for 2023, any reason why, once policy rates stop moving higher, you're going to largely see some stabilization? Because that's what kicks off most of your deposit repricing and then you've got a tailwind from reinvestment that continues to flow through into 2023. Is there anything wrong with thinking about things that way? And how long do you think it might take for the NIM to -- is it possible to retrace the last cycle? And how long do you think that might take?",neutral,0.0753,0.0697,0.855
19,Emily Hope Portney,,"Well, there's a lot there, so let me try to unpack it a bit. As you have seen from our financials, we've seen several consecutive quarters of sharp increases in NIM. We do expect another step-up in the fourth quarter and even beyond the fourth quarter based on a lot of the factors that you mentioned. We do expect that NIM will continue to expand but probably at a slower rate. 
In terms of portfolio positioning, we do actually think that rates will continue to surprise to the upside. And so we're therefore really positioned for greater asset sensitivity. But of course, we'll continue to be nimble there. And as we think about the portfolio overall, obviously, we're managing it with the objective of optimizing capital, liquidity as well as NIR.",positive,0.7232,0.0234,0.2534
0,Operator,,We will now take our next question from Brian Bedell from Deutsche Bank.,neutral,0.0326,0.0367,0.9307
7,Brian Bertram Bedell,,"That was kind of my question on net interest income as well. Maybe just one point on that, just technical on the Fed funds purchased spread, that's on the asset and liability side, I see that spread went up to about $72 million in 3Q versus $38 million in the second quarter. I guess how should we think about that book? As more of a matched book with a spread sort of contained in that area? Or actually, is that poised to dramatically rise in the next couple of quarters?",neutral,0.3617,0.0313,0.607
19,Emily Hope Portney,,"Yes. I think on that particular question, I think it's just best to follow up specifically with IR. If you're asking more specifically about the kind of the outlook for NIR, which is kind of the broader-based question. Based on the forward curve that we see today, we would probably expect some growth from our Q4 exit rate. 
And just to kind of talk a bit about the drivers there, of course, as I mentioned earlier, we expect central banks to continue to increase rates and they’ll probably remain elevated for most of the year. We do think that a large majority of the deposit outflows will be behind us by year-end. And again, that's largely because our client base is institutional, more rate sensitive than sensitive to the size of the balance sheet. We could have a little bit more runoff, but we do expect also some organic growth. NIBs, as I've already talked about, and marginal betas will increase. So all of those factors just are kind of coming into the fact that we would expect some growth from our fourth quarter exit rates. Of course, lots of uncertainties.",positive,0.7908,0.0274,0.1818
7,Brian Bertram Bedell,,"That's great color. And maybe if I can pivot to the organic growth initiatives that you talked about in your prepared remarks, Robin. Maybe if you could just focus on real-time payments. You've talked a lot about Pershing X recently and, of course, the digital platform. But maybe just if you can talk a little bit about sort of the -- what you're thinking in that area, and to what extent you think these initiatives can enhance that organic growth rate? I don't know if it's too early to put out a target there for 2% or 3%? Or do you think we're going to stay in the sort of 1% plus range for a little while?",neutral,0.1269,0.0151,0.8579
24,Robin Antony Vince,,"So it's a little too early for a specific target. As I mentioned in my prepared remarks, we're working through all of the various different businesses, understanding the priorities for each one. And as we come out of all of that, we'll have a better sense on that part of the question. But let me talk about real-time payments because I think this is quite interesting for a few different reasons. It is a new payment rail. And whenever there's a disruption or a change in the ecosystem, you have some degree of change in sort of the established order or at least the opportunity for that disruption. And so for us, we think that those opportunities don't come along every day. And so we're quite focused on taking advantage of that. 
But it's also part of a broader solution set because providing faster payments is nice and safer payments is good. But when it's combined with the ability to do digital invoicing in the request for payments and when that's combined with payment validation, fraud protection and other data services, they can become very interesting solutions for clients. And we view ourselves as not just a payment provider but a platform provider for entry into the banking system. 
And we think this is where it overlaps very nicely. You'll remember that we cover 97% of the world's top 100 banks. That makes us -- with that installed customer base and then the leadership on the product side, it makes us a very appealing partner for FinTechs and regional banks as they are thinking about wanting to take advantage of all those capabilities, but either because they don't actually want to be a bank in the case of some FinTechs or in the case of the fact that it's very expensive to make all of this investment, and we've done that in the case of other regional banks, we're now providing access to RTP, Zelle, account validation, soon-to-be FedNow, white-label solutions and with the real-time invoicing. 
And we think that whoever gets that collective set of rails up and running, really frankly has an advantage. And as you know, we were the first bank to make real-time payments. We were the first to launch a real-time e-billing, and we're leading in the whole process with FedNow as part of that rollout as well, working very closely with the Fed and other banks as well. 
So it's for all of those reasons that I think this is an interesting space. We haven't put a number on it, but we're certainly getting franchise traction.",neutral,0.1666,0.0125,0.8209
0,Operator,,And our final question comes from Gerard Cassidy from RBC Capital Markets.,neutral,0.0392,0.0249,0.9359
10,Gerard Sean Cassidy,,"Emily, can you share with us your way you guys are managing your securities portfolio, in view, I think you said you think rates will be going higher as we go forward in terms of the strategies of moving some into held-to-maturity versus available-for-sale to protect you on the AOCI. And as you go forward, how are you looking at the AOCI issue?",neutral,0.1695,0.0152,0.8153
19,Emily Hope Portney,,"Sure. So as I did say before, we do expect the environment to remain volatile and actually rates to continue to surprise to the upside. And frankly, we really would need some change in tone from central banks or some evidence that inflation is declining probably to change our view on that. 
So we are continuing to position the portfolio for greater asset sensitivity. Year-to-date, we have reduced DV01 by about 50%. Duration is also the lowest it's been in a really long time. You do mention that certainly, we did also take measures earlier in the year to protect against AOCI volatility. And so we did move a portion of the portfolio, about 40% of it now is in held-to-maturity. That certainly has helped with diminishing AOCI unrealized losses. They would have been more, of course, than they have been if we had not taken that action. But ultimately, the portfolio is positioned for greater asset sensitivity. 
Having said that, we are going to be very, very nimble, and should the environment change, we do benefit actually from the fact that 60% of the portfolio is designated as available-for-sale and has a short duration. So we can be pretty flexible and act very swiftly.",positive,0.4301,0.4148,0.1552
10,Gerard Sean Cassidy,,"Does it make sense since you have so much in available-for-sale and you're an advanced approach bank, so it's already going through your CET1 ratio, to actually take some realized losses and then redeploy those funds at higher yields?",neutral,0.1086,0.0391,0.8523
19,Emily Hope Portney,,"We feel very comfortable where we are in terms of held-to-maturity. We really want to retain flexibility and also certainly want the flexibility around, not only managing interest rate risk, but of course, liquidity as well.",positive,0.6902,0.0103,0.2995
10,Gerard Sean Cassidy,,"Very good. And then just as a follow-up question, I know you've touched a lot about your deposits today in your answers to questions, just one last question on deposits. QT now is in full speed operation here in the United States. Have you noticed any change in the deposit outflows since we've gone to the $94 billion, $95 billion a month? And how do you -- I know you pointed out deposits are going to come down in the fourth quarter. But when you look out to next year, is that going to change your thinking at all? Or is it behaving as you expected?",negative,0.0531,0.6308,0.3161
19,Emily Hope Portney,,"Yes. I think as I indicated, deposit outflows are behaving pretty much as we anticipated. We do think the lion's share of the runoff will be behind us by the end of this year. And why we think that -- our client base is predominantly institutional, in the past and even now they've proven to be much more sensitive to rates than actually just the size of the Fed's balance sheet. 
Also, just as a reminder, our businesses are much bigger. They've grown significantly since what we've seen in the last cycle. So Treasury Services is much bigger, AUC/A and Asset Servicing is much bigger. With that comes just naturally more deposits. And even what we've seen in the runoff, as I suggested or said before, it's been mostly nonoperational. So I think we feel pretty good about our expectations here and that the large majority is behind us. 
Having said that, could there be more runoff? Yes, I mean there's so much uncertainty, whether it's interest rate volatility, the levels of the RRP, macroeconomic uncertainty in general. So that's our best guesstimate based on the forward curve of what we've seen thus far.",neutral,0.2754,0.0514,0.6732
0,Operator,,"And with that, that does conclude our question-and-answer session for today. I will now hand the call over back to Robin with any additional or closing remarks.",neutral,0.0318,0.026,0.9422
24,Robin Antony Vince,,"Thank you, operator, and thank you, everyone, for your interest in BNY Mellon. If you have any follow-up questions, please reach out to Marius and the IR team. Be well.",neutral,0.1116,0.0124,0.876
0,Operator,,Thank you. This does conclude today's conference and webcast. A replay of this conference call and webcast will be available on the BNY Mellon Investor Relations website at 2:00 p.m. Eastern Standard Time today. Have a great day.,neutral,0.0992,0.0145,0.8863
