Speaker ID,Speaker Name,Speaker Company,Text,Sentiment Label,Positive Score,Negative Score,Neutral Score
35,Stephen Biff Bowman,,It is swap that -- yes. Yes.,neutral,0.125,0.0157,0.8593
5,Betsy Lynn Graseck,,"Okay, okay. And then on the Fed growing the balance sheet, I mean, they've obviously been doing some temporary open market operations just recently going to the promos. I heard you said about the QE. Have you seen any benefit from this? I mean, it's been about a month or so.",neutral,0.1638,0.0499,0.7863
35,Stephen Biff Bowman,,"I would say not. We have not seen any extraordinary sized flows from that at this point. So I'd say that's still pretty early, would be my intuition. It's pretty early to see. And hopefully, in a couple of months, we will have a better line of sight to that. But right now, I would say no, we've not seen any impact.",neutral,0.2556,0.0424,0.702
5,Betsy Lynn Graseck,,"Okay, okay. And then just lastly, a little bit more strategic question. But we talked a little bit about how you're investing in a variety of different technologies to improve your own processes as well as in some areas of [ where you're ] growing more rapidly. I wanted to understand the rationale for transferring the private equity blockchain technology platform to Broadridge. How is that enhancing your strategic focus and drive?",neutral,0.2249,0.0098,0.7653
35,Stephen Biff Bowman,,"Yes. At that point in time, I think we felt that the distribution opportunities and the growth opportunities with Broadridge were just better moved through their pipe, if I can say that, than they were through ours. But we know we have a client base that helped us deliver that product and capability, and it's one that we think we can and have commercialized inside our own group. But the ability to grow that, I think, more assertively through Broadridge was really beneficial for everything. Mark, if you've got anything else.",neutral,0.4102,0.0099,0.5799
34,Mark M. Bette,,I think that's the best color. It was the best commercial decision for us and that's what we decided on.,neutral,0.1706,0.0128,0.8166
5,Betsy Lynn Graseck,,"But you were focused on using blockchain technology or either utilizing it or enabling it for your clients is still intact. Is that accurate even though you transferred it? Because you're a user of their platform, right?",neutral,0.064,0.0214,0.9146
35,Stephen Biff Bowman,,"Yes, sure. And I want to be clear, that was just one application as it related to sort of fit the private equity field. We're using it in much broader applications than just that field. But that was one where we thought there would be perhaps a commercialization that would be better enhanced through that vehicle and ownership structure than directly owned by us, if you will. But we're using it in a variety of other type of clearing and product capabilities for our clients.",neutral,0.1122,0.0098,0.8781
0,Operator,,We'll now take a question from Brennan Hawken with UBS.,neutral,0.0388,0.0258,0.9355
6,Brennan Hawken,,"Biff, congrats on your retirement. Wish you the best. I'm sure the golf game will improve. You'll get tickets to the Northern Open in the future.",positive,0.789,0.0115,0.1995
35,Stephen Biff Bowman,,"Yes. It's got a lot of room to improve, Brennan.",positive,0.8854,0.0094,0.1053
6,Brennan Hawken,,"Tell me about it. So on NII, just circling back there. Thanks for all the color on that, really appreciate it. Curious about a couple of different components. Number one, when we look at the forward curve, it looks like the forward curve suggests also a cut in December. And so I know that will be late in the quarter so probably wouldn't have a big impact on 4Q. But should we count on an impact, a comparable impact going forward? Or are your assumptions around beta such that further cuts beyond the next one will have an increasing impact because you're getting -- you would be getting a little bit lower on the deposit cost side, and therefore, less room on that front? Just any additional color you could give there would be great.",neutral,0.1472,0.1284,0.7244
35,Stephen Biff Bowman,,"Okay. So I'll try to peel that apart a little bit. So a December cut would have nominal fourth quarter impact, you're right on that, but it wouldn't have 0 impact. I want to be clear on that. That's why we gave a range earlier because it depends on if pricing started to anticipate that earlier than the actual cut itself and you know how that works. 
In terms of the impacts in the 2020, we're not going to give guidance out to 2020 at this point. There are just so many variables to that. But that being said, I think we've talked about the betas, we think, being relatively symmetrical, and I think we think that's how it is. And they are -- as you will pull apart, if you look again at the institutional dollar betas, they were pretty high and that's where they were on the way up, they were pretty high now. I think they would have some symmetry on the way down, so they would probably start to pull back a little bit. I don't know if that's with 1 or 2 or 3 highs, that would be speculation. I don't know where that point of symmetry sort of hits, but I think we would just sort of model something that looks relatively symmetrical from what we saw on the way up.",neutral,0.0662,0.0647,0.869
6,Brennan Hawken,,"Okay. So -- and just to clarify, like, on the way up, we saw the ramp in betas steadily increase. And so therefore, you guys are starting high and then would -- you'd see the mirror image of that, so betas would decrease.",negative,0.3686,0.4549,0.1765
35,Stephen Biff Bowman,,"Yes. So I think, Brennan, if we go back, if you remember, the betas were quite low for several hikes. And then they -- the curve starts to steepen, right, through all the symmetry around that. So perhaps, the betas are quite high for some period and then start to come down. I just don't know, is that one hike away? Is that 2 hikes away -- or excuse me, 1 cut, 2 cut or 3 cuts away? I don't -- that would be speculating. I don't want to do that. But I think it's symmetrical look to the way they float on the way up and the way down.",neutral,0.0582,0.2998,0.642
6,Brennan Hawken,,"Got it. Okay. That's clear and totally logical. And my next question is on the excess reserves commentary. Just curious, it seemed like Northern didn't really get hurt, especially versus some of the larger trust bank competitors when reserves were getting drained from the system. So I'm kind of curious as to why you would think the inverse would happen. Why would you benefit with an expansion of reserves, especially relative to some of the larger competitors?",neutral,0.1308,0.101,0.7682
35,Stephen Biff Bowman,,"I think as a general rule, as the rates get closer -- I think this is your question, as the rates pull back down closer and closer to 0, because we're a asset servicing provider to $11 trillion of assets under custody and administration, we've become somewhat of a natural home for what I will say are cash balances that may be indifferent but want a very financially strong liquid provider. So there's just some natural benefit of that, the tide floating all boats kind of thing like that and coming with it. And so you've got large hedge fund clients or others who say, ""I'm indifferent now to a series of investment options."" 
I will say this time, Brennan, what I think is different is money market reform has happened and government funds and things that -- like gates and other things that were in place, some of those things have been addressed in money market reform. So the ability to have those balances not sit on a bank balance sheet that go to a fund, so they could get paid roughly 0 at a financial institution or get paid roughly 0 on a fund, they may be -- they may consider that more than they have in past cycles where rates have gone low. 
So we'll have to see how that plays out. And it depends on how low rates get. I think the rates have to get lower than 1 or 2 more cuts before we would see that kind of impact. It would have to be something that gets close to where we were right after the crisis.",neutral,0.0878,0.0993,0.8129
0,Operator,,We'll now take a question from Brian Kleinhanzl with KBW.,neutral,0.0389,0.0214,0.9397
8,Brian Matthew Kleinhanzl,,"A quick question on the comp expense. You said it was up and staffing was up 1% quarter-on-quarter. If you go back the past couple of years, you see an uptick 4Q to 3Q as well in comp expense. Is there any reason to think that wouldn't be the same case this year?",positive,0.6391,0.0528,0.3081
35,Stephen Biff Bowman,,"So I'd have to look to see. I mean there may have been -- there is some incentive compensation that's variable at some point in the fourth quarter. That might be driven by how pretax income goes. As far as the comp sequentially this quarter, one thing that definitely is different than prior years is that we, in the prior years, have had -- we've had, I think, last year about $10 million of equity retirement-eligible expense that was in the second quarter that fell off in the third quarter. We did not have that this year, all of it was in the first quarter. So second to third this year is a different picture than what it would have been in 2017 and 2018. 
The other thing I would say about compensation as well. Last quarter, we did mention that we had charges, $5 million of charges. Only $2 million of that was in compensation, about $3 million of it was in outside services. We did have charges this quarter as well. Now we've gotten away from calling those out because we think we're more on a business-as-usual environment with those charges. But I would say when you look at compensation, the charges this quarter were actually pretty comparable to what we had in the prior quarter. So that's another part. 
So if you were expecting a decline because the charge is rolling off, we did have some charges in the quarter. But like I said, until they -- if they were to rise up again to a higher level, certainly, we'll call them out. But at this point, we feel like it's more of just business-as-usual activity.",negative,0.0842,0.5747,0.3411
8,Brian Matthew Kleinhanzl,,"Okay. And then just a separate question. In C&IS, is there any way to kind of give any color on what new business wins were in the quarter on installed pipeline? I know you've kind of gravitated away from doing that in the past, but any type of color would be greatly appreciated.",neutral,0.0871,0.0208,0.8921
35,Stephen Biff Bowman,,"Yes. We -- you're right, we've gravitated away from that. We don't provide that. I would say we continue to see strong new business wins installed in the quarter. We continue to see a very solid and strong pipeline really across the globe. But particularly, we've seen a real strong interest in the Asian market, in Australia in particular, and a substantial win that I think we published. We did press release World Bank as a win. So that was a very high-profile win that was issued in a press release in the quarter. 
So we continue to have strong growth. And as we said, we really look at it more as an organic growth story for us across the fee line, and we were pleased with where we were from a trajectory standpoint in the quarter.",positive,0.8645,0.0127,0.1228
0,Operator,,Your next question comes from Jim Mitchell with Buckingham Research.,neutral,0.0342,0.0401,0.9257
45,James Francis Mitchell,,"Maybe just one last kind of follow-up on NII, and just thinking through. It seems to me that there's been pretty high betas in Europe. So just getting kind of your view on if there are further cuts there, is that actually -- are you actually liability-sensitive in Europe? Or is it neutral? And then when I think about looking further out, do you have any -- you've talked about extending duration as offsets and things like that, do you have any further kind of ability on the asset yield side to kind of offset some lower rates given how conservative your balance sheet's been?",neutral,0.2169,0.0611,0.7221
35,Stephen Biff Bowman,,"Yes. So in Europe, you're right. On the euro, in particular, the beta was high. And that can be both a factor. We moved obviously a relatively high beta -- or a very high beta with the euro move. And some of that could have been that our rate was actually attractive in that market and that we were catching up from the rate being slightly ahead of the market, if you will, or slightly better than the competitive landscape, which could move that beta a little bit higher than perhaps even the move that you saw there. But -- so that's a driver there. 
And then I think it's important to understand our client base. We have clients that are on  -- some are on standard rates and some that are on, I'll call it, more specialized rates, custom rates. Some of them move immediately with sort of central bank rates, IOER or ECB. So they'll move really with almost 100% beta, right, with those. 
In terms of the duration of the balance sheet, we've moved the duration of the portfolio out to about 1.6 years from an index duration perspective, which as you know, we typically have run a very short duration portfolio closer to 1, 1.1. But we have done some things in light of what we think could be a continued decline in rates. And so we have moved that duration out in the portfolio to help soften some of that and help deal with asset yield issues that you talked about.",neutral,0.2655,0.0927,0.6418
45,James Francis Mitchell,,And is there room for that to do anything else to -- whether to duration out more or flip some of your cash into U.S. rates out of -- from Europe? How do we think about what you can do in your mix to help offset pressure?,neutral,0.0968,0.0122,0.891
35,Stephen Biff Bowman,,"So the answer to the first part of that is yes, that is a decision that our ALCO committee makes every month. But there is, I think, still room to take that duration out. And from the benefit of the call, we're really not taking any credit risk in that duration. We typically extend the duration of our balance sheet through the use of longer-dated treasuries. So that's the way we get there and we do. But we evaluate that through our ALCO committee regularly, but there is still capacity to take that duration out. 
In terms of swapping currencies into dollars or whatever to get the yield enhancement, the swap rates on that have made -- and the cost of doing that, quite frankly, have made that, in many cases, an unattractive trade. So -- and we always have -- we have generally tried to invest largely in the currency -- in currency, in support of our clients and the balance sheet. So they've invested in euros, they've laid their balances off in euros. Their balances would be in euros or sterling, et cetera. But there are, occasionally, opportunities that we can do that swap. But right now, swap rates would make that neutral [indiscernible]. Yes.",neutral,0.0756,0.0437,0.8807
0,Operator,,We'll now move to Mike Mayo with Wells Fargo Securities.,neutral,0.0392,0.0157,0.9451
18,Michael Lawrence Mayo,,"So I think I heard that Value for Spend is 90% done and that your spending initiatives for revenues, inflation and technology should outpace organic growth. Therefore, you need to find productivity savings. So got that. So under the category of productivity savings, what do you have in the way of potential technology saves? For example, how many data centers do you have? Where were they at peak? Where could that go? Or maybe you want to measure that in terms of number of servers. Moving to the cloud what percent are your -- you have been able to get to the cloud? Where are you now? Where would you like to go? But just more generally, what are the technology-driven productivity savings that you could see going ahead, especially now that Value for Spend is in the late stages?",neutral,0.0769,0.0247,0.8984
35,Stephen Biff Bowman,,"There's a lot in that question, Mike. So you're right. So we have absolutely have an ongoing process to look at all the things that you described in there. For instance, number of data centers. We outsource the managed services, for instance. So we've talked about here, where we have looked at things like our mainframe maintenance and others that we've used. There's opportunities to do that technologically with someone else at a lower cost. 
We're looking at, very strategically with our Board and our technology group, is the cloud strategy for the firm? I'm not going to comment on that in this call, but that's something that is actively engaged with the Board and others. So it's going to be the primary driver of our productivity has to be in the space of technology because it's the largest part of our spend. So I know that's obvious to you, Mike. But I mean, if we don't get the kinds of savings you talked about, consolidating data centers, cloud-based solutions, et cetera. 
I will say what we've done a pretty good job of, Mike, is not running as many duplicative systems. I think we've looked and consolidated across our organization and where we were running multiple applications to do similar services. I think we've done a pretty good job of consolidating that, although I know that we're still looking at the number of apps that we have, if you will, inside the firm in trying to maximize and reduce that. So probably the single largest effort we have right now is around understanding that technology spend and how we can drive that through productivity.",neutral,0.1175,0.0214,0.8611
18,Michael Lawrence Mayo,,"Well, that helps you get some useful context around that. And just one more time on specific numbers. Do you just -- I'm not saying many do, but the number of asset you have and the number of data centers that you have or at least what you mean when you say mainframe maintenance move to like a third-party data provider, like a data center provider, are you thinking of using one of those?",neutral,0.0391,0.0277,0.9332
35,Stephen Biff Bowman,,"So the -- for instance, if we use a provider of that mainframe, we had our own staff that did the upgrades and maintenance on that. There are firms who provide the hardware and other items for that mainframe, who also have staff that can provide that maintenance. We've done that, instead of having our own staff. But that's a productivity pickup for us because we had our own staff to do that, and there's others who can do it for better cost advantages. So that's how I would describe that, is what that means.",neutral,0.0898,0.042,0.8681
0,Operator,,We'll now take a question from Rob Wildhack with Autonomous Research.,neutral,0.0449,0.0189,0.9362
22,Robert Henry Wildhack,,"One more on organic growth, and appreciate the commentary on the alignment of expenses and revenue growth there. But can you remind us on the level of organic growth where those 2 started to decouple a little more and positive operating leverage would really start to show up?",neutral,0.2612,0.0149,0.724
35,Stephen Biff Bowman,,Can you ask that one more time? I want to make sure I follow that.,neutral,0.0761,0.0198,0.9041
22,Robert Henry Wildhack,,"I think you're talking about aligning expense growth and organic revenue growth. And so I'm wondering if there's a given level of revenue growth where the expense growth might not need to stay as closely aligned, and you can really see some operating leverage.",neutral,0.1908,0.0427,0.7665
35,Stephen Biff Bowman,,"Yes. Okay. I don't know exactly where that point would be. But in general, in our 2 businesses, it could be a little bit different. So in our asset servicing business, for instance, there's a required level of expense to generate probably every point of organic growth right now. For most of that, it depends on which business line. If it's traditional custody, that's highly leverageable, there's less expense needed. If it's fund administration, fund accounting, it needs more expense. It has a little bit more, I'd say, a larger expense base that needs to go with it. 
In the wealth space, pretty highly leverageable there. So the expense required to grow that point of organic growth there could be different. So I think that's what you're asking, is we could get continued growth. I don't know that there's ever a point where the expense growth stops and the organic revenue continues. I think there's always a piece of that that's needed to get that  through that. 
So -- but there is certain lines of businesses that are more leverageable than others that widen that gap out. And we've had great success in some of those lines. Particularly, Wealth has had a  strong growth rate that you can see in their line versus their industry and their competitors.",neutral,0.1375,0.0259,0.8366
0,Operator,,"And it appears there are no further questions, so we would like to thank you all for your participation. You may now disconnect.",neutral,0.0348,0.0529,0.9122
35,Stephen Biff Bowman,,"Thanks, everyone.",neutral,0.2199,0.0354,0.7447
