Speaker ID,Speaker Name,Speaker Company,Text,Sentiment Label,Positive Score,Negative Score,Neutral Score
37,James Francis Mitchell,,"Okay. That's helpful. And maybe one other question on deposit betas. It seemed like this quarter, at least on an aggregate level, your deposit beta was -- has actually slowed versus the last 3 or 4 quarters. I think some of your peers are mentioning accelerating deposit betas and high competition. So just trying to get a sense of maybe the difference that you're seeing. Are you seeing that competitive pressure on deposit rates? It doesn't look like it. Just maybe talk to the deposit beta this quarter and where you think if anything's changed going into 2Q.",negative,0.0431,0.7776,0.1793
35,Stephen Biff Bowman,,"Yes. I caution you to look at 1 quarter's beta. We could be catching up, slowing down from previous moves that we've made. I think if you go back and look at our beta across the cycle, you would start with the rate cycles and hikes and go back to 2016 if you want to go back, our beta will look much more like you would expect across a longer horizon. So I think it's a little bit dangerous to only look at it from 1 quarter because we -- like I said, we could have slowed because we were comfortable with our positioning in a quarter or we could 
[Technical Difficulty]",negative,0.0263,0.8732,0.1005
37,James Francis Mitchell,,I think I lost you.,negative,0.0423,0.5978,0.3599
34,Mark M. Bette,,We'd be about 75-ish probably percent beta and then lower than that obviously on the retail.,negative,0.1247,0.4648,0.4105
37,James Francis Mitchell,,Sorry. I think my phone got cut out for half of your response. I'll follow up later.,negative,0.0184,0.7841,0.1975
0,Operator,,Our next question will be from Ken Usdin with Jefferies.,neutral,0.0352,0.029,0.9358
12,Kenneth Michael Usdin,,"Just a couple of quick follow-ups, cleanups, I guess. Biff, you mentioned earlier that the second quarter won't have the same stock-based compensation that the year-ago quarter had. Can you just tell us then again what was the magnitude of that a year ago? And so what -- how much will be absent this year relative to what was in last year?",neutral,0.0499,0.2307,0.7194
34,Mark M. Bette,,"Ken, it's Mark. We are having some audio difficulties on our end. Hopefully, what we're saying is coming through. But yes, you're right. So the last couple of years, you'll remember there was an extra expense that came through in the second quarter from the retirement-eligible grants. Last year, there was $11 million in the second quarter. So we had $32 million in the first, $11 million in the second a year ago. This year, we had $30 million in the first, but there will not be further retirement-eligible stock expense that would impact the second quarter because of the changes in the service requirements around the performance shares. So $11 million during the second quarter of last year, but this year we would not have that.",neutral,0.0975,0.1719,0.7306
12,Kenneth Michael Usdin,,"Got it. That's a nice year-over-year starting point helper. And then second one on the deposits. Biff, you mentioned that the customer-related deposits should be growing with the growth of the business. But obviously, the balance sheet has been net shrinking because again of that removal of liquidity and -- how has the core deposits been growing underneath the surface? And how can you help us like understand the inflows versus outflows in terms of trying to guess and estimate when that total earning asset base starts to bottom and turn the corner upwards?",neutral,0.1198,0.3812,0.4991
34,Mark M. Bette,,"Yes. Yes. Thanks. So the answer is at the core -- and it's hard to see in any of the financials we put out there, but I would say it's a general statement. At the core, we have seen that core operating balance has sort flattened out. It's hard to see, like you said, all the liquidity moving on and off the balance sheet, so it can be difficult to see. The other thing I would say too is when we say that the new business that we win comes with balances, some of the new business wins we've been having are administration in nature and they don't always come with balances. So the mix of business we win matters, too. Over time, we tend to win a broad-based mix of business, some which come with custody balances, some which come with administration. I would say we had more wins in the -- large wins in the administrative side that may or may not come with balances. It's one of the reasons you may see our AUC and AUC/A a little bit flatter but revenue still going up and fees going up because the mix of that business is different [indiscernible] with the balances. So you got the dynamic of the win mix [ matters ] and then you've got the dynamic of the underlying balance sheet because that's what I would call the liquidity flows or the excess balances moving around. You've seen that in our competitors. Underneath, the core operating deposits continue to be pretty stable.",neutral,0.0983,0.1761,0.7257
0,Operator,,"Our next question will be from Brian Kleinhanzl, and he's from 
[Audio Gap]",neutral,0.0291,0.0295,0.9414
8,Brian Matthew Kleinhanzl,,Just a couple of questions here. On the -- you had mentioned you're taking a while a bit more duration in the securities portfolio. Can you actually give what the securities duration is now and still how much is tied direct repricing on a [indiscernible] basis?,neutral,0.0375,0.0438,0.9188
35,Stephen Biff Bowman,,"So the duration of the portfolio has historically been closer to 1. And it moved up by 30% or something like that. The long end of the securities portfolio is longer than that. But [indiscernible] of the portfolio has moved up by that 30-or-so percent. And the second part of your question broke up, I apologize. Can you repeat?",neutral,0.2338,0.1004,0.6657
34,Mark M. Bette,,I think it may have been the exposure to the 30-day rates within the [indiscernible]?,neutral,0.0312,0.3625,0.6064
8,Brian Matthew Kleinhanzl,,"Yes, how much reprices in the next 30?",neutral,0.0465,0.0258,0.9277
34,Mark M. Bette,,"Yes. So on the securities side, the short end of the -- I should say, if you split the securities portfolio in half, a little bit more than half is the shorter portfolio. And there, we would say a lot of that would be driven by the 1-month, 3-month type of LIBOR moves with a little bit more weighted toward the 1-month side. So it does -- that part of the securities does reprice pretty quickly. And when you get to the longer portfolio, obviously, not all that is going to roll over in 1 quarter or even 1 year. That's kind of over the course of -- if for instance, if you're sitting with, on average, 2 years securities and it was a nice even book, in theory that means that 1/8 of it would roll through every quarter. That's not to say where we're at, but that's just an example of what you would have if you were staying with a 2-year book when you look at the longer portfolio. Does that help? We're having some audio problems here.",neutral,0.0532,0.095,0.8518
8,Brian Matthew Kleinhanzl,,"It does. And then just a second quick follow-up on the deposit runoff. I think in the past, you said that you've been able to capture as much as 2/3 of those deposits. Is that still -- is it now that's still true? Or is it a lot of that deposit runoff just running away from you in total?",neutral,0.0533,0.2254,0.7213
35,Stephen Biff Bowman,,"I think we've said we've captured about half of it, can move into a money fund and then half [indiscernible] to some other vehicle and [indiscernible] investment vehicle somewhere else or would lead. I don't know that I know if that's changed dramatically from what we've seen. So I think it is still -- we've seen growth in our cash funds, as you can see, particularly on the institutional side when we saw growth in our cash funds. So there's clearly [indiscernible] in the cash funds from the balance sheet, and we continue to look at an array of the opportunities for [indiscernible] balance sheet [indiscernible] cash funds. So we've been able to capture a meaningful portion through the company.",positive,0.5025,0.0203,0.4772
0,Operator,,And I'd now like to turn the call back over to our presenters to -- for closing remarks.,neutral,0.0499,0.0136,0.9365
34,Mark M. Bette,,"Thank you for joining us for the first quarter call, and we look forward to talking to you again in July. Thank you.",neutral,0.2044,0.0127,0.7829
0,Operator,,"Ladies and gentlemen, this concludes today's teleconference, you may now disconnect.",neutral,0.0207,0.0969,0.8824
