Speaker ID,Speaker Name,Speaker Company,Text,Sentiment Label,Positive Score,Negative Score,Neutral Score
34,Mark M. Bette,,"Yes, so on the C&IS line, I think that's what you're looking at the investment management fees. On a sequential basis, ex waivers, I think we were up about 6%. Probably 3/4 of that -- 2/3 to 3/4 of that came from market lift. So there was some sequential organic growth there. But I don't know if that's what specifically you're looking at.",neutral,0.3828,0.0328,0.5844
8,Brian Matthew Kleinhanzl,,"For the fee waivers. So -- I mean, it sounds like flow trends in there more positive?",neutral,0.3919,0.0292,0.5789
34,Mark M. Bette,,"Yes. There were some flow activity that we saw there. Like Mike had mentioned, we've been seeing good growth in ESG, some of the quant active products as well. But the waivers, they on a sequential basis, certainly kind of overwhelmed what we saw from both favorable markets as well as business flows.",positive,0.8239,0.0464,0.1297
0,Operator,,"That will conclude today's question-and-answer session. Mr. Bette, at this time, I will turn the conference to you for any final remarks.",neutral,0.0291,0.0246,0.9462
34,Mark M. Bette,,"Thanks for joining us today, and we look forward to seeing you in July for our second quarter update.",positive,0.581,0.0176,0.4014
0,Operator,,Thank you. And thank you all for your participation. This concludes today's conference. You may now disconnect.,neutral,0.0209,0.1125,0.8666
