Speaker ID,Speaker Name,Speaker Company,Text,Sentiment Label,Positive Score,Negative Score,Neutral Score
37,Jason Jerrome Tyler,,"Yes. And part of it is in this -- the deposits have just been so volatile and so you don't want to commit to significant movement in shrinking the balance sheet. And we want to be there for our clients. We've got plenty of capital. We've got plenty of room for a leverage perspective. And so just not anxious to quickly do any significant moves. And so to that extent, as deposits come down, you have the opportunity to then say, maybe we want to use some discretionary leveraging, again, we printed a 7.4% Tier 1 leverage, which is -- leaves you a lot of room. And so if we hadn't done leveraging that incremental leveraging would be even higher in the 7s. And at a point, you just have to say it just prudent to make sure you're taking advantage of the opportunities that exist. So.",neutral,0.2514,0.0397,0.7089
25,Michael C. Brown,,Okay. Great. And then I guess maybe just following up on that point there on the capital side. You guys increased the share buyback or you bought back about $100 million or so of stock this quarter. Any expectation on how that could progress from here? What should we think about in terms of your capital return.,neutral,0.1194,0.0147,0.8658
37,Jason Jerrome Tyler,,"Sure. Well -- sorry, yes, the overall theme of what you saw in this quarter makes sense in the near term, where you'd see us be in the market for share repurchase. The thing that worked against us, the AOCI actually worked slightly against us this quarter. Usually, in a neutral rate environment, the pull to par will give us some lift there. But it did in this quarter, that's fine. But even so, the $100 million we did is about what -- it's kind of -- that's the model we're thinking about. In the short run, big caveat is that the FDIC special assessment coming online, presumably in third quarter, that would be a similar dollar amount as what we did from a repurchase perspective this quarter. And so you could see us saying hold off for a quarter, get that payment done and then get back to your game plan.",neutral,0.1493,0.0235,0.8272
0,Operator,,Next question comes from Gerard Cassidy from RBC.,neutral,0.0291,0.0591,0.9118
10,Gerard Sean Cassidy,,"Jason, can you share with us -- I think you gave us the cumulative beta through the cycle of 68% and then the incremental beta, of course, is higher. And I think you touched on it this quarter may be 100%. The question is this, how is the beta behaving relative to past tightening cycles? I don't know if 2016 to '18 is cycle that really is that comparable? Maybe I have to go back a little further. And then second, how quickly -- if the Fed does start cutting rates cutting Fed fund rates in 2024 sometime, how quickly can you guys reduce your deposit costs?",neutral,0.1635,0.0491,0.7874
37,Jason Jerrome Tyler,,"Sure. Well, on the first, just to make sure I said it right earlier, the 100% going forward would be for the institutional side of the business, not for the overall deposit base. And Yes. 
Yes. And to the question of how does that compare historically it's -- this is higher than it has been historically. And there's different dynamics that you and I could talk about, I think, that are driving that. But there's very strong competition for deposits right now and for various reasons. And so we want to make sure that we're there for our clients. And we still -- we've got the ability to do that. And so we want to make sure that we're holding on to our fair share and providing that liquidity capability for clients. I think about reductions, the reductions can -- they can come quickly. And our -- the way we price, the way we the way our agreements work, we get fast movement on the way down. And so we should be able to get deposit costs down quickly as rates come down.",neutral,0.3115,0.0368,0.6517
10,Gerard Sean Cassidy,,"Very good. And then as a follow-up, you also touched on the volatility of deposits. Is it more -- based on your guys' experience at Northern, are you finding that this period's volatility is even greater than past periods? And is it because of quantitative tightening or actions that is causing greater volatility in your guys' estimate?",neutral,0.1081,0.1053,0.7866
37,Jason Jerrome Tyler,,"Well, it is more volatile, not just over the long run, and we went from $90 billion to $138 billion down to $106 billion. And -- but even within the quarters, a lot of volatility. And -- but I think that's driven by some of the macro factors and what we saw in early March spooked a lot of depositors, obviously, and then another trend of debt ceiling and then leading to another trend of deposit competition, all of those things are having -- or driving significant different preferences that clients have, not just between which bank to go to but whether to use banks versus money market funds versus treasuries. I think all of those factors are what's leading to the heightened volatility we're seeing.",neutral,0.0612,0.2855,0.6532
0,Operator,,Next question comes from Vivek Juneja from JPMorgan.,neutral,0.0282,0.0574,0.9143
16,Vivek Juneja,,"A couple of questions. I'll start with noninterest-bearing deposits. The big outflow you saw in the second quarter, which segment did that come more out of and where -- what are you seeing in that trend? Sorry, if I'm repeating a question, there have been overlapping calls just made it -- I hope I'm not doing that.",neutral,0.0622,0.1666,0.7712
37,Jason Jerrome Tyler,,"The significant movements are almost always going to come -- well, almost in this case came from asset servicing.",neutral,0.1027,0.0511,0.8462
16,Vivek Juneja,,"Okay. And the stabilization, where are you seeing more of that, which segment?",neutral,0.042,0.035,0.923
37,Jason Jerrome Tyler,,"The asset servicing segment is actually overall been relatively stable. We'll see big chunky movements in and out but the overall level has been about the same. The wealth segment is more granular. The GFO client base has -- is much chunkier, but you just think about the amount of clients in the wealth segment, it just makes it more granular.",neutral,0.2236,0.1635,0.6129
16,Vivek Juneja,,"And on the Wealth Management segment, the low single-digit expense growth. Is that because that's where you've done a lot of the headcount cutting that you all talked about? And what are the implications for service there?",neutral,0.0359,0.1089,0.8553
37,Jason Jerrome Tyler,,"Service has been great. And we didn't provide detail in the expense allocation between the business units. But just in general, you'll note that the headcount is down but no impact to service levels whatsoever. The low single-digit growth I referenced was related to organic growth within Wealth Management.",negative,0.055,0.8432,0.1018
0,Operator,,"Next question comes from [ Robert Richal ] from Wells Fargo. 
Unknown Analyst 
Just a quick follow-up. You mentioned that equipment and software, you had some projects being delayed. Does that mean that non-comp expense will see some upward pressure in the second half of the year?",negative,0.0569,0.653,0.29
37,Jason Jerrome Tyler,,"Yes. In certain categories, it will. And so in equipment and software, we'll see -- in that line item, in particular, we'll see upward pressure, $5 million to $10 million third and fourth quarter. But not -- I didn't reference other line items. We mentioned outside services relatively flat. So that's really the only forward-looking information we provided, except for the comp number, which you referenced.",neutral,0.1367,0.1578,0.7055
0,Operator,,And Brian Bedell from Deutsche Bank.,neutral,0.0398,0.029,0.9311
7,Brian Bertram Bedell,,"Just wanted to clarify on the FDIC special assessment, is that included in that expense guide of 6% or better. And I don't know if you're able to frame the size of the essential assessment yet.",neutral,0.0529,0.0265,0.9207
37,Jason Jerrome Tyler,,It's not included in the 6%. And we haven't talked publicly about what the number is.,neutral,0.0337,0.0814,0.8848
40,Jennifer Childe,,Okay. Thank you very much for joining us today. We look forward to speaking with you again soon.,positive,0.6268,0.0123,0.361
