Speaker ID,Speaker Name,Speaker Company,Text,Sentiment Label,Positive Score,Negative Score,Neutral Score
35,Stephen Biff Bowman,,"It was -- if we add all of the components together, it was a little over $8.8 million in the quarter. So it's a large number. But again, a year ago, that was closer to about $4 million, $3.5 million to $4 million. So -- and that Visa mark is driven by a series of factors. We look at the equity price of Visa. We look at our expected duration of the litigation. We look at the conversion ratio of our B shares to A shares. And that's driven, in many cases, by any contributions made to settlement funds. So all of those can, in any given quarter, be valued and come out. The Visa stock price has moved. Our thinking around the duration of the litigation can change in any given period, and all of those ended up being a quite significant move this quarter. The -- you can calculate it. It's in our Q. Our Visa Class B shareholdings are somewhere in the $900 million to $1 billion range right now depending on the Visa stock price as we sit here today. I don't know where it is, but somewhere in that range. So it's a substantial off balance sheet. It's not off-balance-sheet. It's on the balance sheet at 0. So it's on but at a 0 valuation.",neutral,0.0395,0.0643,0.8962
10,Gerard S. Cassidy,,Very good. Can you also share with us -- I think you said that 20% to 25% of C&SI's (sic) [ C&IS ] custody and administration fees come from transaction volumes. What transaction volume should we monitor from the outside to see what type of activity may show up in a quarter in this area?,neutral,0.0535,0.0159,0.9305
34,Mark M. Bette,,"Yes. Gerard, it's hard. I mean, you can look at overall global market volumes as a driver. There is some -- sometimes with  -- through the sub-custodian network, there might be different timings of recoveries when those types of buildings come through, and then they come into the fees as well. But in general, I think looking at overall market volumes is a good way to probably try to judge that.",neutral,0.0685,0.0363,0.8952
0,Operator,,We'll take our next question from Vivek Juneja with JPMorgan.,neutral,0.0354,0.0285,0.9361
16,Vivek Juneja,,Can you hear me? Yes. Can you hear me?,neutral,0.064,0.0244,0.9116
35,Stephen Biff Bowman,,"Yes, yes.",neutral,0.2002,0.0246,0.7752
16,Vivek Juneja,,"I'm sorry. So my question -- your CET1 ratio, it's grown pretty sharply in the quarter to 12.9%. Firstly, what drove that 50 basis point increase? And secondly, what is your plan with that since you are -- it's so far above your targets. What do you -- especially with balance sheet growth being slower, do you accelerate your buybacks even more significantly over time?",positive,0.5213,0.0385,0.4401
35,Stephen Biff Bowman,,"Yes. So the drivers of that in this quarter were really a decline in the risk-weighted assets. And as we said earlier, our total payout ratio in the quarter was a little bit north of 100. So we didn't really add anything to the equity portion, but we did have lower risk-weighted assets in the quarter. The drivers of that lower risk-weighted assets were lower foreign exchange exposures, lower securities lending exposures, lower what I will call other. And we can have things like client settlement, securities, client overdrafts and others. All of those quite frankly kind of went in our favor at period-end and they helped drive the risk-weighted asset out down, which drove the CET1 up about 50 basis points. So that was the driver in the quarter. Those can have some end-of-period volatility to them. 
The second part of your question was really more around the how do we think about that. Look, we increased our dividend 31% in -- starting in the third quarter, and we bought or we were approved -- excuse me, we were not objected to by the Federal Reserve to buy up to $1 billion worth of stock in the quarter. We executed on that in this quarter, as you can see from the buyback. And we continue to look at that. We will look at that in our evaluation with our Board and others in coming quarters and in the spirit of the next year's CCAR and capital ask with the Board to see what the right return levels of capital are. But it's a strong position, and we take all the factors you mentioned into consideration as we look at that capital return.",neutral,0.2243,0.07,0.7057
16,Vivek Juneja,,"And how are you thinking about dividend payout in this? Because your payout ratio has been below what it used to be several years ago. You're now in the -- depending on quarter-to-quarter, anywhere -- with this increase this quarter, you're still only at about 34%, 35%. So do you think about -- where do you see that going longer term?",negative,0.0351,0.6658,0.2991
35,Stephen Biff Bowman,,"Yes. We do think about that. We think about that -- how that dividend payout ratio would be able to sustain itself in stress. We take great consideration of -- and we want a great deal of certainty around the ability to pay that dividend. And so when we do our stress testing, we want to make sure that we have the dividend payout ratio that can sustain itself in stress when the earnings and other things are in stress. We have, I think publicly said, that we think being in that 30% to 40% range from a dividend payout ratio is an area where we feel comfortable with that over time, and we'll continue to evaluate that. But I think that's a reasonable range with the rest of our total payout ratio obviously being in the form of stock buyback. But we think that gives us the right mix and the right comfort around the importance of that dividend to our Board and others.",neutral,0.2364,0.015,0.7486
0,Operator,,"This concludes today's questions. We thank you for joining today's call. You may now disconnect, and have a great day.",neutral,0.1633,0.0161,0.8206
35,Stephen Biff Bowman,,Thank you.,neutral,0.1625,0.014,0.8235
