Speaker ID,Speaker Name,Speaker Company,Text,Sentiment Label,Positive Score,Negative Score,Neutral Score
38,Michael G. O’Grady,,"So in wealth, we've continued to grow. But you're right, the marketplace is extremely competitive, which is why it's so important that we stay focused on both the parts of the market where we think we compete most effectively, and on providing for the clients in that segment. So where we're seeing our strongest growth has been in the upper part of the market there. So think about clients with assets above $20 million. And particularly during this time period where equity values are going up, there's obviously been an increase in wealth. So that drives growth. But then also with the change in administration and potential changes in taxes and things like that, it increases the need for planning. So a high level of activity, both with our existing clients, but also opportunities with prospects.",positive,0.8298,0.0193,0.151
40,Michael Roger Carrier,,"Okay. Great. And then just in terms of the expense outlook, you realize you guys try to focus on aligning that slightly lower than the organic growth levels that firm over time. But as we transition from, say, the low short rates as headwinds to NII and waiver headwinds stay eventually stabilizing and then as short rates rise and eventually become still, like any necessary like investment areas ahead or like new efficiency areas post-COVID like real estate that we should be thinking about?",neutral,0.1271,0.0167,0.8562
38,Michael G. O’Grady,,"I'll start, and then I'm sure Jason can add detail to it. But it's -- on the expense side, it's a very dynamic situation right now. What I mean by that is we're obviously still in this resiliency mode that we talked about, which has certain, say, cost to it, but also there are certain expenses that we're not incurring at this point. So obviously, travel and business promotion is lower than it was pre-pandemic. With not operating with as many people in our facilities, the cost of operating those facilities is lower. So you do have some lower costs on that front that to the extent that we transition out of that, you would expect that those would increase. 
The second thing I would say is with regard to the organic growth that we've talked about, it does require investment. That can be supporting large new clients. And it also can come in the form of bringing on new talent to continue this growth. I mean as you bring on new talent, you want to make sure that you're providing the right level of service across all of our businesses, and that means making sure that we have the people that go along with this. And then the third piece I would just say is around our digitalization efforts, which, again, have accelerated in the last year. And I think we're seeing the benefit of that. But it does require investment in technology as well to ensure that, yes, we're adding those capabilities, but we're doing it in the right safe, secure, stable way. So that backdrop does say, okay, we're going to continue to grow, but it's going to require investment. And that's why, as Jason talked about earlier, we also have to be focused on efficiency. And we did see, as a part of the remote working environment, there are some efficiencies in that as well. And so how can we, for example, look at our real estate footprint and see if there are opportunities to shrink the footprint and use that to support some of the investments that I talked about.",neutral,0.2723,0.0895,0.6381
0,Operator,,We will now go to Betsy Graseck with Morgan Stanley.,neutral,0.036,0.015,0.9491
5,Betsy Lynn Graseck,,Okay. A couple of other themes that we haven't touched on yet. One is around the wealth management business and the virtual advising strategy. I know that's been well underway for a while. I just wanted to get a sense as to if the demand for that is more run rate at this stage? Or are you still seeing acceleration of demand for that strategy that you've got there?,neutral,0.1133,0.0265,0.8601
37,Jason Jerrome Tyler,,"So if -- the way we've tackled kind of the virtual engagement through with clients on the wealth side is the continued use of our goals-driven wealth management approach. And so we were able very quickly to take those discussions and have virtual conversations. But with that same very -- what we think is a very differentiated platform with clients through COVID, it was very good. Engagements were very, very strong, and it's led the business to feel that there's strong momentum from an overall client engagement perspective. So that's gone well. And it's one of the continued large investments in wealth management. And Mike just talked about our investment in digitizing the business. That's an area where we can use that as a core platform but add journeys to it, add specific areas to become more and more detailed and specific with how -- matching up with what our clients are going through. It's very strong investment for us, and it's been extremely positive. Our Net Promoter Scores as Steve Fran, who runs that business is just talking about how strong those are. And so clearly, that investment has been paying off with good client engagement.",positive,0.7004,0.0133,0.2864
5,Betsy Lynn Graseck,,"Okay. And then just separately, I know you've been in the press recently with regard to some of the crypto custody activities that you are working on, not sure when it's going to be launched. I think you've got a partnership going on with [indiscernible]. So maybe you can give us some color on that. And part of the question too is, it doesn't just end with custody or can you foresee an opportunity to enable -- to offer crypto to your clients? 
When I think about European investors, well, not just investors, but the services asset managers that you work with over there are dealing with negative rates. What I hear is that there's a decent demand for going into crypto because at least it's not negative interest rate. So how far is it until you -- or how long is it until you offer crypto as one of your liquidity tools? Just kind of thinking, thinking out loud.",neutral,0.0892,0.0507,0.8601
37,Jason Jerrome Tyler,,"So Betsy, as you know, the financial markets are constantly innovating and evolving, and have for some time period and in the business we're in, we absolutely have to keep pace with that, and do it in a way that, again, it allows us to provide the safety and security for the clients in managing their assets. And crypto and digital assets more broadly is right now, clearly, one of the areas that's evolving the fastest. And so on that front, to your point, with regard to custody of crypto assets or cryptocurrencies, we've partnered with Standard Chartered in a venture called Zodia, which will provide that crypto custody. And I think what's important there, what we're trying to accomplish is leverage the traditional custody expertise that we have, that Standard Chartered has as well, but do it in a fintech way. So that's why it's a separate independent entity that, again, can develop and evolve at that pace. And at this point, we still expect at some point in 2021 that will be approved for client use. Again, it's going to be done not only our own, I'll call it, approvals, but also from a regulatory perspective. And then I think more broadly, to your point, absolutely, we see many different potential opportunities in this space where clients will look at digital assets and potentially cryptocurrencies in order to address various either challenges they have or ways to earn better returns. And that's why we've not only done what I talked about in cryptocurrencies, but more broadly with the digital assets, whether it's tokenization, which we've done with -- on the value, whether it's developing a PE capability on blockchain which we've done with Broadridge, there's a number of different areas where we've experimented either on our own or with partners in order to be able to be a part of that innovation.",neutral,0.1144,0.0142,0.8713
0,Operator,,We will now move to our next question that is coming from Jim Mitchell with Seaport Global Securities.,neutral,0.0409,0.0227,0.9364
39,James Francis Mitchell,,"Maybe just a question on the wealth management business. It seemed to be quite a bit of disparity in the outcomes even though market appreciation, whether it's lag basis or month lag or full quarter lag, was pretty similar. So is it just -- there's a lot more fee waivers in the Global Family Office. How do we think about that sort of difference?",neutral,0.0469,0.0658,0.8873
37,Jason Jerrome Tyler,,"Yes, you've hit it right. There is a distinction in the lag in that business, but that's not what drove it, frankly. It was -- it's the waivers hit hard. And we've talked about the fact that people shouldn't see waivers as linear. This is a good example, where the waivers -- that the GFO business is obviously much more institutional. And so the waivers hit later. And we're now starting to see it come in, whereas the regions have more traditional closer to, but not retail pricing. And so those waivers just hit earlier. 
Second dynamic though is GFO is spiky. And we have clients there that will move billions of dollars. And so you can have 1, 2, 3 clients that if they all have significant movements, then you'll -- you can see big movements on a sequential basis. If you look year-over-year, the organic growth -- the growth rate overall for GFO is actually slightly higher than the regions. But obviously, the sequential look was impacted by those 2 things: one, waivers, and two, some spiky very large client movement.",neutral,0.1285,0.0679,0.8036
39,James Francis Mitchell,,"Okay. And so the incremental hit to fee waivers, is that also going to be in 2Q more in Global Family Office and maybe C&IS, or how do you think about the geography of that?",neutral,0.0419,0.0303,0.9278
37,Jason Jerrome Tyler,,"I think we're -- I think from here, it's somewhat -- it's going to be more linear. I mean, the funds are more -- they're all there at this point in waiver mode. And so I don't think we're going to see as big of a disparity going forward. But people should just realize it's not a linear relationship. And I think there was -- overall it was $22 billion, $23 billion in wealth, and 9 of that was in -- 9, almost 10 was in GFO. And so that's a year-over-year look, that's just aggregate effectively. But the one quarter look, it was $5 million in GFO alone. And so big -- that was the increase quarter-over-quarter.",neutral,0.0624,0.073,0.8646
0,Operator,,"Next, we'll move to Jeff Harte with Piper Sandler.",neutral,0.0456,0.0179,0.9364
39,Jeffery J. Harte,,"To circle back a bit to the buyback. I mean, it's good to see you guys out there buying $135 million of stock. Historically, it feels like the actual buyback comes in kind of below what at least our estimated capacity is somewhat regularly. I think first quarter might have given us a partial edge with risk-weighted asset growth. But can you help kind of differentiate kind of the buyback, the difference in your thinking between just being conservative versus the expectation that risk-weighted assets could actually continue ramping up like they did in the first quarter?",neutral,0.3302,0.1871,0.4827
37,Jason Jerrome Tyler,,"Yes. It's completely related, and it comes back to that theme of wanting to think about returns. And so -- and for us, it's not like we're making a decision of do we buy back stock or just park money at the Fed at 10 basis points. For us, we -- it's -- but it's nice to be able to see that client activity is driving the alternative to share buybacks. So that's certainly not to say that we're doing 0 or very little. It's just to say those are the different options we think about. And you saw sec lending activity up significantly. Just the loan demand being up $1 billion, that's going to cause $1 billion in higher RWA just in of itself. And then you see the deposits coming in, which is -- it's nice for us to be able to answer a client need, but that comes with RWA as we redeploy it on the asset side. And so the best thing we can do is have the balance sheet used for good return on equity activity that's client-related, building relationships in the long run. But at the same time, we did do $150 million in share repurchase over the time frame. So it's not like we were absent in the market, but you can imagine here at 12%, we're going to be looking at what does AOCI look like, what does client activity look like and balancing all of those things together.",neutral,0.1768,0.0288,0.7943
39,Jeffery J. Harte,,"Okay. And just to touch on kind of the fee growth, I guess, growth across relative businesses. It seems like C&IS has been outgrowing wealth management, at least outpacing it for a while now. I mean, is that the right way that we should think about those 2 business trajectories going forward growth-wise? Or is there a reason to think that kind of wealth management could start kind of catching up with C&IS?",neutral,0.2216,0.0148,0.7636
37,Jason Jerrome Tyler,,"Couple of things. One, every time -- over long periods of time, we think one of the businesses is growing faster and we think all this is going to be the case for the future, you get an inflection. The businesses have acted as good hedges to each other. And it's always difficult to predict those inflection points and what's going to grow faster. For sure, if you look over the last couple or few years, you'd see C&IS having grown faster. But in general, wealth has got good exposure to equity markets. And so -- and you also think over the long run, there's good title growth, particularly at the top end of the wealth market. And so those things should help as well. And so we wouldn't call a prediction necessarily on one of the businesses over the long run and the future growing faster.",neutral,0.2654,0.0174,0.7172
34,Mark M. Bette,,"And I would just add to Jason's comments. That's why we really like the combination of the 3 businesses. Not only is it complementary from a client perspective, but also from a financial perspective, they have different dynamics. So the asset servicing business, which has done a great job leading and growing at a high rate, it also requires resources to do that as we've talked about that and has different levels of volatility in the business, whereas in wealth management, very steady and at a high level of profitability and scalable. And then with asset management, again, very high level of operating leverage in the business. And as has been positioned over the last couple of years, for example, when you can get positioned in the right products, for example, in liquidity, and the markets go up, the liquidity goes up. Very strong increase in profitability for that and focus on other areas where we can have that same dynamic with ESG and quant. So we like all the businesses, I would say, from a client competitive perspective but also from a financial perspective.",positive,0.5764,0.0131,0.4105
0,Operator,,We will now go to Rob Wildhack with Autonomous Research.,neutral,0.0482,0.0111,0.9406
22,Robert Henry Wildhack,,"Question from me on organic growth. I think a year ago, the prospects for organic growth were probably more uncertain. And fast forward to today and your comments have been really positive. Coming out of 2020, do you see any new or different sources of organic growth that could maybe increase the long-term sustainable rate you think you're capable of achieving?",positive,0.4979,0.0131,0.489
37,Jason Jerrome Tyler,,"I'll start, and Mike, I'm sure has some comments on this as well. And let's take those -- let's take the different businesses. In C&IS, we hinted even early today, the integrated trading solutions is something we talked about a little bit over the last few months. That's come through. That's part of the reason I think there's been that lift in brokerage commission income, done strategic things in foreign exchange and those aren't -- so it's not accidental, I think, that we've had lift in those areas. And then front office solutions is another area where we're trying to go to sophisticated clients and show the breadth of what we can do. 
In wealth management, the engagement there is around expanding and continuing to invest in goals-driven wealth management. And the growth we've had, particularly in the upper end, that product gets to -- we've thought so much about what $50 million, $100 million and hundreds of millions of dollar clients need in order to interact in a good holistic way and think we're set up well there. And then in asset management, $215 billion, I remember about 1.5 years ago, where we were on a liquidity perspective to now $275 billion And yes, there's been great growth in the industry, but they did a lot of hard things to get cutoff times done well to get to open a Northern Trust portal-- there's so many different -- to invest in the talent we have in that group. And then you think about our ESG and quant capabilities, ESG assets are over $130 billion now, great engagement in -- across the Nordics with very strong client base there and doing a lot with our ETF platform, including launching new products in Europe there. And so in each of the areas, I think there's good opportunity for us to leverage the work that's been done to lead to stronger organic growth",neutral,0.3978,0.0123,0.5899
0,Operator,,Our next question comes from Vivek Juneja with JPMorgan.,neutral,0.0371,0.0353,0.9277
16,Vivek Juneja,,"I guess just to follow up on the Integrated Trading Solutions. Can you explain that a little bit how it actually works? Are you -- is it an electronic thing? Or is it people that you're providing instead of your asset management clients having them? And how does that work if it's 5 of your clients want to buy 1 particular stock, how are you separating all of that? Can you give a little more color on how this actually works?",neutral,0.0391,0.0261,0.9348
37,Jason Jerrome Tyler,,"Sure. At 25,000 feet, you think about it as almost out -- trading outsourcing. Investment trading outsourcing where a lot of clients realize -- a lot of our asset management clients realize that their core competencies around security selection and research and not necessarily having the trading operations, the back office that comes with that, trade order entry and so our ability to say, you can work with us and we can be your effective outsourced trading partner, it appeals to a lot of asset management clients.",neutral,0.1187,0.0114,0.8699
16,Vivek Juneja,,Okay. So they don't have to have a trader anymore and you're just providing the back office for trading?,neutral,0.0372,0.051,0.9118
37,Jason Jerrome Tyler,,"No, it starts with trading. They can -- we can have portfolio managers and their middle office send us model accounts, send us trades, and we can provide that service for them and be more of a full outsource operation from them from middle office through trade execution and trade management.",neutral,0.0666,0.0152,0.9182
16,Vivek Juneja,,"Okay. All right. I'll follow up maybe a little more offline. Going back to the capital question, Jason, Mike. So I hear you, you want to obviously -- you're thinking about client needs and all of that stuff. But even if we factor that in as we think about it, what level are you sort of comfortable running your various capital ratios at? Whether it's Tier 1 leverage or whether it's CET1? Is it a 10% or is it an 11%? Whatever the form it gets through, whether it's through loan growth, securities lending growth and/or buybacks, what is sort of that cutoff point below which you don't want to go?",neutral,0.0361,0.0392,0.9246
37,Jason Jerrome Tyler,,"From our perspective, I think it still is going to depend on where the industry -- where are our peers. And regulators asking us to hold on to capital, to not buyback stock at that time. I don't -- we don't call an absolute level. We haven't talked about our buffers externally. Obviously, we're running significantly above any regulatory minimum. But we haven't -- and so we've got buffers that we use internally to manage that, not something we've talked about externally. But when we engage with clients, we want to be able to continue telling them that they've got -- they're interacting with a balance sheet that's strong on an absolute and a relative basis. And it doesn't have -- it's part of our strategic strength when we talk to clients. And a lot of institutions you think about, not just pension funds, but even sovereign wealth funds, if they're investing -- if they're depositing $500 million, $1 billion, $2 billion, $3 billion, they're not really depositing, they're lending to their banks at that point, and they want to be operating with institutions that are strong. And so we're always going to be looking and seeing where the tides are in the industry to make sure we reflect strong capital levels.",neutral,0.0845,0.0271,0.8884
0,Operator,,Our next question is coming from Gerard Cassidy with RBC.,neutral,0.0394,0.0287,0.9319
10,Gerard Sean Cassidy,,"Jason and Mike, can you guys share with us -- I know you're not a prime broker. But there was that trading mishap in March with supposedly a large family office, which probably was a hedge fund. But can you just give us any color because we've never seen any risk in your Global Family Office business at all. Can you reassure us that's still the case? And just maybe some color around how you manage that business and manage those risks?",neutral,0.0735,0.0218,0.9047
37,Jason Jerrome Tyler,,"Sure. Well, couple of things. I mean, you're right, we're not a prime broker. And so we're not providing the type of trading leverage to --  or alongside clients in taking positions is we're dealing with either our hedge fund clients or our family office clients. In the family office business, we have some loans, but those are much more of the loans that we see in the traditional wealth business, which are loans against investments that clients will have and long-term clients, they're not taking that type of exposure. And so the -- and the services that we provide for our hedge fund clients and our GFO clients, it's much more about asset servicing, asset administration, investment reporting. That's how we're going to market to deal with those types of clients. And so just to put anybody's minds at rest, we didn't have any exposure to the hedge fund/family office that you're talking about, and don't see that type of exposure in our portfolios.",neutral,0.0358,0.0431,0.9211
10,Gerard Sean Cassidy,,"Speaking of asset servicing and reporting that you just did, is there an opportunity to capitalize then if the SEC requires more disclosure from the family office organizations as a possibility as a result of what happened. Would that be an opportunity for you guys to do more work for your customers and therefore maybe more revenues?",neutral,0.1863,0.0141,0.7996
37,Jason Jerrome Tyler,,"Yes. It's an interesting nuance because we -- a lot of our clients on the hedge space, they actually are SEC registered and so we're used to dealing with them and helping those types of institutions on doing the reporting and administration that they need to do for their SEC registration material and engagement. And so that would be -- I don't think it's a monumental opportunity for us, we haven't talked about it that way, but certainly, we have that capability set and would be seen as a strong provider for hedge funds that we're looking to have more of a traditional investment reporting and overall fund administration engagement with their service providers.",neutral,0.194,0.0113,0.7947
0,Operator,,We will take our final question from Brian Kleinhanzl with KBW.,neutral,0.0341,0.0266,0.9393
8,Brian Matthew Kleinhanzl,,"Two quick questions. One -- first one on the comp expenses. I heard that $32 million of comp was retirement eligible. And then did you also say that you absorbed the merit increases year-over-year, so those are getting paid out in the first quarter now? I thought those was getting paid out in the second quarter historically. I'm just trying to think of the 2Q to 1Q trend here for comp?",neutral,0.0596,0.0575,0.8829
37,Jason Jerrome Tyler,,"Yes. No, the merit will come through second quarter. What I did mention earlier was that this may have been what you -- what got your mind going is we -- the reduction in overall FTE and headcount for the company did lead to a lower salary level in the quarter. But that won't off -- but that's not -- that's distinct from the merit increases.",negative,0.0628,0.8444,0.0928
34,Mark M. Bette,,"And just to clarify, this is Mark. The base pay adjustment the year-over-year increase is still reflecting of any base pay adjustments that happened in the previous year. We're still lapping that. So if that's what you were referring to, Brian, in the release or in some of the comments we made, that would have been what that was referring to, not this year.",neutral,0.0583,0.0983,0.8434
8,Brian Matthew Kleinhanzl,,"Got it. And then can you also just talk about the trends in investment management. I think if you adjust for the fee waivers, looking at the first quarter relative to the third quarter, you're not seeing much in terms of revenue growth despite the change in market levels over that time period. Could you just maybe touch on the flows in that segment?",neutral,0.1249,0.0169,0.8582
37,Jason Jerrome Tyler,,"Yes. Mark may want to touch on flows in general, but...",neutral,0.2905,0.015,0.6945
