Speaker ID,Speaker Name,Speaker Company,Text,Sentiment Label,Positive Score,Negative Score,Neutral Score
35,Stephen Biff Bowman,,"Geoff, it certainly continues to remain competitive in that space, and it really has more nuance than just for me to just say that broad brush. In certain markets, we could see very highly competitive pricing, parts of Asia or we could see it in other parts of the world. In other parts where we see what I would say is more measured and pragmatic pricing, so I'm hesitant to give you anything other than it's a really competitive landscape for pricing. We feel pretty good about our ability to complete and still drive margins. We talked about the margins in our C&IS business continued to expand in the quarter, so they're able to win without margin erosion in that space. So we feel pretty good. But it is still a very competitive landscape in that space. I do think in the macro environment, we are able -- if you can bring value proposition, you can still get paid for it in the space. But you have to demonstrate the value you're creating for the marketplace in which we compete, particularly in the institutional side of the business, which is what I think you were referencing. I think on the Wealth side, we demonstrate that value proposition very effectively, and we've seen really very strong growth on the fee side on the Wealth Management business.",positive,0.5219,0.016,0.4621
9,Geoffrey Elliott,,"And then just a quick one on the deposit side. What gives you confidence that those outflows you saw in DDAs and in the custody business is just kind of normal ebbs and flows? Because I guess, if we look across the banks that have been reporting, there's a pretty clear mixture of noninterest-bearing deposits flowing out across the board. So what kind of gives you confidence that those might be back again in a quarter or 2?",neutral,0.0753,0.0392,0.8855
35,Stephen Biff Bowman,,"So let me break them apart because I think you said on the Wealth side, I don't know that...",neutral,0.0697,0.1021,0.8282
9,Geoffrey Elliott,,"No, on the custody side and on the commercial DDAs.",neutral,0.0469,0.014,0.9391
35,Stephen Biff Bowman,,"Yes. Well, we track the trends client-by-client over time. We do that, and we've seen these types of things before. I guess I can't guarantee that they come back, but we have seen these types of ebbs and flows in the past from those clients that we track at a client level that drove some of this in the quarter. I can't guarantee that they'd come back. They could have been excess cash. But we're tracking at a client level, I know, have we seen these types of moves before from those individual clients? We have. So we'll continue to track that. And you're absolutely right, it could be something that was more permanent in nature, but that's our current and most informed view.",neutral,0.0642,0.0601,0.8757
0,Operator,,We'll take our next question from Betsy Graseck with Morgan Stanley.,neutral,0.0348,0.0294,0.9358
5,Betsy Lynn Graseck,,"Couple of questions. One, in the prepared remarks, Biff, I think you discussed a little bit about the risk in analytic services that were adding to one of the fee rate lines. And just wanted to dig in a little bit and understand some of the drivers there and opportunity set. I know also you put out a press release recently about the integrated trading solutions product and wanted to see if that was all driving the forward look on what risk and analytics services can do for you.",neutral,0.0912,0.0161,0.8927
35,Stephen Biff Bowman,,"Yes. So they're 2 separate services, so I'll go first to risk and analytics services. We have, for a long time, provided what I will call the analytics and analysis of particularly fund performance, pension fund or whatever. So when a pension fund board or a public fund board is evaluating how their assets have performed and their managers have performed, we provide very detailed analytics. And that's another way for us to use the data we have and work with them to provide what I'd call very high value-added services. They continue to do great work and have been able to grow that business, and it's been a very value-added part of the relationship. But I'll let Mark give you an update on ITS.",neutral,0.1581,0.0135,0.8284
34,Mark M. Bette,,"Betsy, yes, so really, the ITS is kind of a bit of an offshoot from in 2016 when we acquired Aviate Global to kind of strengthen our global brokerage business. So really, those -- it's solutions for our asset owners and asset managers. It's really -- that I would say is more in the security commissions and trading space than it would be in the -- within the trust fee categories. And we have seen good growth in that area. I would say that for this quarter, the security commissions and trading performance was impacted by transition management activity being lower and as well as interest rate swap activity being lower, and those do tend to be more volatile on a quarter-to-quarter basis. But when we look at the underlying like core brokerage trends, including ITS, we see some good growth there.",positive,0.4951,0.3028,0.2022
5,Betsy Lynn Graseck,,And this ITS announcement looked like it was aimed at Europe. Is that accurate? Or am I -- is there something here to for U.S. as well?,neutral,0.0477,0.0299,0.9224
35,Stephen Biff Bowman,,"Yes, I think it certainly is being primarily run through Europe right now because that's where the predominance of the Aviate acquisition was, and I think we'll look to see if there's availability in the U.S. or applicability in the U.S. or Asia.",neutral,0.1957,0.0105,0.7938
0,Operator,,We'll take our next question from Brian Kleinhanzl with KBW.,neutral,0.0372,0.0303,0.9325
8,Brian Matthew Kleinhanzl,,"Biff, just a quick question on the comp expense. I want to make sure that the third quarter is a good jumping-off point when we think about where we're going in the fourth quarter. I think you mentioned that there was some impact on incentive comps in the quarter from previous quarters. Was there an accrual reversal in the quarter? Or was this the number that you posted a clean number to think about for fourth quarter?",neutral,0.2072,0.2109,0.5819
34,Mark M. Bette,,"Brian, it's Mark. Yes, I would say that it's a fairly clean number. I mean, the decline that we would have had for the equity incentive compensation really relates to when we issue the grants in the first quarter for retirement eligible expense that gets recognized over the first 2 quarters. Most of it on the first, and then $11 million of it was in the second quarter. So that would have rolled off in the third quarter. So what's left, I would say, is a pretty -- probably good, solid starting point as far as compensation goes.",positive,0.6246,0.1338,0.2416
8,Brian Matthew Kleinhanzl,,"Okay. And then on the outside services, I mean, I thought it was about a year ago, you mentioned there was some ability to maybe manage that number down, but it seems they just keep going up. How are you thinking about that going forward? And is there an opportunity to manage those expenses lower in '19 or '20?",neutral,0.1589,0.1391,0.702
34,Mark M. Bette,,"I would say when we look at the year-over-year growth in outside services, we're looking at about 6% to 7%. There is -- probably about 3 points of that would've been from the acquisition. And then when you look at what's left, about 3% of growth, there is the impact of the higher third-party adviser fees for revenue recognition; and that the gross accounting, slightly offset by lower sub-adviser cost. But we would say that you're probably looking at -- when you adjust for those things, a pretty modest amount of gross really driven by technical services, which includes market data but offset by we are seeing lower consulting and legal expense on a year-over-year basis. So that's outside services on a year-over-year basis.",neutral,0.2116,0.1752,0.6131
35,Stephen Biff Bowman,,"Yes. And I'll add one piece to that, too. There can be -- you've seen some improvement, I think, in the trajectory of the compensation line in some cases where we've chosen to outsource the outside service line picks up the expense, but the comp line should come down commensurately. So we have some -- we've talked about some of our managed services around our technology that we've done. That's another underlying driver of that as well.",neutral,0.3773,0.0331,0.5896
0,Operator,,We'll take our next question from Glenn Schorr with Evercore ISI.,neutral,0.0374,0.0222,0.9404
11,Glenn Paul Schorr,,"Two quick summary questions. One on -- you gave us pieces of revenue and expense, ex UBS, ex FX, ex charges. Can I just pull it together just so I make sure what the -- what you think the clear growth of revenue expense and operating leverage was ex all those pieces?",neutral,0.0423,0.0388,0.9189
35,Stephen Biff Bowman,,"Sure, yes. That is the way we look at it. That's good. We -- I would say if you pull ex currency, ex acquisition, ex charges, we would say that trust fees were probably up 5.5% or so percent. And we would look at our expense to be in the 5% to 5.5% range, excluding all of those items, too. That's not organic. That's just sort of at the core if we pull all those things out. So that's how we would look at fees and expenses. And core revenue, they would be about 8%. Core revenue ex all of the items that we talked about would be 8%.",neutral,0.11,0.0257,0.8642
11,Glenn Paul Schorr,,"Got it. Okay. And then maybe the final one, just to tie it all together on net interest income. I heard the whole thing about each of the pieces, but I'm sure people look at it as balance sheet didn't grow much, NIM was down a basis point sequentially, we had the mix shift issues and the deposit beta issues. When you put it all together, it sounds like net interest income would never grow no matter what rates do and what customer balances do. But doesn't make sense. Meaning as your business grows, as customers grows, as you win new business can -- the question I have is do you have a ballpark idea of range of what you think over a year's period of time what -- if your organic growth is 4% or 5%, what net interest income should accompany with it over time?",neutral,0.0361,0.118,0.8459
35,Stephen Biff Bowman,,"Yes. I won't give that range, but I will say this, we absolutely think that the NIM can expand and the balance sheet can grow and the NIM can expand as long as we continue to see the deposit betas move sort of at where we're seeing industry levels. And again, not just looking at 1 quarter, but looking at trends in the deposit betas, we think it can expand, and we think the balance sheet can get bigger with the organic growth trajectory that we talked about before. This quarter had some movement in it. We had mix shift in the balance sheet. We had some runoff of the noninterest-bearing deposits. But we absolutely think that it can expand, particularly if you think rates are going to rise in that environment. The value of the noninterest-bearing deposits that exist on our balance sheet are even greater in terms of expansiveness of that NIM. So we do believe that. It's just this quarter, it kind of flattened out. I think you need to look at the trajectory of our NIM and its migration more than just 1 quarter. I know you -- that's what you do. But we need to look at it over longer periods of times. It may have some stair stepping to it over time.",neutral,0.3276,0.0201,0.6523
34,Mark M. Bette,,"And certainly, the sequential LIBOR moves were muted this quarter versus what we saw in the first 2 quarters of the year. So on the asset side, that would have translated with less upside sequentially for the asset...",negative,0.2501,0.6283,0.1216
35,Stephen Biff Bowman,,"We look -- we have a shorter duration balance sheet, as you know. I think the 3-month LIBOR averaged 2.34% for both the second and third quarters. So essentially, no movement from where we saw it in the second quarter. One month LIBOR did expand. That was about 14 basis point, half -- about half of what we saw in the previous quarter. One month LIBOR is our largest impactful and 3-month LIBOR is the second. So they both were muted relative to the rate move. I don't know how long that -- I don't know what that trend will be in this quarter.",negative,0.1237,0.4825,0.3937
11,Glenn Paul Schorr,,"Got it. One last cleanup. In the other operating income line, you gave us all the reasons on why it was lower. I guess, my only question is, what is the right jumping-off point where we go forward? In other words, it was $20 million this quarter, it was $30 million the quarter before, it was $40 million a year ago, got a bunch of things that impacted it. Is $30 million to $40 million the right kind of hangout range?",neutral,0.0873,0.419,0.4937
35,Stephen Biff Bowman,,"I think if you look at this quarter, certainly in the other operating income, we hope we won't have any community investment write-downs of $8 million, so I would certainly not consider that a recurring investment. And our Visa derivative, Mark, this quarter was $5 million higher than it was a year over -- a year ago. So if you back those 2 out, I'll let you would then figure out a range and. Mark, I don't know if you have any color you want to add. But I think those are 2. -- the rest of those items in that bucket moved in somewhere around a more consistent pattern. But those 2 were somewhat extraordinary on a year-over-year basis.",neutral,0.1096,0.0969,0.7935
34,Mark M. Bette,,"And the one thing that does get volatile within that category sometimes is the hedge, the hedge, the true-up of the hedging, the net revenue hedging that we're doing, which is also a slight drag on a year-over-year basis. But that -- the overall impact of currency is kind of netted across the income statement, and that's where some of those impacts.",neutral,0.0623,0.2224,0.7153
0,Operator,,We'll take our next question from Jim Mitchell with Buckingham Research.,neutral,0.0348,0.027,0.9382
45,James Francis Mitchell,,"Maybe -- most of my questions have been asked and answered. But maybe quickly on deposits again. Just what have you seen, I guess, so far in October? Have you seen kind of a typical runoff from period-end? Are you seeing any stickiness or lack thereof? I guess, just how are we thinking about what you've seen so far?",neutral,0.0502,0.2004,0.7495
35,Stephen Biff Bowman,,"Yes. I'll tell you what. We'll give you an update on that in December when we've had a chance to look at 2 months and give you some color on that. And as you see in our end of period balance sheet, it can get quite large at the end of period. And some of that can stick around for a week until it sort of gets displaced or put back into the market. And so I would be uncomfortable giving you any view of that because I don't think it's a better average, a moving average. By mid-December, when we are in the public forum, we'll be able to give you a much cleaner look.",neutral,0.0845,0.0524,0.8632
45,James Francis Mitchell,,"Right. But overall, you feel like most of the hot money has mostly gone, and we can hopefully start to see some growth from here?",positive,0.7567,0.0235,0.2198
35,Stephen Biff Bowman,,Yes,neutral,0.1077,0.0359,0.8564
45,James Francis Mitchell,,"Okay. And then maybe on just the NIM. I had noticed LIBOR moved, too. I mean if that is sustained, should we be looking at more 1 month or 3 months for the balance sheet? And all else equal, it seems like that should help into 4Q, right? Is there anything else you can call out in terms of maybe in the securities portfolio? You might have more turnover in the fourth quarter versus the third? Or how do we think about reinvestment yields there?",neutral,0.0929,0.0301,0.877
35,Stephen Biff Bowman,,"So the 1-month LIBOR spread movement would be an important item for you to track. So would 3-month, but 1-month would be the primary in that. And then, you're right, as we look at assets maturing and the chance to reinvest in that, we do have a reasonable book of that business in the fourth quarter, slightly larger than the normal average, but I would focus more on the 1-month to 3-month LIBOR spreads in that space.",neutral,0.0881,0.0355,0.8764
0,Operator,,We'll take our next question from Mike Mayo with Wells Fargo Securities.,neutral,0.0359,0.0377,0.9264
18,Michael Lawrence Mayo,,"Can you remind us on your financial targets? I'll tell you what I think I have. I'm not sure it's right. One is the ROE target of 10% to 15%. Did you ever update that? Will you update that? 
Two would be you're looking for organic fee growth in the 4% to 5% range, as you said. 
Three, you look for that organic fee growth to outpace core expense growth. 
And then four, you have Value for Spend looking for $250 million of savings by 2020. And also, how much of that have you achieved?",neutral,0.0917,0.0142,0.8941
35,Stephen Biff Bowman,,"So our one stated public external target, you're absolutely right, is the 10% to 15% ROE. We have not updated that at this point. We are -- we have regular reviews to establish if that's the right range, and we look at that. I think we have that range to be something that goes through cycles. Obviously, tax reform was a secular change that we have to think about and contemplate what its impact should be, particularly if it looks like tax reform is actually going to flow through the financials and not be priced away. And that's why we waited some period of time to assess just how the world would react to that. The other targets are items we talked about on the phone. They're not formal specifically given targets, but your thought process on all those is right, $250 million for Value for Spend, trying to get to a positive organic-type view of fees to expenses. And on organic growth rate, over a longer period in the 4% to 5% range, as we've talked about.",neutral,0.0747,0.0227,0.9025
18,Michael Lawrence Mayo,,"And your answer to Glenn's question earlier, you said that ex all the noise, charges, the deal, currency, you've had, what, 8% core revenue growth, 5.5% core trust fee growth and 5% to 5.5% core expense growth. Was that year-over-year third quarter?",neutral,0.2769,0.0203,0.7028
35,Stephen Biff Bowman,,"Yes, that's exactly right.",neutral,0.1536,0.0194,0.827
18,Michael Lawrence Mayo,,And what are the same numbers -- yes?,neutral,0.0392,0.0318,0.929
35,Stephen Biff Bowman,,"I'm sorry, that was the third quarter. Year-to-date, if you wanted year-to-date, I would say our trust fees were 8%, our total revenue was 10%, and our expense is 5% on year-to-date. So a lot of leverage year-to-date. The quarter was a little bit tighter, but we are managing it more than just 1 quarter. So that's the year-to-date performance.",neutral,0.1499,0.2393,0.6108
18,Michael Lawrence Mayo,,"And what I think I hear you saying several times is judge Northern by the years, not by every quarter. Is that what I should be hearing?",neutral,0.0327,0.0849,0.8824
35,Stephen Biff Bowman,,"I think what you're hearing is that in any given quarter, and in particular in our C&IS business, which has very lumpy-sized wins, you can see that move a little bit in any given quarter. And you can see that net interest income with some nuances, some beta catch-up and others have some slight pressures to it. I hope that we're judged on those metrics in longer periods than just 90 days. But that's where we're at.",neutral,0.1716,0.0453,0.783
0,Operator,,We'll take our next question from Marty Mosby with Vining Sparks.,neutral,0.039,0.0325,0.9285
36,Marlin Lacey Mosby,,"Well, if you'll be patient with me. I've been putting a giant matrix together to look at all these different pieces, and I think it's pretty interesting. If you look at year-over-year, like you said, revenues are growing, NII is up double digits, fee income is up high single digits. So it's not the momentum you've had over the year, it's just a sequential quarter. If you look at sequential quarter, expenses are up. But I imagine the golf tournament refracts most of that increased expenses from second quarter to third quarter. Am I about right on that?",positive,0.5838,0.0443,0.3719
35,Stephen Biff Bowman,,"So the -- there's currently a sequential impact from the Northern Trust Open. There's also an offset to that, that partially offsets that is, we have some equity incentives that run down. But we have, I believe we called it out last quarter, the impact of the Northern Trust Open sequentially.",negative,0.0912,0.681,0.2278
34,Mark M. Bette,,"New business promo, about a $17 million sequential increase. And we were -- and you'll see when the 10-Q is filed, we were right on that range.",positive,0.7788,0.0355,0.1857
35,Stephen Biff Bowman,,Yes.,neutral,0.1082,0.0226,0.8692
36,Marlin Lacey Mosby,,"So you can understand that, that's more seasonal if you look at the revenues and you get the NII going down in this particular quarter, about $5 million. But am I hearing this correctly, $17 million impact from this FX swap income in NII? So instead of a $5 million drop, you take that $17 million and add it back, that would be a $12 million increase in NII, net-net, if you take out what's happening in fee income.",negative,0.0714,0.6693,0.2593
34,Mark M. Bette,,So there was also a drag in the prior quarter of $14 million. So there was a $3 million decline from the FX swap activity here.,negative,0.0412,0.9282,0.0307
35,Stephen Biff Bowman,,"So I don't -- you've got to do apples-to-apples, Marty, I think it would've been about down $1 million-ish.",neutral,0.0502,0.1392,0.8106
36,Marlin Lacey Mosby,,"Okay. So that's what I was trying to get at in the sense that you kept telling about incremental. Really, it's about $3 million-ish between quarters. So NII was relatively flat this particular quarter.",negative,0.0817,0.6344,0.2839
35,Stephen Biff Bowman,,Exactly.,neutral,0.0505,0.0259,0.9236
36,Marlin Lacey Mosby,,"If you look at the fee income -- yes, so if you take that impact out NII was relatively flat, you then flip over and look at your fee income and look at the actual components of the fee income between second quarter and third quarter, you actually had about $4 million of pricing impacts, you had $6 million of seasonality and you had then growth in the core. So if you look at the actual core business, it's still up. Seasonality and then one pricing decision that you make is what basically brings your core down a couple of million dollars. But again, that's 2 different things that are very understandable. FX is actually down $7 million, but that's very noisy, it kind of comes in and out. So that's a very kind of quarter-to-quarter. You just kind of see where that ends up.",negative,0.0276,0.7293,0.243
35,Stephen Biff Bowman,,"Also seasonal. The third quarter is seasonally slow. There's a lot of holiday in July and August in Europe, particularly where we drive a lot of that. Yes.",negative,0.0361,0.7346,0.2293
36,Marlin Lacey Mosby,,"And then if we look at the $8 million and other decline, so looking at that number, it's going to be the swap thing that's going over the Visa Class B already taking out the $8 million related to the unusual item. And then you've got some basically some security commissions and trading that's down $4 million. So I mean that's driving that. So in other words, we've got an unusual sitting down here. We've got some noise in trading that's from quarter-to-quarter. So if I back through this, instead of seeing a decline of something like $25 million to $27 million in revenue, you really have core revenues that are up, and then you've got seasonality hitting a couple of spots, you've got a price -- one pricing decision, and you got some noise in other. So when you start looking at it that way and say, well, year-over-year, we're still growing revenues 10%. In this particular quarter, it's just got a litany of things that once you start looking at it cause everything to kind of round to the -- for the negative, which is what I'm hearing you in your conversation trying to say, but the noise really covers that up this particular quarter. So I just wanted to kind of make sure I was walking through all that correctly.",negative,0.0285,0.8405,0.131
35,Stephen Biff Bowman,,"Well, I think all of your -- I was following all of your mental calculations there. I think they're all accurate. But that's what happens in a quarter, right? Those are the kinds of moves that can happen, the sequential impacts that you talked about and others. We -- I think you've accurately portrayed how they moved in the quarter, and we continue to make decisions that are longer focused than that and we think are the right decisions, and these things sort themselves out in more than 90 days sometimes. So we'll continue to make those calls. And we believe that at a 15.1% ROE with all those things going your way, that's still a pretty attractive return in terms of on ROE, and I would say it's also a pretty strong return when you consider that we're sitting on a 12.9 Common Equity Tier 1 ratio. So it's a well-capitalized franchise that can still generate pretty strong returns.",neutral,0.3678,0.0202,0.612
0,Operator,,We'll take our next question from Gerard Cassidy with RBC.,neutral,0.0341,0.0258,0.9401
10,Gerard S. Cassidy,,"Biff, can you -- you just talked about that Visa differential in the quarter being $5 million greater this quarter. What was the total amount of the Visa mark in the other income this quarter?",neutral,0.048,0.1124,0.8396
