Speaker ID,Speaker Name,Speaker Company,Text,Sentiment Label,Positive Score,Negative Score,Neutral Score
0,Operator,,[Operator Instructions] And I do have a question from Steven Chubak with Wolfe Research.,neutral,0.061,0.028,0.911
44,Hang Leung,,This is actually Sharon Leung calling in for Steven. Just a question on deposit betas. They came in a little bit better than expected this quarter. Can you help us understand how to think about the incremental betas from here?,neutral,0.1055,0.0192,0.8753
37,Jason Jerrome Tyler,,"Sure. So betas have continued to increase. And from here, I think we still have to separate the institutional client base health client base. we noted that we're cumulatively across the platform within this quarter in the high 80% range. The institutional channel is likely going to be at 100% at this point. The wealth channel still provides some benefit. There's -- the betas there are a lot lower. But at this point, we're seeing about 100% in the institutional channel and still much less than that and well. And that seems to those -- both of those trends seem to be continuing as what we've seen early signs in the quarter.",positive,0.4251,0.2852,0.2897
44,Hang Leung,,"Great. And then as a follow-up, noted you're at about 17% noninterest-bearing deposits today. I think you had trough closer to about 15% in the '04, '06 cycle. Can you help us think through where that potentially goes from here? And once that starts to normalize where you see NII exiting the year?",neutral,0.152,0.0247,0.8233
37,Jason Jerrome Tyler,,"Sure. Well, like you, we've looked back a lot at where it's troughed. And the data we have showed it a little higher than the 15%. You mentioned, I think it's 16%. But I don't think about that as a floor. There's nothing structural in the base to consider that a floor. Now that said, it has been moderating significantly. And we don't see -- we haven't seen much movement at this point. Obviously, there's a step down this quarter of another percentage point, but it seems to be leveling off at this point.",negative,0.1534,0.6276,0.2191
0,Operator,,Next question comes from Alex Blostein from Goldman Sachs.,neutral,0.0295,0.0542,0.9164
4,Alexander Blostein,,"So a couple of questions around expense trends. I guess, one, a little bit more near term. You guys announced some action, obviously, over the course of the quarter, there's a severance charge. So maybe help us quantify what it means in terms of savings and your just updated views on the overall sort of firm-wide expense growth for the year, I guess excluding the charges occurred in the second quarter. I think last time you talked about bringing that down to below 7%, but maybe an update there would be helpful. And then a bigger picture question. You guys are running at a kind of high 20-ish percent pretax margin that used to be north of 30%. So as you kind of think about the fee environment getting a little bit better with the market, but NII has clearly peaked, as we talked about before, is there an opportunity to get back to that 30% plus? And how do you see sort of achieving that, if that's the goal? And what's the time frame around that?",neutral,0.1478,0.042,0.8103
37,Jason Jerrome Tyler,,"Sure. So let me tackle the expense. The compensation related first. First, I'm sure people are curious, where is the base from here. So let me just provide some background on kind of first quarter to second quarter, second quarter to third quarter. I think from here, we'd say flat to down from second quarter ex the severance charge in the compensation line. So if I go back to last quarter, we explained that the significant movements for second quarter would be the $40 million seasonal decline in equity awards and then the $20 million increase in the base pay coming online. That would have put comp at about $575 million for the quarter. And obviously, ex the charge, we ended up about $8 million better than that, including currency. 
So 2 factors led to that. First, we pulled a lot of levers in the quarter to flatten compensation, including accelerating and close to completing the actions that we launched in fourth quarter of last year. So in January, we communicated that the projected reduction by late '23 would be about 300 roles. And about $5 million to $7 million in quarterly comp benefit net of reinvestments. So we got a portion of that work done in the first quarter, and we mostly finished it in second quarter, and that was a big part of the reason it put us ahead of schedule. Second, as we saw the timing of that first program, accelerating and coming to completion, we launched a new effort during the second quarter, specifically related to what you referenced, Alex, and the severance charge that we announced this morning. 
We've already gotten some benefit of that within the quarter, and that's reflected in the results. So overall, this new program, to your question, should impact about an incremental 600 roles many of that will be backfilled based on a lens of skills or geography, but same goal, we should be able to get $5 million to $7 million a quarter in run rate savings and a portion of that got embedded in the second quarter. So we've got to remember that we did pull the lever hard this quarter, so there's some hiring that's in the queue, but we also pushed a fair amount back. And so that's why with various puts and starts, it's good to think about a flat to down from the comp levels you see in second quarter ex charges going into third quarter. So that's hopefully helpful background there. 
To get to your questions on -- for the rest of the year, where do we see expenses -- at a high level, we've taken about a point out of the curve for the year based on the trajectory that we're on. If you take out -- to your point, if you take out the notable items, this year on each quarter has been under 6%, and we think we've taken that point out of the curve at this point and that should continue through the rest of the year. 
To margins, you're right that we -- we've been in the 30s and had -- and now in the 20s, our target has us one of our key performance indicators is for us to be in the 30s. And no way have we lost sight on that. That is where we're trying to get. That gets impacted largely by what's going to happen in our minds, we can control the expense side. And obviously, we're doing a lot of work there. And we're also getting good benefit because we saw good organic growth in the quarter. And so both levers are working in the right way, but we have definitely not changed our target of being in the 30s from a margin perspective.",neutral,0.2845,0.1599,0.5556
4,Alexander Blostein,,"Got it. Super comprehensive. Just a quick follow-up around deposits. So good news, you guys were kind of in line with what you updated us on around $105 billion. sounds like deposits are fairly stable. I think you said $106 billion right now with a kind of similar noninterest-bearing mix as we saw over the course of the quarter. Can you help just frame the seasonal deposit outflows and any other kind of client conversations you're hearing that could give us a sense where deposits could ultimately trough in the cycle. It sounds like there's a little bit more to go, but just curious to hear what the endpoint might be?",neutral,0.1216,0.0732,0.8052
37,Jason Jerrome Tyler,,"Yes, you heard right. It's held in quite well so far in July. And we didn't -- June, you see the end of the quarter and there's a spike there. But in general, June and July have been at about this level and have been holding in well. Our client activity is good. We've taken action here to make sure we're talking to clients aggressively and telling them we want to continue providing good liquidity services for them, whether it's lending or holding on to their deposits. But we've got -- we talked last quarter about the fact that we think about liquidity broadly. It's about client liquidity. And it was good to see money market funds up this quarter. That adds to margins really well, too. And even as we think about what clients are holding in brokerage. And so all of the client liquidity seems to be holding in well. 
On the seasonality dynamic, August is a low point but it's not -- it doesn't go dramatically, we've looked back several years. And so we're feeling that deposits at these levels seems to be holding in okay. So I can even give a little bit of thought from our perspective at this point, based on our outlook, I think it's prudent to think about another decline, even though deposits are holding in pretty well, but we see the competition. And so I think it's prudent to think about another NII decline of about 5% for the quarter. Again, June and July volumes have held in at about $100 billion to $110 billion, but we just have to be conscious of the competitive environment and what the summer tends to hold in terms of volume pressure.",negative,0.279,0.5023,0.2187
0,Operator,,Our next question is going to come from Brian Bedell from Deutsche Bank.,neutral,0.0386,0.0274,0.9339
7,Brian Bertram Bedell,,"Maybe just to go back to expenses. I appreciate the color you gave, Jason. Normally start to talk about the seasonal lift that you typically get in the second half in things like equipment and software and outside services. I wonder if you want to comment on any projection there?",neutral,0.0682,0.0463,0.8856
37,Jason Jerrome Tyler,,"Sure. Well, it's good to call it out. I think in equipment and software, in particular, we were better than what we thought we were going to be, but that was really 2 factors led to that. One, we did have some delays in projects coming from WIP into being depreciated. Those will come online, so that's more timing. And then secondly, we've been working very aggressively as far as the productivity office to just negotiate on and then try and push inflation down, and we had some good results there, bringing costs down. And so from here, we think third quarter up $5 million to $10 million in that line item. Fourth quarter, we can even tell because some of it's baked an additional $5 million to $10 million lift from that perspective and outside services, not no update to make there.",positive,0.7246,0.0994,0.1759
7,Brian Bertram Bedell,,"Okay. Great. And then, Mike, you started off the call talking about the new business wins in asset servicing and wealth management. I guess how should we think about that contributing to organic revenue growth? Maybe just broadly, if we're in a, say, a flat -- flattish market situation, would you expect this to have a positive impact in the next couple of quarters and going to '24 on revenue?",neutral,0.3174,0.0211,0.6615
42,Michael Gerard O’Grady,,"Yes, Brian. So the answer is yes. And to your point, we only consider it organic growth once it's transitioned and in. And yet we know the pipeline of business or mandates that we've won that have not transitioned in yet. And in each of the businesses, it's a little bit different. There's more of a, I'll call it, forward pipeline with asset servicing, but the pipeline looks very good based on recent activity that I mentioned there. Within Wealth Management, there's not as much of a forward pipeline, if you will. But similarly there, I would say very steady, steady activity. And as much as anything with wealth management, keeping in mind that this -- I'll say, company, but also that business has been built on doing what's right for the client. And sometimes, that results in different financial implications for the company, but over time is best for the company and the shareholders. And my point being the discussion around deposits and money market funds and treasuries and managing things like that. They all have different implications for us, but the client activity has been very good. 
And we're, I would say, optimistic about how some of the shifts with rates will have implications on where those funds get redeployed. So again, positive on the wealth management front in a steady fashion. And then Asset Management, as Jason mentioned, we've seen strong flows into the money market platform there. but that also in some other areas as well. And likewise, I like to see those get redeployed in other ways over time. So good across the board.",neutral,0.3005,0.0255,0.674
7,Brian Bertram Bedell,,Is it fair to say that revenue growth on the fee side is definitely better than the NII side for the organic growth equation at least now.,positive,0.9309,0.0118,0.0573
42,Michael Gerard O’Grady,,"Yes. No, that's right, Brian. And I view it as you're kind of implying there. On the fee side, it tends to kind of grind up more gradually subject to the markets. and NII can be more volatile. And the only other area I would just highlight is around our capital markets activity, FX and brokerage and trading there, which has been relatively subdued during this time period with lower volatilities, lower activity, which that can also change and that has different implications to just meaning those can be more profitable.",neutral,0.0877,0.1293,0.783
0,Operator,,"And Robert [ Bradchao ] from Wells Fargo. 
Unknown Analyst 
I guess the first question is on fee growth kind of more broadly. You sort of indicated that you're the 5% expense growth rate. Does that go down? But do the fees -- where do you see fees growing to get up to that expense level so that you could grow fees faster than expenses?",neutral,0.0753,0.0568,0.8678
37,Jason Jerrome Tyler,,"Well, I mean, in the short run, I think we're still -- I don't think we're still absorbing an inflationary environment from an expense perspective. And so would like to be able to do better even than what we're doing right now in the long run from an expense growth perspective. 
On the revenue side, as you know, the lift -- the financial model enables us to have lift from 2 different areas. One is the market left, and that's tended to provide low single-digit growth rates, but it's a very strong component of the financial model. And then secondly, the organic growth. And if we can have low single-digit growth in wealth management organically and then mid-single-digit growth in asset servicing, that provides a good model for us to get well above the expense rates that we think we can lead to in the long run and provide good operating leverage. 
Unknown Analyst 
Okay. And if I could follow up on wealth. You've improved growth there as well. Are there any differences in the competitive dynamic among the top end and the low end? Are you having more success you're having more success in Global Family Office. I guess can you talk about the funnel, new clients sort of in the middle tier and what you're doing to grow that?",neutral,0.4243,0.0128,0.5629
37,Jason Jerrome Tyler,,"Yes. It's interesting. It's actually not just the family office the very top end of wealth advisory and those clients can be similar size. They just happen to not have a family office and are leaning more toward us for wealth advice as opposed to the broader set of more operational and reporting services that the Global Family Office provides, we are doing better at the top end. And looking at the new business that came on board and at the pipeline, the accounts above $20 million, just that was where there was more velocity. And that's been consistent for a while on that business. And so there is something to that dynamic, we seem to be doing better at the top end. That's where a disproportionate percentage of the growth has come from.",neutral,0.3271,0.0213,0.6516
0,Operator,,Our next question is going to come from Brennan Hawken from UBS.,neutral,0.036,0.0323,0.9317
6,Brennan Hawken,,"Just a quick clarification point. Jason, you referenced a point of expense benefit. Is it right to interpret that as coming off of your prior 7% or better expectation or was that meant in a different way?",neutral,0.0571,0.1009,0.842
37,Jason Jerrome Tyler,,"It is correct to interpret that as saying we don't see at this point. We've said 7% or better. And at this point, we should be doing 6% or better. We've done that first half, and we see a path to that in the second half as well.",positive,0.6417,0.0287,0.3296
6,Brennan Hawken,,"Perfect. And then -- sure -- you guys had a write-off of a client capability. I don't remember seeing that in the past, just a little confusing to me. So maybe if you can help me understand it. When did you build that capability and then what happened that caused you to write it off?",neutral,0.0501,0.3766,0.5733
37,Jason Jerrome Tyler,,"Yes, I can give you some thoughts on it. Just from a timing perspective, it's been in the works for many quarters. But one of the pillars of the productivity office is to look at what we refer to as internal investments to ensure that they're on track to meet our hurdle rates or returns and margins. The charge was a project to build out a new client capability in asset servicing, specifically in the asset owners channel. So after working and eventually discussing with different stakeholders, we didn't reach commercial agreement on terms that would meet our hurdles. And so we halted the project. I think it's importantly, I'd presume you'd ask, are there others like this in inventory, absolutely not. We don't -- this is a large project endeavor that we've been working on and didn't reach resolution that got to our hurdle rates and so stop the project.",neutral,0.0738,0.1653,0.7608
6,Brennan Hawken,,"Okay. Did something happen in the sort of like revenue opportunity that diminished it versus where you planned? Because I'm sure you guys went through the process before you broke ground, so to speak, at least metaphorically. Or was it that it was really pricey turned out to be more expensive to build. Was it the expense side that hurt the outlook versus plan? Or was it the revenue opportunity?",neutral,0.0682,0.4617,0.47
37,Jason Jerrome Tyler,,"Yes. Well, it was more costly to build than we thought, and the revenue dynamics were not at that point, going to get to our hurdle rate. And this -- it really is reflective of us taking an extremely disciplined approach on items like this where we're not going to devote resources to areas where we're not going to achieve our hurdle rate. And so well before we talked about this, even internally, one of the pillars that we talked about for the productivity office was looking at our internal investments. And this fits squarely in one of those areas. We define that as areas where we're allocating resources, whether it's capital or expense dollars, and we're not at our hurdle rate. And so this is one where we were disciplined in saying we're going to stop now, halt it and not make -- not invest more into this.",neutral,0.0644,0.0501,0.8855
6,Brennan Hawken,,"Jason, it's actually a lot more encouraging than that I interpreted it on paper.",neutral,0.1934,0.0249,0.7817
37,Jason Jerrome Tyler,,"No, thanks for asking. It probably is help for you to clarify. It's helpful to other. So thank you.",neutral,0.2031,0.0116,0.7853
22,Robert Henry Wildhack,,"Just a bigger picture question on expenses. Where do you want or what's your target, I guess, for that expense-to-trust ratio over the long run? And then what are the sort of necessary ingredients to get there?",neutral,0.0467,0.0266,0.9267
37,Jason Jerrome Tyler,,"Yes. If we can be in the 110% to 110% range, then that's 105% to 110%, then we feel like we're in good shape to do well. And we're grinding to get down there. We got down there before. We've been well above it. We got down into that range, in fact, even slightly below it for a quarter or 2. And now all the factors we've talked about, higher inflation, markets coming down, and the effects of NII going up not helping that metric, we're outside that range, but it is an important part of our financial model to be in that range. And so we're -- it's the first thing I look at is where are we. And it's good to see us getting back toward the number that we -- the range that we've articulated. It's another one of the key performance indicators that we talk about internally.",neutral,0.3222,0.1059,0.5718
22,Robert Henry Wildhack,,"Got it. And just one follow-up on the positive organic growth commentary this morning. If you saw a big acceleration in organic growth or a sustained period of strong organic growth, multiple quarters even several years. How do you think that would impact expense growth, if at all?",neutral,0.0671,0.0339,0.899
42,Michael Gerard O’Grady,,"Yes. So Rob, your 2 questions relate to each other, which is the primary way that we can drive that ratio to the range that Jason talked about is through organic growth on the fee side and then controlling organic expenses, all right? And to your point, if you have higher organic growth, that is going to require more resources. And to the extent that you don't achieve that, then you have to make sure that you're reducing the organic growth on the expense side to get there. But those are the 2 areas that we control the most. And then you say, okay, but beyond that, as Jason mentioned, on the fee side, it's going to have the impact of markets and sometimes currency. And on the expense side, you're going to have the impact from inflation and to some extent, currency. And so try to focus on what you can control the most, which are those 2 items, organic growth on fees and organic growth on expenses to ultimately drive it to the target range.",neutral,0.0951,0.0209,0.8839
0,Operator,,And Betsy Graseck from Morgan Stanley is next.,neutral,0.0331,0.0299,0.937
43,Connell J. Schmitz,,"This is actually Connell Schmitz filling in for Betsy. So just 1 question, a little bit nuanced on the credit portfolio. It seems like a little bit of an outlier. I know it's small, but on the reserve release, it seems like an outlier that there's an improved outlook on your CRE book. Can you just explain what's going on there and where you see this line item from here?",neutral,0.1245,0.028,0.8475
37,Jason Jerrome Tyler,,"Yes. So actually, the -- just to clarify, there was the release, the release as a result of some improvements in a small number of borrowers in that book. But that more than offset an actually worsening outlook that we have overall for CRE. And so -- and it's not dramatic, but the -- our outlook on that portion of the book actually would have caused an increase in the reserve.",positive,0.5181,0.4157,0.0662
43,Connell J. Schmitz,,"Got it. Okay. That makes more sense. I guess one other question on the investment portfolio. You mentioned the duration still sub 1 year and you're mostly in cash. At what point just given the context of potential future rate hikes, where do you see like this duration heading in the coming months? And how are you planning to mix shift this book in that context to protect NII? Yes.",neutral,0.0602,0.023,0.9167
37,Jason Jerrome Tyler,,"Yes, absolutely. So the duration of the securities book is it to one, the duration of the balance sheet is just under 1%. And you're absolutely right to call out that this is -- it is an interesting time in what we think was the evolution of the of the yield curve. And so we've been allowing the maturity of securities to go -- to become more liquid as we reinvest them, that's brought down duration at this point with the yield curve, we are talking about where to go from here. That's not indicating it's going to go up. But it's not on a -- at this point, we are thinking about where is the yield curve, where is it going? And how does that influence what we want to do as the large securities book continues to mature and provide opportunity for reinvestment.",neutral,0.082,0.0364,0.8816
43,Connell J. Schmitz,,Okay. And then I guess one follow-up on that same topic. How should we think about earning asset growth in the context of deposit outflows potentially should those flow out on a one-to-one basis? Or will you maintain certain balance sheet size or...,neutral,0.0869,0.0137,0.8994
37,Jason Jerrome Tyler,,"Yes. Our -- as deposits come down, the securities can act as obviously, the funding mechanisms for it. It doesn't -- that doesn't move very quickly. And so the deposit size is always going to influence the earning asset size. And -- so what we have to then think about the constraining factor at that point becomes what does leverage look like. And we've got a lot of room from a leverage perspective. And so that's what sometimes will lead us to think about discretionary leveraging just to make sure that we're not missing opportunities to pick up some NII even if it's a very thin NIM based on where the size of the balance sheet is because it doesn't flex super quickly.",neutral,0.0534,0.0448,0.9018
0,Operator,,And our next question is going to come from Mike Brown from KBW.,neutral,0.0522,0.0251,0.9227
25,Michael C. Brown,,"Maybe just actually following up on that question there. We noticed that the complexion of your balance sheet has been shifting on the funding side, naturally, and that makes sense. But your deposits, they declined by 6%, but we saw that the higher cost Fed fund purchased balance actually jumped meaningfully quarter-over-quarter has been growing this year. I guess, why not just let the balance sheet decline more? Like what's kind of going on there in terms of the mix? And how could that progress from here should -- if the deposits continue to trend down. As you talked about, will that balance -- the Fed funds purchase balance continue to grow as an offset to fund the assets.",negative,0.324,0.3785,0.2974
