Speaker ID,Speaker Name,Speaker Company,Text,Sentiment Label,Positive Score,Negative Score,Neutral Score
0,Operator,,[Operator Instructions] Our first question is coming from Glenn Schorr with Evercore.,neutral,0.0457,0.0278,0.9265
11,Glenn Paul Schorr,,"I guess my question is on organic growth. I heard a lot of commentary throughout your 18 minutes of prepared remarks. On positive net flows, across most parts of the business. I think in your prepared remarks, I heard you talk about ESG mandates within asset management, but maybe you could cover whether you quantify or qualify, I'll take either one, where you're seeing new business, what kind of business you're winning in asset servicing? And has there been any pandemic-related pause that is now freeing up a lot, Jim. So any color on that would be great?",neutral,0.148,0.0128,0.8392
37,Jason Jerrome Tyler,,"Yes. Mike, do you want to start on it?",neutral,0.0326,0.0364,0.9311
38,Michael G. O’Grady,,"Sure. So Glenn, as you described there, we are seeing strong organic growth across the company and specifically in asset servicing. And I would say the first place I would start, the foundation of our growth strategy is retaining existing clients. And as you would imagine, going through the pandemic, being able to support clients has been extremely important, but also, I think, earned us the right, if you will, to continue to serve our clients, many of them are largest clients. So that's been a big positive. 
Second, I would say is that we have seen, I would say, a full return to marketplace activity. So our clients, both asset owners and asset managers are actively looking at their own operating models and looking for opportunities either to become more effective in how they invest on behalf of their beneficiaries or improving the efficiency of the way they do that. So consolidating operations or providers, utilizing new technology, and that has played very well into our strategies in asset servicing that we've had underway for years. So thinking about things like front-office solutions, which is an investment book of record for clients that have high levels of alternative assets, the ability to look at across their portfolio in order to manage their business. And then thinking about our asset manager clients, our whole office strategy is definitely resonating as well where we can provide services across front, middle and back office. So high level of activity. And then I would say, success with strategies we've had in place for some time period.",positive,0.8147,0.0117,0.1737
11,Glenn Paul Schorr,,"Appreciate that. Maybe just the last follow-up on net interest income. The NIM was down 5%, but deposits were up a ton. Do you feel net interest income has now finally bottomed and maybe some backup of your thoughts behind that in terms of redeployment opportunities?",negative,0.2067,0.5502,0.2431
37,Jason Jerrome Tyler,,"I don't want to call a bottom on it. I mean, if you unpack the quarter effectively, we saw loan growth that was strong and up $1 billion, and that has a few million dollar impact if you take our average return on those assets. If you think anywhere from 175 to 200 basis points on that $1 billion, you're going to get $4 million or $5 million in lift for the quarter. And then you also had obviously a lift from the deposits overall, but that's offset by something that's more predictable going forward, which is we're still going to have reinvestment in -- as the security book continues to mature. And that's still got some maturation to do. And so it's easier to predict what's going to happen on the reinvestment side than what's going to happen on the loan side. But obviously, if we continue to see strong loan demand, then that's more important than what we're seeing on the other components of volume.",neutral,0.3321,0.0467,0.6212
0,Operator,,Our next question comes from Mike Mayo with Wells Fargo.,neutral,0.0373,0.0369,0.9257
18,Michael Lawrence Mayo,,"I see at your annual meeting today, a 2021 priority is productivity. So I was wondering if you could put some metrics around what you'd like to achieve? And on the positive side, I see the headcount is down 1% quarter-over-quarter. The pretax margin in the first quarter is back to the 30s, where it was not last year at all. But on the negative side, I have to imagine the fee waivers will continue and might actually increase. So where does it all end up? And where would you like to get to this year?",negative,0.0571,0.8287,0.1142
37,Jason Jerrome Tyler,,"Yes. Let me take that in a few different buckets. You're right. The productivity is extraordinarily important. And we go and we scratch and call and do everything we can to earn new business. That's hard to do. It's not overly predictable. But what we can do is exhibit extreme discipline on the productivity side. And so we haven't put external metrics to that, but we're looking at it a lot of different ways internally. We look at operating leverage, which we talked about earlier, we look at fee operating leverage. And internally, we're able to look at organic trust fee operating leverage. And so from our perspective, we want to see -- we don't want to just call expenses up or down because a lot of our business relate -- a lot of our expenses relates to the amount of new business that's coming in. And if we continue to show growth in the different areas of the business, we're going to see lift in those expenses. We just want to make sure it's related in the proper way to the organic growth that's coming in. Now you're right, headcount was down. And that comes back to the initiatives that we talked about in January. And so you see it's a meaningful reduction for us of about 300 headcount and that played through in lower salary expense for the company. And so that's -- those are meaningful movements and I think reflective of the discipline and the commitment we have around expense management. And then on fee waivers, you're right, it's -- that is a -- it's a very, very difficult dynamic that we're facing. And I also think people need to realize, we've talked about the fact that the $50 million we have this quarter, we're still seeing lower rates on the short end of the curve. And as much as we've seen the 1-year, 5-year, 10-year up, we've seen overnight repo at 0 and 1, and that's very difficult for a $275 billion pool of money market funds. And that's why we've tried to give consistent information, not guidance, but a consistent run rate on how those fee waivers are going. And as we sit right now, that number looks more like $65 million to $70 million on a quarterly run rate basis. Hopefully, as the Fed balance sheet changes, we see some improvement there, but that's where we sit today. And so it's something we have to monitor. And obviously, it has a big impact on the pretax margin you identified.",neutral,0.1421,0.232,0.626
18,Michael Lawrence Mayo,,"And then the one tailwind you have, I guess, the higher asset values. Can you remind us of the relationship between every change in the stock market and your fees?",neutral,0.0475,0.0483,0.9043
37,Jason Jerrome Tyler,,"Sure. It's going to -- it varies by the area of the business that you're talking about. In general, 60% -- in C&IS about 60% are based on asset values in some ways. And then in wealth, you can split it even more. And Mark, you might have those numbers close or off the top of your head, but it's...",neutral,0.0435,0.0363,0.9202
34,Mark M. Bette,,"Right. Yes, the 60% in C&IS is related to asset values, which would be all asset values, equity assets as well as fixed income or cash. And then as we look across, in wealth management, there is more of a relationship there to the assets. But the equity sensitivity, if that's what you're looking at, is a little different. And the regions, the equity sensitivity is probably 50% to 55%, whereas when you get to the Global Family Office, there the equity sensitivity is probably closer to 1/3 just because of the way the clients' assets are allocated.",neutral,0.0618,0.0314,0.9069
0,Operator,,We will now go to Brennan Hawken with UBS.,neutral,0.0403,0.0134,0.9463
6,Brennan Hawken,,"So first on the balance sheet growth here. Quite robust deposit growth. It was a pretty significant inflection from how things were trending in the back half of last year. And so curious about your thoughts there? How much of this do you view as excess? It seems as though a lot of the central bank deposits on the asset side went up, which would imply that you might think this is -- these are short duration deposits. So if you could give maybe some color on what your expectations are for the sustainability of this growth in deposits and how you might be thinking about redeploying those deposits over time? And how much time do you need in order to do that?",neutral,0.123,0.0382,0.8387
37,Jason Jerrome Tyler,,"Sure. So you're right. I mean, total interest-related deposits up, interest-bearing deposits up. And I think the good news is that interestingly, we were able to hold on to the margin. You saw a decline in LIBOR. And even in that book, we also saw a decline in cost. And despite the fact that part of the book is below 0. And I think that's meaningful. To get to your question about volume levels and the nature of the deposits, there's no doubt a lot of those deposits are nonoperational. And so we need to let them season before we would do much beyond putting those at central banks. That said, there are other things we can do because we've got capacity in the balance sheet. But obviously, the nature of how we run the treasury book is to let those types of deposits, the ones that are more institutional and might be more transitional season before we would take longer-term exposure on those.",neutral,0.2467,0.1006,0.6528
6,Brennan Hawken,,"Okay. All right. I appreciate that. And then when we think about -- I think you had had commented, Jason, in response to Glenn's question about that really, when you think about NII, it's a foot racing between loan growth and reinvestment rates. Your loan growth picked up a bit here this quarter versus the trend of the back half of last year. But period end, not necessarily all that higher than the average. So how should we think about loan growth from here? What are you seeing as far as demand for loans amongst your clients? And is the rate for that loan book still -- are we still better off looking at the 1-month and 3-month LIBORs to think about those rates?",neutral,0.1513,0.0722,0.7765
37,Jason Jerrome Tyler,,"Sure. So first of all, the loan growth has come almost exclusively or the vast, vast majority has come from the wealth management side of the business. And even though in dollars, it's not as big as the deposits, the impact is much more meaningful. And having $1 billion in higher average deposits, that's quite meaningful for NII, and we've talked very consistently about the fact that the deposit levels are interesting. They're chunky, but don't really do too much on NII. It is difficult to predict what the loan demand will be. However, what we've experienced isn't simply, I'd say, random. We've talked about the fact that we have been communicating with clients more aggressively. And this is over the last 1.5 years, 2 years, about our desire to be with them and be a liquidity provider for them. 
Our liquidity engagement with clients is it's a big part of our business. And that shows up not just in what we do with the balance sheet on deposits, but also money market funds where again, $275 billion in AUM there and also on the lending side, particularly on the wealth management clients. And so it's more -- this has been, I think, more of a strategic lift and -- so that's not predictive that it's going to hold on or continue to accelerate, but we don't see it as something that we're dismissing is potentially random either.",neutral,0.1253,0.026,0.8487
0,Operator,,We will now go to Alex Blostein with Goldman Sachs.,neutral,0.0361,0.0149,0.949
4,Alexander Blostein,,"I want to shift gears a little bit, maybe talk about capital a little bit, and obviously and continue to be in very strong position across all the key ratios. Can you guys remind us or kind of how you think about the binding constraints for Northern Trust, obviously, relative to regulatory minimums, that's not kind of how you said the bar. You typically look at your peers. So given some of the changes that they have made and kind of how they're thinking about sort of the minimum levels they're willing to run with, how does that inform your view of excess capital at Northern Trust? And then ultimately, how does that translate into your appetite for increased buybacks from here?",neutral,0.1032,0.0162,0.8806
37,Jason Jerrome Tyler,,"Sure. So you're right that it's less of a -- for us, it's less of an algebraic calculation and more where we want to be on a relative basis. At this point -- you guys have heard us talk consistently about -- thinking about our engagement with the Board where we're totally aligned, but we want to make sure that, that conversation continues to take place where we are on an absolute basis, how we think about things on a relative basis and how we think about things from a regulatory perspective. 
And right now, I'd say, just keeping an eye on what the industry is doing is important. So the absolute level, less so, we got plenty of room, obviously, from a CET1 perspective, sitting at 12%, given where the regulatory minimum are. And so if you think about Tier 1 leverage, even though the industry has talked about coming down significantly, we're -- we've still printed well into the 6s. And that's on a $125 billion average deposit base. So I'm not going to -- I'm not giving you our buffers here, but just take a 5% number just to get at your question on about what our capacity would look like. If you came all the way down to 5, that would translate to a balance sheet of about $200 billion, and you could have $170 billion in deposits, all else equal on the balance sheet today. And so you're talking about easily $40 billion on a base of 125 currently. And so that's a lot of room. And I think also importantly, it's not like we use the balance sheet for clients that for organizations we don't know. We're really dealing from a candidate pool of depositors that are existing clients. And so at this point, we feel good about the capacity we have, but it's obviously something that we're watching, given how dramatically things can change given Fed actions and where deposits were 15 months ago.",neutral,0.0774,0.0433,0.8794
4,Alexander Blostein,,Right. I guess I was trying to get more to the capital return framework of kind how you guys are thinking about the opportunity for share repurchases from here given the access capital that you've outlined?,neutral,0.0737,0.0173,0.909
37,Jason Jerrome Tyler,,"Thanks for clarifying. Let me tackle that directly. It's interesting because this quarter is a great example of how -- we don't just think about do we buy back stock or not. There are different ways we can invest capital. And that 10% to 15% return target, it comes up in everything we do from a capital perspective, including using the balance sheet to help clients. And so this quarter, you saw the capital levels come down not because there was a meaningful decline in CET1, but because there is more activity in -- from a client perspective, and that showed up with an increase in RWA on the denominator. And we saw higher sec lending activity. We saw higher lending activity and we saw higher treasury activity in the form of more bond buying, muni purchases. In each of those areas, we're thinking about what's the best way to use our balance sheet in the long run and what's the best way to think about return. And for us, we can think about the returns of buying back $1 of stock. We're looking at everything from what we think our returns are going to be there, what's -- what are we getting in terms of price to book. We're also looking at the desire to be there with clients and what those returns will look like. And when we have the ability to think about lending or expanding C&IS relationships with the other things I mentioned, those things come up as very attractive ways for us to use capital. It turns into better -- it turns into good growth for us in the long run and good use of capital.",neutral,0.3227,0.2291,0.4482
4,Alexander Blostein,,"Got it. Great. That makes sense. And then just a quick follow-up around NIR again. So I think, Jason, in the past, I think we talked a little bit about some sensitivities to sort of the repricing dynamics in the securities portfolio. Maybe refresh us where that sort of stands today? So securities portfolio yield, I think, is about 120 or so. If you look at rates where they are today, I want to say most of the securities portfolio is already repriced lower, but holding current rates constant sort of how much more of a drag on the securities yield do you guys expect to see over the next couple of quarters?",negative,0.0588,0.5698,0.3714
37,Jason Jerrome Tyler,,"Yes. Well, to give you a sense of what's repriced at this point, obviously, just take -- if you look at the $150 billion in earning assets, obviously, all of the money market assets have repriced, 85% of the loan book is repriced. It's $60 billion of the securities. So about 63% of the securities book has repriced at this point. So that's where we sit at this point. And then it's interesting, if you think about what's the impact of that, I'll tell you, in this quarter alone, it was a significant impact. We actually had, if you -- just from securities portfolio, NIR was down $10 million. And so that was the drain on it. But that's not -- I don't want you to think about that as a pure run rate because we're thinking there about what's happening with the loan book and so there are other factors to play in as we're reinvesting those securities. But I want to at least start with giving you the numbers that you asked for in terms of how much is repriced and then also what the implications are. But the runoff is coming through at this point. And also the fact that the 1, 2, 3, 5 year where we tend to be reinvesting has come up, that has brought down the influence on a quarter-over-quarter basis as well.",neutral,0.0551,0.3921,0.5528
0,Operator,,We will now go to Brian Bedell with Deutsche Bank.,neutral,0.0352,0.0165,0.9483
7,Brian Bertram Bedell,,"If I can start off with maybe one of the loan book, Jason, just -- the comment you made on the 85% of the loan book has repriced. It looks like that yield has at least for the last couple of quarters now bottomed and it's starting to move back up. So my question would be around of the 15% that's repricing, sort of what are the dynamics on that versus maybe what are some of the new loans that you're bringing on that's helping improve that yield? And then longer term, most of that is tied to LIBOR. Maybe just talk about the plan of whether some of those loans are going to use in new reference rate given the planned station of LIBOR and how you're thinking about that?",neutral,0.0839,0.0875,0.8285
37,Jason Jerrome Tyler,,"Sure. So the longer-dated loans are -- often it's going to be in the mortgage book. And so that's what's going to take longer effectively, just so you know. The loans that have come on disproportionately, the growth has come, again, within wealth, but within personal loans and within some of our more corporate-based organizations, we do have a lot of corporate -- there's small and midsized business activity in that book, and that's where a lot of the growth has been. And then in terms of the LIBOR transition, yes, as you know, and I'm sure you're covering really closely, Brian, there'll be a transition in most -- the industry seems to be looking to move from LIBOR to SOFR as a reference rate. And so watching that and the implications of it.",neutral,0.0723,0.0228,0.9049
7,Brian Bertram Bedell,,"And is that transition to SOFR, I mean, I guess it's too early at this stage because there's not an effective term rate. But I mean, is there any -- or are you sensing any implication on the yield of the loan book by that transition? Or is it just simply too early?",neutral,0.0324,0.2595,0.7082
37,Jason Jerrome Tyler,,"Well, it's early, but we -- and I think the industry is hoping that they'll be -- once we get to those transition dates, they'll be more of a reset and we'll have the -- not just the reference rate changes, but the spread changes. And to reflect -- because, obviously, SOFR is different. There's not credit, there's not duration in it. And so it's a different rate. And the relationship between LIBOR and SOFR is a lot different today than what it was even a year ago. And so I think the industry has got some work to do to work on what the conversations are going to be like at the point where we actually make that hard switch.",neutral,0.0939,0.0358,0.8704
0,Operator,,Our next question comes from Steven Chubak with Wolfe Research.,neutral,0.04,0.0367,0.9233
27,Steven Joseph Chubak,,"So I had a couple of ticky-tack modeling question. The first is just on the non-asset sensitive fees within custody and fund administration. And we've had 2 pretty meaningful sequential increases these past 2 quarters. That line item exited the quarter at about $178 million versus what historically had been a pretty consistent range of $150 million to $160 million. I'm just curious what's driving the recent strength in that line item? And maybe just as we think about from a modeling perspective, what's the right jumping off point we should be thinking about as we look ahead to 2Q?",neutral,0.2211,0.0533,0.7257
34,Mark M. Bette,,"Yes. And just to make sure I'm tracking totally specific, you're talking about other noninterest income at $180 million on the income statement?",neutral,0.0271,0.0416,0.9312
27,Steven Joseph Chubak,,"It's actually the $178 million within custody and fund administration, but it's a non-asset sensitive fee portion. So that's the part that will presumably move around with that?",neutral,0.0325,0.0355,0.932
34,Mark M. Bette,,"Yes. So this is Mark. So you're referring to when we talk about the sensitivity of the -- of those fees at about 60% to 65% are asset sensitive, and then the rest are kind of either their mix. Quite frankly, there's transaction volumes within those. There are some flat fees or fixed fees or even account level fees. So you could maybe say roughly half of it is transaction volume related. So -- and we did see a pickup this quarter in those transaction volumes that created some of the sequential lift that we saw -- or 1% or so of the sequential lift that we saw. So I hope that is answering your question?",neutral,0.1696,0.0589,0.7715
27,Steven Joseph Chubak,,"Yes, yes, that's sufficient. So we should be expecting some normalization of that, presumably it could be higher than the $150 million to $160 million, but it sounds like the $178 million may have been a bit elevated and we could see some rebasing there. Is that fair?",positive,0.641,0.0542,0.3047
34,Mark M. Bette,,"Yes, that's probably fair. I don't necessarily have the numbers that you're doing because I don't have it on specifically like that. That's kind of a directional guide that moves around each quarter that split. But yes, I mean, we did -- we certainly saw heavier transaction activity during this most recent quarter that would have benefited those fees by a bit.",positive,0.7015,0.1719,0.1266
27,Steven Joseph Chubak,,"Okay. That's helpful color. And just for my follow-up on NII, actually, a bit more focused on the liability side. The beat was helped by continued grind down in those interest-bearing deposit costs. It's the second consecutive quarter where we've actually seen that come down. Just curious if you see any additional room to cut deposit costs further if the rate backdrop folds or has that lever been largely exhausted at this point?",negative,0.0702,0.8639,0.0659
37,Jason Jerrome Tyler,,"I felt decent about coming down a couple of basis points in that book. And I think it's reflective that a lot of that book is international. It's in currencies that are already used to having negative rates. And so the dynamic that we've talked about that once 0 is broken, there's an expectation that the beta will continue at that point seems to be playing through there. And so wouldn't necessary -- and we've talked to clients a lot about where rates are there because it obviously can be a sensitive topic. But I think the win there is we've got good dialogue with clients that indicate we're all looking at things like the euro the same way and tracking deposit costs. So we don't have further deterioration as the asset side compresses more.",neutral,0.218,0.2148,0.5672
0,Operator,,We will now go to Mike Carrier with Bank of America.,neutral,0.0407,0.013,0.9463
40,Michael Roger Carrier,,"Just a question on organic growth trends. You provided some good color on asset servicing in the loan book question. Just in investment management and particularly in wealth, are you starting to see improvement as COVID conditions improve versus last year? And how has the competitive backdrop changed given that it seems like everybody has been focused on that part of the business?",neutral,0.4273,0.0261,0.5466
